"index","collection","packageId","granuleId","title","detailsLink","pdfLink","pdfSize","htmlLink","htmlSize","xmlLink","xmlSize","otherLink1","other1Size","otherLink2","other2Size","teaser","historical","publishdate"
"157","Congressional Hearings","CHRG-117hhrg45370","CHRG-117hhrg45370","Building Back with Justice: Environmental Justice Is Central to the American Jobs Plan","https://www.govinfo.gov/app/details/CHRG-117hhrg45370/CHRG-117hhrg45370","https://www.govinfo.gov/content/pkg/CHRG-117hhrg45370/pdf/CHRG-117hhrg45370.pdf","266.0 KB","https://www.govinfo.gov/content/pkg/CHRG-117hhrg45370/html/CHRG-117hhrg45370.htm","201.1 KB","","0 B","","0 B","","0 B"," REPRESENTATIVES ONE HUNDRED SEVENTEENTH CONGRESS FIRST SESSION JULY 21, 2021 Serial No. 117-35 Printed for the use of the Committee on Oversight and Reform [GRAPHIC NOT AVAILABLE IN TIFF FORMAT] Available at: govinfo.gov, oversight.house.gov or docs.house.gov U.S. GOVERNMENT PUBLISHING OFFICE 45-370 PDF WASHINGTON : 2021 COMMITTEE ON OVERSIGHT AND...","","2021-07-21"
"158","Congressional Hearings","CHRG-117hhrg44861","CHRG-117hhrg44861","A Review of the President's Fiscal Year 2022 Budget Proposal for NASA","https://www.govinfo.gov/app/details/CHRG-117hhrg44861/CHRG-117hhrg44861","https://www.govinfo.gov/content/pkg/CHRG-117hhrg44861/pdf/CHRG-117hhrg44861.pdf","9.3 MB","https://www.govinfo.gov/content/pkg/CHRG-117hhrg44861/html/CHRG-117hhrg44861.htm","142.1 KB","","0 B","","0 B","","0 B","REPRESENTATIVES ONE HUNDRED SEVENTEENTH CONGRESS FIRST SESSION JUNE 23, 2021 Serial No. 117-21 Printed for the use of the Committee on Science, Space, and Technology [GRAPHIC NOT AVAILABLE IN TIFF FORMAT] Available via the World Wide Web: http://science.house.gov U.S. GOVERNMENT PUBLISHING OFFICE 44-861PDF WASHINGTON : 2022 COMMITTEE ON SCIENCE, ...","","2021-06-23"
"159","Congressional Hearings","CHRG-117hhrg45170","CHRG-117hhrg45170","Historic Protests in Cuba and the Crackdown on Free Expression","https://www.govinfo.gov/app/details/CHRG-117hhrg45170/CHRG-117hhrg45170","https://www.govinfo.gov/content/pkg/CHRG-117hhrg45170/pdf/CHRG-117hhrg45170.pdf","9.8 MB","https://www.govinfo.gov/content/pkg/CHRG-117hhrg45170/html/CHRG-117hhrg45170.htm","126.5 KB","","0 B","","0 B","","0 B"," INTERNATIONAL ECONOMIC POLICY OF THE COMMITTEE ON FOREIGN AFFAIRS HOUSE OF REPRESENTATIVES ONE HUNDRED SEVENTEENTH CONGRESS FIRST SESSION July 20, 2021 Serial No. 117-62 Printed for the use of the Committee on Foreign Affairs [GRAPHIC NOT AVAILABLE IN TIFF FORMAT] Available: http://www.foreignaffairs.house.gov/, http://docs.house.gov, or http://...","","2021-07-20"
"160","Congressional Hearings","CHRG-117hhrg45866","CHRG-117hhrg45866","Judicious Spending to Enable Success at the Office of Nuclear Energy","https://www.govinfo.gov/app/details/CHRG-117hhrg45866/CHRG-117hhrg45866","https://www.govinfo.gov/content/pkg/CHRG-117hhrg45866/pdf/CHRG-117hhrg45866.pdf","23.1 MB","https://www.govinfo.gov/content/pkg/CHRG-117hhrg45866/html/CHRG-117hhrg45866.htm","162.3 KB","","0 B","","0 B","","0 B"," ON ENERGY OF THE COMMITTEE ON SCIENCE, SPACE, AND TECHNOLOGY HOUSE OF REPRESENTATIVES ONE HUNDRED SEVENTEENTH CONGRESS FIRST SESSION OCTOBER 21, 2021 Serial No. 117-36 Printed for the use of the Committee on Science, Space, and Technology [GRAPHIC NOT AVAILABLE IN TIFF FORMAT] Available via the World Wide Web: http://science.house.gov U.S. ...","","2021-10-21"
"161","Congressional Hearings","CHRG-117shrg45490","CHRG-117shrg45490","Open Hearing: Nominations of Stacey A. Dixon to Be Principal Deputy Director of National Intelligence; Thomas A. Monheim to Be Inspector General of the Intelligence Community; and Matthew G. Olsen to Be Assistant Attorney General for National Security","https://www.govinfo.gov/app/details/CHRG-117shrg45490/CHRG-117shrg45490","https://www.govinfo.gov/content/pkg/CHRG-117shrg45490/pdf/CHRG-117shrg45490.pdf","17.6 MB","https://www.govinfo.gov/content/pkg/CHRG-117shrg45490/html/CHRG-117shrg45490.htm","89.7 KB","","0 B","","0 B","","0 B"," GENERAL OF THE INTELLIGENCE COMMUNITY; AND MATTHEW G. OLSEN TO BE ASSISTANT ATTORNEY GENERAL FOR NATIONAL SECURITY HEARING BEFORE THE SELECT COMMITTEE ON INTELLIGENCE OF THE UNITED STATES SENATE ONE HUNDRED SEVENTEENTH CONGRESS FIRST SESSION TUESDAY, JULY 20, 2021 Printed for the use of the Select Committee on Intelligence [GRAPHIC NOT AVAILABLE...","","2021-07-20"
"162","Congressional Hearings","CHRG-117hhrg47148","CHRG-117hhrg47148","Leading the Wireless Future: Securing American Network Technology","https://www.govinfo.gov/app/details/CHRG-117hhrg47148/CHRG-117hhrg47148","https://www.govinfo.gov/content/pkg/CHRG-117hhrg47148/pdf/CHRG-117hhrg47148.pdf","4.9 MB","https://www.govinfo.gov/content/pkg/CHRG-117hhrg47148/html/CHRG-117hhrg47148.htm","213.6 KB","","0 B","","0 B","","0 B"," ON ENERGY AND COMMERCE HOUSE OF REPRESENTATIVES ONE HUNDRED SEVENTEENTH CONGRESS FIRST SESSION APRIL 21, 2021 Serial No. 117-23 Published for the use of the Committee on Energy and Commerce govinfo.gov/committee/house-energy energycommerce.house.gov [GRAPHIC(S) NOT AVAILABLE IN TIFF FORMAT] ______ U.S. GOVERNMENT PUBLISHING OFFICE 47-148PDF ...","","2021-04-21"
"163","Congressional Hearings","CHRG-117shrg50802","CHRG-117shrg50802","Cryptocurrencies: What Are They Good For?","https://www.govinfo.gov/app/details/CHRG-117shrg50802/CHRG-117shrg50802","https://www.govinfo.gov/content/pkg/CHRG-117shrg50802/pdf/CHRG-117shrg50802.pdf","3.0 MB","https://www.govinfo.gov/content/pkg/CHRG-117shrg50802/html/CHRG-117shrg50802.htm","238.6 KB","","0 B","","0 B","","0 B","HUNDRED SEVENTEENTH CONGRESS FIRST SESSION ON EXAMINING THE PROBLEMS AND POSSIBILITIES OF CRYPTOCURRENCY JULY 27, 2021 Printed for the use of the Committee on Banking, Housing, and Urban Affairs [GRAPHIC NOT AVAILABLE IN TIFF FORMAT] Available at: https: //www.govinfo.gov / ______ U.S. GOVERNMENT PUBLISHING OFFICE 50-802 PDF WASHINGTON : 2023 ...","","2021-07-27"
"164","Congressional Hearings","CHRG-117hhrg48312","CHRG-117hhrg48312","Discrimination and Violence Against Asian Americans","https://www.govinfo.gov/app/details/CHRG-117hhrg48312/CHRG-117hhrg48312","https://www.govinfo.gov/content/pkg/CHRG-117hhrg48312/pdf/CHRG-117hhrg48312.pdf","36.9 MB","https://www.govinfo.gov/content/pkg/CHRG-117hhrg48312/html/CHRG-117hhrg48312.htm","196.2 KB","","0 B","","0 B","","0 B"," ON THE JUDICIARY U.S. HOUSE OF REPRESENTATIVES ONE HUNDRED SEVENTEENTH CONGRESS FIRST SESSION THURSDAY, MARCH 18, 2021 Serial No. 117-12 Printed for the use of the Committee on the Judiciary [GRAPHIC NOT AVAILABLE IN TIFF FORMAT] Available via: http://judiciary.house.gov U.S. GOVERNMENT PUBLISHING OFFICE 48-312 WASHINGTON : 2022 COMMITTEE ON...","","2021-03-18"
"165","Congressional Hearings","CHRG-117shrg47786","CHRG-117shrg47786","Nominations of Arun Venkataraman and Damon Y. Smith","https://www.govinfo.gov/app/details/CHRG-117shrg47786/CHRG-117shrg47786","https://www.govinfo.gov/content/pkg/CHRG-117shrg47786/pdf/CHRG-117shrg47786.pdf","10.0 MB","https://www.govinfo.gov/content/pkg/CHRG-117shrg47786/html/CHRG-117shrg47786.htm","137.8 KB","","0 B","","0 B","","0 B"," ONE HUNDRED SEVENTEENTH CONGRESS FIRST SESSION ON NOMINATIONS OF: ARUN VENKATARAMAN, OF THE DISTRICT OF COLUMBIA, TO BE ASSISTANT SECRETARY OF COMMERCE AND DIRECTOR GENERAL OF THE UNITED STATES AND FOREIGN COMMERCIAL SERVICE DAMON Y. SMITH, OF MARYLAND, TO BE GENERAL COUNSEL, DEPARTMENT OF HOUSING AND URBAN DEVELOPMENT JULY 13, 2021 Printed ...","","2021-07-13"
"166","Congressional Hearings","CHRG-117hhrg46865","CHRG-117hhrg46865","[H.A.S.C. No. 117-42] Fiscal Year 2022 Budget Request for Nuclear Forces and Atomic Energy Defense Activities","https://www.govinfo.gov/app/details/CHRG-117hhrg46865/CHRG-117hhrg46865","https://www.govinfo.gov/content/pkg/CHRG-117hhrg46865/pdf/CHRG-117hhrg46865.pdf","3.3 MB","https://www.govinfo.gov/content/pkg/CHRG-117hhrg46865/html/CHRG-117hhrg46865.htm","128.6 KB","","0 B","","0 B","","0 B"," ON ARMED SERVICES HOUSE OF REPRESENTATIVES ONE HUNDRED SEVENTEENTH CONGRESS FIRST SESSION SUBCOMMITTEE ON STRATEGIC FORCES HEARING ON FISCAL YEAR 2022 BUDGET REQUEST FOR NUCLEAR FORCES AND ATOMIC ENERGY DEFENSE ACTIVITIES HEARING HELD JUNE 10, 2021 [GRAPHICS NOT AVAILABLE IN TIFF FORMAT] U.S. GOVERNMENT PUBLISHING OFFICE 46-865 WASHINGTON ...","","2021-06-10"
"167","Congressional Hearings","CHRG-117hhrg45878","CHRG-117hhrg45878","Recognizing and Building on the Success of Pandemic Relief Programs","https://www.govinfo.gov/app/details/CHRG-117hhrg45878/CHRG-117hhrg45878","https://www.govinfo.gov/content/pkg/CHRG-117hhrg45878/pdf/CHRG-117hhrg45878.pdf","207.3 KB","https://www.govinfo.gov/content/pkg/CHRG-117hhrg45878/html/CHRG-117hhrg45878.htm","117.5 KB","","0 B","","0 B","","0 B"," ON OVERSIGHT AND REFORM HOUSE OF REPRESENTATIVES ONE HUNDRED SEVENTEENTH CONGRESS FIRST SESSION SEPTEMBER 22, 2021 Serial No. 117-41 Printed for the use of the Committee on Oversight and Reform [GRAPHIC NOT AVAILABLE IN TIFF FORMAT] Available at: govinfo.gov, oversight.house.gov or docs.house.gov U.S. GOVERNMENT PUBLISHING OFFICE 45-878 PDF ...","","2021-09-22"
"168","Congressional Hearings","CHRG-117hhrg56896","CHRG-117hhrg56896","The Overdose Crisis: Interagency Proposal to Combat Illicit Fentanyl- Related Substances","https://www.govinfo.gov/app/details/CHRG-117hhrg56896/CHRG-117hhrg56896","https://www.govinfo.gov/content/pkg/CHRG-117hhrg56896/pdf/CHRG-117hhrg56896.pdf","82.1 MB","https://www.govinfo.gov/content/pkg/CHRG-117hhrg56896/html/CHRG-117hhrg56896.htm","224.5 KB","","0 B","","0 B","","0 B"," ON ENERGY AND COMMERCE HOUSE OF REPRESENTATIVES ONE HUNDRED SEVENTEENTH CONGRESS FIRST SESSION DECEMBER 2, 2021 Serial No. 117-59 GRAPHIC(S) NOT AVAILABLE IN TIFF FORMAT Published for the use of the Committee on Energy and Commerce govinfo.gov/committee/house-energy energycommerce.house.gov _______ U.S. GOVERNMENT PUBLISHING OFFICE 56-896PDF ...","","2021-12-02"
"169","Congressional Hearings","CHRG-117hhrg45430","CHRG-117hhrg45430","[H.A.S.C. No. 117-18] National Security Challenges and U.S. Military Activities in Europe","https://www.govinfo.gov/app/details/CHRG-117hhrg45430/CHRG-117hhrg45430","https://www.govinfo.gov/content/pkg/CHRG-117hhrg45430/pdf/CHRG-117hhrg45430.pdf","696.5 KB","https://www.govinfo.gov/content/pkg/CHRG-117hhrg45430/html/CHRG-117hhrg45430.htm","178.5 KB","","0 B","","0 B","","0 B"," SEVENTEENTH CONGRESS FIRST SESSION HEARING HELD APRIL 15, 2021 [GRAPHIC(S) NOT AVAILABLE IN TIFF FORMAT] ______ U.S. GOVERNMENT PUBLISHING OFFICE 45-430 WASHINGTON : 2021 COMMITTEE ON ARMED SERVICES One Hundred Seventeenth Congress ADAM SMITH, Washington, Chairman JAMES R. LANGEVIN, Rhode Island MIKE ROGERS, Alabama RICK LARSEN, Washington ...","","2021-04-15"
"170","Congressional Hearings","CHRG-117shrg56723","CHRG-117shrg56723","Department of Defense Authorization for Appropriations for Fiscal Year 2022 and the Future Years Defense Program","https://www.govinfo.gov/app/details/CHRG-117shrg56723/CHRG-117shrg56723","https://www.govinfo.gov/content/pkg/CHRG-117shrg56723/pdf/CHRG-117shrg56723.pdf","304.0 KB","https://www.govinfo.gov/content/pkg/CHRG-117shrg56723/html/CHRG-117shrg56723.htm","303.4 KB","","0 B","","0 B","","0 B"," THE COMMITTEE ON ARMED SERVICES UNITED STATES SENATE ONE HUNDRED SEVENTEENTH CONGRESS FIRST SESSION ON S. 2792 TO AUTHORIZE APPROPRIATIONS FOR FISCAL YEAR 2022 FOR MILITARY ACTIVITIES OF THE DEPARTMENT OF DEFENSE, FOR MILITARY CON- STRUCTION, AND FOR DEFENSE ACTIVITIES OF THE DEPARTMENT OF ENERGY, TO PRESCRIBE MILITARY PERSONNEL STRENGTHS FOR ...","","2021-06-15"
"171","Congressional Hearings","CHRG-117hhrg46586","CHRG-117hhrg46586","Department of Defense Appropriations for 2022","https://www.govinfo.gov/app/details/CHRG-117hhrg46586/CHRG-117hhrg46586","https://www.govinfo.gov/content/pkg/CHRG-117hhrg46586/pdf/CHRG-117hhrg46586.pdf","6.9 MB","https://www.govinfo.gov/content/pkg/CHRG-117hhrg46586/html/CHRG-117hhrg46586.htm","563.0 KB","","0 B","","0 B","","0 B","SEVENTEENTH CONGRESS FIRST SESSION _____ SUBCOMMITTEE ON DEFENSE BETTY McCOLLUM, Minnesota, Chair TIM RYAN, Ohio KEN CALVERT, California C. A. DUTCH RUPPERSBERGER, Maryland HAROLD ROGERS, Kentucky MARCY KAPTUR, Ohio TOM COLE, Oklahoma HENRY CUELLAR, Texas STEVE WOMACK, Arkansas DEREK KILMER, Washington ROBERT B. ADERHOLT, Alabama PETE AGUILAR, ...","","2021-05-07"
"172","Congressional Hearings","CHRG-117shrg55152","CHRG-117shrg55152","Pride in Patent Ownership: The Value of Knowing Who Owns a Patent","https://www.govinfo.gov/app/details/CHRG-117shrg55152/CHRG-117shrg55152","https://www.govinfo.gov/content/pkg/CHRG-117shrg55152/pdf/CHRG-117shrg55152.pdf","4.2 MB","https://www.govinfo.gov/content/pkg/CHRG-117shrg55152/html/CHRG-117shrg55152.htm","73.9 KB","","0 B","","0 B","","0 B"," ON THE JUDICIARY UNITED STATES SENATE ONE HUNDRED SEVENTEENTH CONGRESS FIRST SESSION OCTOBER 19, 2021 Serial No. J-117-41 Printed for the use of the Committee on the Judiciary [GRAPHIC NOT AVAILABLE IN TIFF FORMAT] www.judiciary.senate.gov www.govinfo.gov U.S. GOVERNMENT PUBLISHING OFFICE 55-152 WASHINGTON : 2024 COMMITTEE ON THE JUDICIARY ...","","2021-10-19"
"173","Congressional Hearings","CHRG-117shrg29104948","CHRG-117shrg29104948","Department of Defense Appropriations for Fiscal Year 2022","https://www.govinfo.gov/app/details/CHRG-117shrg29104948/CHRG-117shrg29104948","https://www.govinfo.gov/content/pkg/CHRG-117shrg29104948/pdf/CHRG-117shrg29104948.pdf","248.2 KB","https://www.govinfo.gov/content/pkg/CHRG-117shrg29104948/html/CHRG-117shrg29104948.htm","205.3 KB","","0 B","","0 B","","0 B",", DC. The subcommittee met at 2:06 p.m., in room SD-192, Dirksen Senate Office Building, Hon. Jon Tester, (chairman) presiding. Present: Senators Tester, Durbin, Leahy, Feinstein, Murray, Schatz, Baldwin, Shelby, Murkowski, Moran, Hoeven, and Boozman. DEPARTMENT OF DEFENSE Department of the Air Force Office of the Secretary STATEMENT OF HON. ...","","2021-06-08"
"174","Congressional Hearings","CHRG-117hhrg43773","CHRG-117hhrg43773","A Year into the Pandemic: The State of International Development","https://www.govinfo.gov/app/details/CHRG-117hhrg43773/CHRG-117hhrg43773","https://www.govinfo.gov/content/pkg/CHRG-117hhrg43773/pdf/CHRG-117hhrg43773.pdf","2.3 MB","https://www.govinfo.gov/content/pkg/CHRG-117hhrg43773/html/CHRG-117hhrg43773.htm","80.9 KB","","0 B","","0 B","","0 B"," AND GLOBAL CORPORATE SOCIAL IMPACT OF THE COMMITTEE ON FOREIGN AFFAIRS HOUSE OF REPRESENTATIVES ONE HUNDRED SEVENTEENTH CONGRESS FIRST SESSION MARCH 10, 2021 Serial No. 117-6 Printed for the use of the Committee on Foreign Affairs [GRAPHIC(S) NOT AVAILABLE IN TIFF FORMAT] Available: http://www.foreignaffairs.house.gov/, http://docs.house.gov,...","","2021-03-10"
"175","Congressional Hearings","CHRG-117shrg52334","CHRG-117shrg52334","Implementation and Enforcement of the United States-Mexico-Canada Agreement: One Year After Entry into Force","https://www.govinfo.gov/app/details/CHRG-117shrg52334/CHRG-117shrg52334","https://www.govinfo.gov/content/pkg/CHRG-117shrg52334/pdf/CHRG-117shrg52334.pdf","508.1 KB","https://www.govinfo.gov/content/pkg/CHRG-117shrg52334/html/CHRG-117shrg52334.htm","386.5 KB","","0 B","","0 B","","0 B"," ON FINANCE UNITED STATES SENATE ONE HUNDRED SEVENTEENTH CONGRESS FIRST SESSION JULY 27, 2021 [GRAPHIC NOT AVAILABLE IN TIFF FORMAT] Printed for the use of the Committee on Finance U.S. GOVERNMENT PUBLISHING OFFICE 52-334-PDF WASHINGTON : 2023 COMMITTEE ON FINANCE RON WYDEN, Oregon, Chairman DEBBIE STABENOW, Michigan MIKE CRAPO, Idaho MARIA ...","","2021-07-27"
"176","Congressional Hearings","CHRG-117hhrg44635","CHRG-117hhrg44635","Understanding Authoritarianism and Kleptocracy in Russia","https://www.govinfo.gov/app/details/CHRG-117hhrg44635/CHRG-117hhrg44635","https://www.govinfo.gov/content/pkg/CHRG-117hhrg44635/pdf/CHRG-117hhrg44635.pdf","19.9 MB","https://www.govinfo.gov/content/pkg/CHRG-117hhrg44635/html/CHRG-117hhrg44635.htm","101.8 KB","","0 B","","0 B","","0 B"," ON FOREIGN AFFAIRS HOUSE OF REPRESENTATIVES ONE HUNDRED SEVENTEENTH CONGRESS FIRST SESSION May 27, 2021 Serial No. 117-43 Printed for the use of the Committee on Foreign Affairs [GRAPHIC NOT AVAILABLE IN TIFF FORMAT] Available: http://www.foreignaffairs.house.gov/, http:// docs.house.gov, or http://www.govinfo.gov U.S. GOVERNMENT PUBLISHING ...","","2021-05-27"
"177","Congressional Hearings","CHRG-117hhrg46026","CHRG-117hhrg46026","Fueling the Climate Crisis: Exposing Big Oil's Disinformation Campaign to Prevent Climate Action","https://www.govinfo.gov/app/details/CHRG-117hhrg46026/CHRG-117hhrg46026","https://www.govinfo.gov/content/pkg/CHRG-117hhrg46026/pdf/CHRG-117hhrg46026.pdf","362.4 KB","https://www.govinfo.gov/content/pkg/CHRG-117hhrg46026/html/CHRG-117hhrg46026.htm","326.1 KB","","0 B","","0 B","","0 B"," HOUSE OF REPRESENTATIVES ONE HUNDRED SEVENTEENTH CONGRESS FIRST SESSION OCTOBER 28, 2021 Serial No. 117-50 Printed for the use of the Committee on Oversight and Reform [GRAPHIC NOT AVAILABLE IN TIFF FORMAT] Available on: govinfo.gov, oversight.house.gov or docs.house.gov U.S. GOVERNMENT PUBLISHING OFFICE 46-026 PDF WASHINGTON : 2022 COMMITTEE ON ...","","2021-10-28"
"178","Congressional Hearings","CHRG-117hhrg48495","CHRG-117hhrg48495","[H.A.S.C. No. 117-30] Ship and Submarine Maintenance: Sustainment Considerations for a Changing Fleet","https://www.govinfo.gov/app/details/CHRG-117hhrg48495/CHRG-117hhrg48495","https://www.govinfo.gov/content/pkg/CHRG-117hhrg48495/pdf/CHRG-117hhrg48495.pdf","388.0 KB","https://www.govinfo.gov/content/pkg/CHRG-117hhrg48495/html/CHRG-117hhrg48495.htm","101.0 KB","","0 B","","0 B","","0 B"," THE COMMITTEE ON ARMED SERVICES HOUSE OF REPRESENTATIVES ONE HUNDRED SEVENTEENTH CONGRESS FIRST SESSION HEARING HELD MAY 6, 2021 [GRAPHIC(S) NOT AVAILABLE IN TIFF FORMAT] ______ U.S. GOVERNMENT PUBLISHING OFFICE 48-495 WASHINGTON : 2022 SUBCOMMITTEE ON READINESS JOHN GARAMENDI, California, Chairman JOE COURTNEY, Connecticut DOUG LAMBORN, Colorado ...","","2021-05-06"
"179","Congressional Hearings","CHRG-117hhrg44120","CHRG-117hhrg44120","Renewing the United States' Commitment to Addressing the Root Causes of Migration from Central America","https://www.govinfo.gov/app/details/CHRG-117hhrg44120/CHRG-117hhrg44120","https://www.govinfo.gov/content/pkg/CHRG-117hhrg44120/pdf/CHRG-117hhrg44120.pdf","3.5 MB","https://www.govinfo.gov/content/pkg/CHRG-117hhrg44120/html/CHRG-117hhrg44120.htm","108.0 KB","","0 B","","0 B","","0 B",", CIVILIAN SECURITY, MIGRATION AND INTERNATIONAL ECONOMIC POLICY OF THE COMMITTEE ON FOREIGN AFFAIRS HOUSE OF REPRESENTATIVES ONE HUNDRED SEVENTEENTH CONGRESS FIRST SESSION APRIL 14, 2021 Serial No. 117-25 Printed for the use of the Committee on Foreign Affairs [GRAPHIC(S) NOT AVAILABLE IN TIFF FORMAT] Available: http://...","","2021-04-14"
"180","Congressional Hearings","CHRG-117shrg47326","CHRG-117shrg47326","U.S. Policy on Democracy in Latin America and the Caribbean","https://www.govinfo.gov/app/details/CHRG-117shrg47326/CHRG-117shrg47326","https://www.govinfo.gov/content/pkg/CHRG-117shrg47326/pdf/CHRG-117shrg47326.pdf","247.0 KB","https://www.govinfo.gov/content/pkg/CHRG-117shrg47326/html/CHRG-117shrg47326.htm","198.8 KB","","0 B","","0 B","","0 B"," HUNDRED SEVENTEENTH CONGRESS FIRST SESSION NOVEMBER 30, 2021 Printed for the use of the Committee on Foreign Relations [GRAPHIC NOT AVAILABLE IN TIFF FORMAT] Available via http://www.govinfo.gov U.S. GOVERNMENT PUBLISHING OFFICE 47-326 PDF WASHINGTON : 2022 COMMITTEE ON FOREIGN RELATIONS ROBERT MENENDEZ, New Jersey, Chairman BENJAMIN L. CARDIN, ...","","2021-11-30"
"181","Congressional Hearings","CHRG-117shrg51633","CHRG-117shrg51633","The President's Fiscal Year 2022 Budget","https://www.govinfo.gov/app/details/CHRG-117shrg51633/CHRG-117shrg51633","https://www.govinfo.gov/content/pkg/CHRG-117shrg51633/pdf/CHRG-117shrg51633.pdf","438.2 KB","https://www.govinfo.gov/content/pkg/CHRG-117shrg51633/html/CHRG-117shrg51633.htm","430.2 KB","","0 B","","0 B","","0 B"," FIRST SESSION JUNE 16, 2021 [GRAPHIC NOT AVAILABLE IN TIFF FORMAT] Printed for the use of the Committee on Finance U.S. GOVERNMENT PUBLISHING OFFICE 51-633-PDF WASHINGTON : 2023 COMMITTEE ON FINANCE RON WYDEN, Oregon, Chairman DEBBIE STABENOW, Michigan MIKE CRAPO, Idaho MARIA CANTWELL, Washington CHUCK GRASSLEY, Iowa ROBERT MENENDEZ, New Jersey ...","","2021-06-16"
"182","Congressional Hearings","CHRG-117shrg46202","CHRG-117shrg46202","The Causes, Outlook, and Implications of Domestic and International Energy Price Trends","https://www.govinfo.gov/app/details/CHRG-117shrg46202/CHRG-117shrg46202","https://www.govinfo.gov/content/pkg/CHRG-117shrg46202/pdf/CHRG-117shrg46202.pdf","33.8 MB","https://www.govinfo.gov/content/pkg/CHRG-117shrg46202/html/CHRG-117shrg46202.htm","124.9 KB","","0 B","","0 B","","0 B"," RESOURCES UNITED STATES SENATE ONE HUNDRED SEVENTEENTH CONGRESS FIRST SESSION TUESDAY, NOVEMBER 16, 2021 [GRAPHIC NOT AVAILABLE IN TIFF FORMAT] Printed for the use of the Committee on Energy and Natural Resources Available via the World Wide Web: http://www.govinfo.gov U.S. GOVERNMENT PUBLISHING OFFICE 46-202 WASHINGTON : 2022 COMMITTEE ON ...","","2021-11-16"
"183","Congressional Hearings","CHRG-117hhrg47821","CHRG-117hhrg47821","[H.A.S.C. No. 117-46] Department of the Air Force Fiscal Year 2022 Budget Request","https://www.govinfo.gov/app/details/CHRG-117hhrg47821/CHRG-117hhrg47821","https://www.govinfo.gov/content/pkg/CHRG-117hhrg47821/pdf/CHRG-117hhrg47821.pdf","2.5 MB","https://www.govinfo.gov/content/pkg/CHRG-117hhrg47821/html/CHRG-117hhrg47821.htm","275.3 KB","","0 B","","0 B","","0 B"," ON ARMED SERVICES HOUSE OF REPRESENTATIVES ONE HUNDRED SEVENTEENTH CONGRESS FIRST SESSION FULL COMMITTEE HEARING ON DEPARTMENT OF THE AIR FORCE FISCAL YEAR 2022 BUDGET REQUEST HEARING HELD JUNE 16, 2021 [GRAPHIC NOT AVAILABLE IN TIFF FORMAT] U.S. GOVERNMENT PUBLISHING OFFICE 47-821 WASHINGTON : 2022 COMMITTEE ON ARMED SERVICES One Hundred ...","","2021-06-16"
"184","Congressional Hearings","CHRG-117hhrg44363","CHRG-117hhrg44363","National Science Foundation: Advancing Research for the Future of U.S. Innovation, Part I","https://www.govinfo.gov/app/details/CHRG-117hhrg44363/CHRG-117hhrg44363","https://www.govinfo.gov/content/pkg/CHRG-117hhrg44363/pdf/CHRG-117hhrg44363.pdf","28.4 MB","https://www.govinfo.gov/content/pkg/CHRG-117hhrg44363/html/CHRG-117hhrg44363.htm","137.9 KB","","0 B","","0 B","","0 B","OF THE COMMITTEE ON SCIENCE, SPACE, AND TECHNOLOGY HOUSE OF REPRESENTATIVES ONE HUNDRED SEVENTEENTH CONGRESS FIRST SESSION APRIL 28, 2021 Serial No. 117-10 Printed for the use of the Committee on Science, Space, and Technology [GRAPHIC NOT AVAILABLE IN TIFF FORMAT] Available via the World Wide Web: http://science.house.gov ______ U.S. GOVERNMENT ...","","2021-04-28"
"185","Congressional Hearings","CHRG-117shrg54901","CHRG-117shrg54901","Protecting Kids Online: Snapchat, Tiktok, and Youtube","https://www.govinfo.gov/app/details/CHRG-117shrg54901/CHRG-117shrg54901","https://www.govinfo.gov/content/pkg/CHRG-117shrg54901/pdf/CHRG-117shrg54901.pdf","32.6 MB","https://www.govinfo.gov/content/pkg/CHRG-117shrg54901/html/CHRG-117shrg54901.htm","472.5 KB","","0 B","","0 B","","0 B"," SECURITY of the COMMITTEE ON COMMERCE, SCIENCE, AND TRANSPORTATION UNITED STATES SENATE ONE HUNDRED SEVENTEENTH CONGRESS FIRST SESSION OCTOBER 26, 2021 Printed for the use of the Committee on Commerce, Science, and Transportation [GRAPHIC NOT AVAILABLE IN TIFF FORMAT] Available online: http://www.govinfo.gov ______ U.S. GOVERNMENT PUBLISHING ...","","2021-10-26"
"186","Congressional Hearings","CHRG-117shrg44584","CHRG-117shrg44584","Nomination of Neera Tanden","https://www.govinfo.gov/app/details/CHRG-117shrg44584/CHRG-117shrg44584","https://www.govinfo.gov/content/pkg/CHRG-117shrg44584/pdf/CHRG-117shrg44584.pdf","53.9 MB","https://www.govinfo.gov/content/pkg/CHRG-117shrg44584/html/CHRG-117shrg44584.htm","163.3 KB","","0 B","","0 B","","0 B"," SEVENTEENTH CONGRESS FIRST SESSION NOMINATION OF NEERA TANDEN, TO BE DIRECTOR, OFFICE OF MANAGEMENT AND BUDGET FEBRUARY 9, 2021 Available via the World Wide Web: http://www.govinfo.gov Printed for the use of the Committee on Homeland Security and Governmental Affairs [GRAPHIC NOT AVAILABLE IN TIFF FORMAT] U.S. GOVERNMENT PUBLISHING OFFICE 44-584 ...","","2021-02-09"
"187","Congressional Hearings","CHRG-117hhrg46150","CHRG-117hhrg46150","Ensuring American Leadership in Microelectronics","https://www.govinfo.gov/app/details/CHRG-117hhrg46150/CHRG-117hhrg46150","https://www.govinfo.gov/content/pkg/CHRG-117hhrg46150/pdf/CHRG-117hhrg46150.pdf","61.7 MB","https://www.govinfo.gov/content/pkg/CHRG-117hhrg46150/html/CHRG-117hhrg46150.htm","204.9 KB","","0 B","","0 B","","0 B"," SEVENTEENTH CONGRESS FIRST SESSION DECEMBER 2, 2021 Serial No. 117-40 Printed for the use of the Committee on Science, Space, and Technology [GRAPHIC(S) NOT AVAILABLE IN TIFF FORMAT] Available via the World Wide Web: http://science.house.gov _________ U.S. GOVERNMENT PUBLISHING OFFICE 46-150PDF WASHINGTON : 2023 COMMITTEE ON SCIENCE, SPACE, ...","","2021-12-02"
"188","Congressional Hearings","CHRG-117shrg44958","CHRG-117shrg44958","Stone-Manning, Baker, Walsh, and Light Nominations","https://www.govinfo.gov/app/details/CHRG-117shrg44958/CHRG-117shrg44958","https://www.govinfo.gov/content/pkg/CHRG-117shrg44958/pdf/CHRG-117shrg44958.pdf","23.0 MB","https://www.govinfo.gov/content/pkg/CHRG-117shrg44958/html/CHRG-117shrg44958.htm","131.9 KB","","0 B","","0 B","","0 B","ONE HUNDRED SEVENTEENTH CONGRESS FIRST SESSION to CONSIDER THE NOMINATIONS OF TRACY STONE-MANNING TO BE DIRECTOR OF THE BUREAU OF LAND MANAGEMENT; SHALANDA H. BAKER TO BE DIRECTOR OF THE OFFICE OF MINORITY ECONOMIC IMPACT, DEPARTMENT OF ENERGY; SAMUEL T. WALSH TO BE GENERAL COUNSEL, DEPARTMENT OF ENERGY; AND ANDREW E. LIGHT TO BE AN ASSISTANT ...","","2021-06-08"
