"index","collection","packageId","granuleId","title","detailsLink","pdfLink","pdfSize","htmlLink","htmlSize","xmlLink","xmlSize","otherLink1","other1Size","otherLink2","other2Size","teaser","historical","publishdate"
"470","Congressional Hearings","CHRG-117shrg47979","CHRG-117shrg47979","Nominations of Hon. Ernest W. Dubester, Hon. Susan T. Grundmann, and Kurt T. Rumsfeld","https://www.govinfo.gov/app/details/CHRG-117shrg47979/CHRG-117shrg47979","https://www.govinfo.gov/content/pkg/CHRG-117shrg47979/pdf/CHRG-117shrg47979.pdf","5.1 MB","https://www.govinfo.gov/content/pkg/CHRG-117shrg47979/html/CHRG-117shrg47979.htm","67.1 KB","","0 B","","0 B","","0 B"," AND GOVERNMENTAL AFFAIRS UNITED STATES SENATE ONE HUNDRED SEVENTEENTH CONGRESS FIRST SESSION NOMINATION OF HON. ERNEST W. DUBESTER TO BE A MEMBER, FEDERAL LABOR RELATIONS AUTHORITY, HON. SUSAN T. GRUNDMANN TO BE A MEMBER, FEDERAL LABOR RELATIONS AUTHORITY, AND KURT T. RUMSFELD TO BE GENERAL COUNSEL, FEDERAL LABOR RELATIONS AUTHORITY OCTOBER 20, ...","","2021-10-20"
"471","Congressional Hearings","CHRG-117shrg48918","CHRG-117shrg48918","The Semiannual Monetary Policy Report to the Congress","https://www.govinfo.gov/app/details/CHRG-117shrg48918/CHRG-117shrg48918","https://www.govinfo.gov/content/pkg/CHRG-117shrg48918/pdf/CHRG-117shrg48918.pdf","37.0 MB","https://www.govinfo.gov/content/pkg/CHRG-117shrg48918/html/CHRG-117shrg48918.htm","199.3 KB","","0 B","","0 B","","0 B"," SENATE ONE HUNDRED SEVENTEENTH CONGRESS FIRST SESSION ON OVERSIGHT ON THE MONETARY POLICY REPORT TO CONGRESS PURSU- ANT TO THE FULL EMPLOYMENT AND BALANCED GROWTH ACT OF 1978 JULY 15, 2021 Printed for the use of the Committee on Banking, Housing, and Urban Affairs [GRAPHIC(S) NOT AVAILABLE IN TIFF FORMAT] Available at: https: //www.govinfo.gov/ __...","","2021-07-15"
"472","Congressional Hearings","CHRG-117hhrg56830","CHRG-117hhrg56830","TSCA and Public Health: Fulfilling the Promise of the Lautenberg Act","https://www.govinfo.gov/app/details/CHRG-117hhrg56830/CHRG-117hhrg56830","https://www.govinfo.gov/content/pkg/CHRG-117hhrg56830/pdf/CHRG-117hhrg56830.pdf","13.3 MB","https://www.govinfo.gov/content/pkg/CHRG-117hhrg56830/html/CHRG-117hhrg56830.htm","137.0 KB","","0 B","","0 B","","0 B","COMMITTEE ON ENERGY AND COMMERCE HOUSE OF REPRESENTATIVES ONE HUNDRED SEVENTEENTH CONGRESS FIRST SESSION OCTOBER 27, 2021 Serial No. 117-56 [GRAPHIC(S) NOT AVAILABLE IN TIFF FORMAT] Published for the use of the Committee on Energy and Commerce govinfo.gov/committee/house-energy energycommerce.house.gov _______ U.S. GOVERNMENT PUBLISHING OFFICE 56-...","","2021-10-27"
"473","Congressional Hearings","CHRG-117hhrg45012","CHRG-117hhrg45012","[H.A.S.C. No. 117-22] Update on F-35 Program Accomplishments, Issues, and Risks","https://www.govinfo.gov/app/details/CHRG-117hhrg45012/CHRG-117hhrg45012","https://www.govinfo.gov/content/pkg/CHRG-117hhrg45012/pdf/CHRG-117hhrg45012.pdf","7.6 MB","https://www.govinfo.gov/content/pkg/CHRG-117hhrg45012/html/CHRG-117hhrg45012.htm","252.2 KB","","0 B","","0 B","","0 B"," MEETING JOINTLY WITH SUBCOMMITTEE ON READINESS OF THE COMMITTEE ON ARMED SERVICES HOUSE OF REPRESENTATIVES ONE HUNDRED SEVENTEENTH CONGRESS FIRST SESSION HEARING HELD APRIL 22, 2021 [GRAPHIC NOT AVAILABLE IN TIFF FORMAT] U.S. GOVERNMENT PUBLISHING OFFICE 45-012 WASHINGTON : 2022 SUBCOMMITTEE ON TACTICAL AIR AND LAND FORCES DONALD NORCROSS, New ...","","2021-04-22"
"474","Congressional Hearings","CHRG-117shrg47212","CHRG-117shrg47212","Afghanistan 2001 to 2021: U.S. Policies Lessons Learned","https://www.govinfo.gov/app/details/CHRG-117shrg47212/CHRG-117shrg47212","https://www.govinfo.gov/content/pkg/CHRG-117shrg47212/pdf/CHRG-117shrg47212.pdf","216.4 KB","https://www.govinfo.gov/content/pkg/CHRG-117shrg47212/html/CHRG-117shrg47212.htm","144.9 KB","","0 B","","0 B","","0 B"," SEVENTEENTH CONGRESS FIRST SESSION NOVEMBER 17, 2021 Printed for the use of the Committee on Foreign Relations [GRAPHIC NOT AVAILABLE IN TIFF FORMAT] Available via http://www.govinfo.gov U.S. GOVERNMENT PUBLISHING OFFICE 47-212 PDF WASHINGTON : 2022 COMMITTEE ON FOREIGN RELATIONS ROBERT MENENDEZ, New Jersey, Chairman BENJAMIN L. CARDIN, ...","","2021-11-17"
"475","Congressional Hearings","CHRG-117shrg43843","CHRG-117shrg43843","The Nominations of Brenda Mallory to Be a Member and Chair of the Council on Environmental Quality and Janet Mccabe to Be Deputy Administrator of the Environmental Protection Agency","https://www.govinfo.gov/app/details/CHRG-117shrg43843/CHRG-117shrg43843","https://www.govinfo.gov/content/pkg/CHRG-117shrg43843/pdf/CHRG-117shrg43843.pdf","30.9 MB","https://www.govinfo.gov/content/pkg/CHRG-117shrg43843/html/CHRG-117shrg43843.htm","132.9 KB","","0 B","","0 B","","0 B"," OF THE ENVIRONMENTAL PROTECTION AGENCY HEARING before the COMMITTEE ON ENVIRONMENT AND PUBLIC WORKS UNITED STATES SENATE ONE HUNDRED SEVENTEENTH CONGRESS FIRST SESSION MARCH 3, 2021 Printed for the use of the Committee on Environment and Public Works [GRAPHIC(S) NOT AVAILABLE IN TIFF FORMAT] ______ U.S. GOVERNMENT PUBLISHING OFFICE 43-843 ...","","2021-03-03"
"476","Congressional Hearings","CHRG-117hhrg45197","CHRG-117hhrg45197","Building Climate Resilient Communities","https://www.govinfo.gov/app/details/CHRG-117hhrg45197/CHRG-117hhrg45197","https://www.govinfo.gov/content/pkg/CHRG-117hhrg45197/pdf/CHRG-117hhrg45197.pdf","420.1 KB","https://www.govinfo.gov/content/pkg/CHRG-117hhrg45197/html/CHRG-117hhrg45197.htm","1.6 KB","","0 B","","0 B","","0 B","CRISIS HOUSE OF REPRESENTATIVES ONE HUNDRED SEVENTEENTH CONGRESS FIRST SESSION HEARING HELD JUNE 11, 2021 Serial No. 1175 ( www.govinfo.gov Printed for the use of the Select Committee on the Climate Crisis VerDate Sep 11 2014 13:28 Aug 19, 2021 Jkt 045197 PO 00000 Frm 00001 Fmt 5011 Sfmt 5011 E:\CLIMATE_CRISIS\45197\45197A.XXX 45197Adk ra us e on ...","","2021-06-11"
"477","Congressional Hearings","CHRG-117hhrg45200","CHRG-117hhrg45200","Appropriations for Fiscal Year 2022","https://www.govinfo.gov/app/details/CHRG-117hhrg45200/CHRG-117hhrg45200","https://www.govinfo.gov/content/pkg/CHRG-117hhrg45200/pdf/CHRG-117hhrg45200.pdf","5.9 MB","https://www.govinfo.gov/content/pkg/CHRG-117hhrg45200/html/CHRG-117hhrg45200.htm","1.3 KB","","0 B","","0 B","","0 B"," JUNE 9, 2021 MEMBER DAY TESTIMONY FOR FISCAL YEAR 2022 APPROPRIATIONS ( Printed for the use of the Committee on Appropriations U.S. GOVERNMENT PUBLISHING OFFICE 45200 WASHINGTON : 2021 VerDate Sep 11 2014 07:06 Aug 13, 2021 Jkt 045200 PO 00000 Frm 00003 Fmt 7513 Sfmt 7513 E:\HR\OC\45200P1.XXX 45200P1dl hi ll on D S K 12 0R N 23 P R O D w ith...","","2021-06-09"
"478","Congressional Hearings","CHRG-117hhrg44954","CHRG-117hhrg44954","Powering up Clean Energy: Investments to Modernize and Expand the Electric Grid","https://www.govinfo.gov/app/details/CHRG-117hhrg44954/CHRG-117hhrg44954","https://www.govinfo.gov/content/pkg/CHRG-117hhrg44954/pdf/CHRG-117hhrg44954.pdf","2.0 MB","https://www.govinfo.gov/content/pkg/CHRG-117hhrg44954/html/CHRG-117hhrg44954.htm","236.9 KB","","0 B","","0 B","","0 B"," ONE HUNDRED SEVENTEENTH CONGRESS FIRST SESSION HEARING HELD MAY 20, 2021 Serial No. 117-4 [GRAPHIC NOT AVAILABLE IN TIFF FORMAT] www.govinfo.gov Printed for the use of the Select Committee on the Climate Crisis U.S. GOVERNMENT PUBLISHING OFFICE 44-954 WASHINGTON : 2021 SELECT COMMITTEE ON THE CLIMATE CRISIS One Hundred Seventeenth ...","","2021-05-20"
"479","Congressional Hearings","CHRG-117hhrg44331","CHRG-117hhrg44331","For-Profit College Conversions: Examining Ways to Improve Accountability and Prevent Fraud","https://www.govinfo.gov/app/details/CHRG-117hhrg44331/CHRG-117hhrg44331","https://www.govinfo.gov/content/pkg/CHRG-117hhrg44331/pdf/CHRG-117hhrg44331.pdf","12.0 MB","https://www.govinfo.gov/content/pkg/CHRG-117hhrg44331/html/CHRG-117hhrg44331.htm","214.9 KB","","0 B","","0 B","","0 B"," OF REPRESENTATIVES ONE HUNDRED SEVENTEENTH CONGRESS FIRST SESSION HEARING HELD IN WASHINGTON, DC, APRIL 20, 2021 Serial No. 117-7 Printed for the use of the Committee on Education and Labor [GRAPHIC NOT AVAILABLE IN TIFF FORMAT] Available via: edlabor.house.gov or www.govinfo.gov U.S. GOVERNMENT PUBLISHING OFFICE 44-331 PDF WASHINGTON : 2022 ...","","2021-04-20"
"480","Congressional Hearings","CHRG-117shrg45021","CHRG-117shrg45021","U.S. Policy on Belarus","https://www.govinfo.gov/app/details/CHRG-117shrg45021/CHRG-117shrg45021","https://www.govinfo.gov/content/pkg/CHRG-117shrg45021/pdf/CHRG-117shrg45021.pdf","202.0 KB","https://www.govinfo.gov/content/pkg/CHRG-117shrg45021/html/CHRG-117shrg45021.htm","127.7 KB","","0 B","","0 B","","0 B"," JUNE 9, 2021 Printed for the use of the Committee on Foreign Relations [GRAPHIC(S) NOT AVAILABLE IN TIFF FORMAT] Available via http://www.govinfo.gov ______ U.S. GOVERNMENT PUBLISHING OFFICE 45-021 PDF WASHINGTON : 2021 COMMITTEE ON FOREIGN RELATIONS ROBERT MENENDEZ, New Jersey, Chairman BENJAMIN L. CARDIN, Maryland JAMES E. RISCH, Idaho ...","","2021-06-09"
"481","Congressional Hearings","CHRG-117shrg44168","CHRG-117shrg44168","Energy and Water Development Appropriations for Fiscal Year 2022","https://www.govinfo.gov/app/details/CHRG-117shrg44168/CHRG-117shrg44168","https://www.govinfo.gov/content/pkg/CHRG-117shrg44168/pdf/CHRG-117shrg44168.pdf","983.2 KB","https://www.govinfo.gov/content/pkg/CHRG-117shrg44168/html/CHRG-117shrg44168.htm","748.7 KB","","0 B","","0 B","","0 B"," STATES SENATE ONE HUNDRED SEVENTEENTH CONGRESS FIRST SESSION ON H.R. 4549/S. 2605 AN ACT MAKING APPROPRIATIONS FOR ENERGY AND WATER DEVELOPMENT FOR THE FISCAL YEAR ENDING SEPTEMBER 30, 2022, AND FOR OTHER PURPOSES Department of Defense--Civil Department of Energy Department of the Interior Nondepartmental Witnesses Printed for the use of the ...","","2021-06-09"
"482","Congressional Hearings","CHRG-117shrg29104947","CHRG-117shrg29104947","Department of Defense Appropriations for Fiscal Year 2022","https://www.govinfo.gov/app/details/CHRG-117shrg29104947/CHRG-117shrg29104947","https://www.govinfo.gov/content/pkg/CHRG-117shrg29104947/pdf/CHRG-117shrg29104947.pdf","317.3 KB","https://www.govinfo.gov/content/pkg/CHRG-117shrg29104947/html/CHRG-117shrg29104947.htm","317.3 KB","","0 B","","0 B","","0 B",", DC.. The committee met at 10 a.m. in room SH-216, Hart Senate Office Building, Hon. Jon Tester, (chairman) presiding. Present: Senators Tester, Durbin, Feinstein, Schatz, Baldwin, Shaheen, Shelby, Collins, Murkowski, Moran, Hoeven, and Boozman. DEPARTMENT OF DEFENSE National Guard Reserve opening statement of senator jon tester Senator Tester....","","2021-05-18"
"483","Congressional Hearings","CHRG-117hhrg44685","CHRG-117hhrg44685","Unsustainable Drug Prices (Part III): Testimony from Abbvie Ceo Richard Gonzalez","https://www.govinfo.gov/app/details/CHRG-117hhrg44685/CHRG-117hhrg44685","https://www.govinfo.gov/content/pkg/CHRG-117hhrg44685/pdf/CHRG-117hhrg44685.pdf","265.8 KB","https://www.govinfo.gov/content/pkg/CHRG-117hhrg44685/html/CHRG-117hhrg44685.htm","201.6 KB","","0 B","","0 B","","0 B"," ONE HUNDRED SEVENTEENTH CONGRESS FIRST SESSION MAY 18, 2021 Serial No. 117-22 Printed for the use of the Committee on Oversight and Reform [GRAPHIC(S) NOT AVAILABLE IN TIFF FORMAT] Available on: govinfo.gov, oversight.house.gov or docs.house.gov ______ U.S. GOVERNMENT PUBLISHING OFFICE 44-685 PDF WASHINGTON : 2021 COMMITTEE ON OVERSIGHT ...","","2021-05-18"
"484","Congressional Hearings","CHRG-117hhrg46728","CHRG-117hhrg46728","Departments of Labor, Health and Human Services, Education, and Related Agencies Appropriations for 2022","https://www.govinfo.gov/app/details/CHRG-117hhrg46728/CHRG-117hhrg46728","https://www.govinfo.gov/content/pkg/CHRG-117hhrg46728/pdf/CHRG-117hhrg46728.pdf","9.9 MB","https://www.govinfo.gov/content/pkg/CHRG-117hhrg46728/html/CHRG-117hhrg46728.htm","391.2 KB","","0 B","","0 B","","0 B"," ON APPROPRIATIONS HOUSE OF REPRESENTATIVES ONE HUNDRED SEVENTEENTH CONGRESS FIRST SESSION _________ SUBCOMMITTEE ON LABOR, HEALTH AND HUMAN SERVICES, EDUCATION, AND RELATED AGENCIES ROSA L. DeLAURO, Connecticut, Chair LUCILLE ROYBAL-ALLARD, California BARBARA LEE, California MARK POCAN, Wisconsin KATHERINE M. CLARK, Massachusetts LOIS FRANKEL, ...","","2021-05-25"
"485","Congressional Hearings","CHRG-117shrg44784","CHRG-117shrg44784","Nomination of Shalanda D. Young and Jason S. Miller","https://www.govinfo.gov/app/details/CHRG-117shrg44784/CHRG-117shrg44784","https://www.govinfo.gov/content/pkg/CHRG-117shrg44784/pdf/CHRG-117shrg44784.pdf","5.7 MB","https://www.govinfo.gov/content/pkg/CHRG-117shrg44784/html/CHRG-117shrg44784.htm","138.3 KB","","0 B","","0 B","","0 B"," STATES SENATE ONE HUNDRED SEVENTEENTH CONGRESS FIRST SESSION NOMINATION OF SHALANDA D. YOUNG TO BE DEPUTY DIRECTOR, OFFICE OF MANAGEMENT AND BUDGET AND JASON S. MILLER TO BE DEPUTY DIRECTOR FOR MANAGEMENT, OFFICE OF MANAGEMENT AND BUDGET MARCH 4, 2021 Available via the World Wide Web: http://www.govinfo.gov Printed for the use of the Committee on ...","","2021-03-04"
"486","Congressional Hearings","CHRG-117shrg46843","CHRG-117shrg46843","Business Meeting","https://www.govinfo.gov/app/details/CHRG-117shrg46843/CHRG-117shrg46843","https://www.govinfo.gov/content/pkg/CHRG-117shrg46843/pdf/CHRG-117shrg46843.pdf","42.6 MB","https://www.govinfo.gov/content/pkg/CHRG-117shrg46843/html/CHRG-117shrg46843.htm","71.3 KB","","0 B","","0 B","","0 B"," SESSION MAY 26, 2021 Printed for the use of the Committee on Environment and Public Works [GRAPHIC NOT AVAILABLE IN TIFF FORMAT] Available via the World Wide Web: http://www.govinfo.gov U.S. GOVERNMENT PUBLISHING OFFICE 46-843 PDF WASHINGTON : 2022 COMMITTEE ON ENVIRONMENT AND PUBLIC WORKS ONE HUNDRED SEVENTEENTH CONGRESS FIRST SESSION THOMAS R. ...","","2021-05-26"
"487","Congressional Hearings","CHRG-117shrg48327","CHRG-117shrg48327","Nominations of Andrea Joan Palm, to Be Deputy Secretary, Department of Health and Human Services; and Chiquita Brooks-Lasure, to Be Administrator, Centers for Medicare and Medicaid Services","https://www.govinfo.gov/app/details/CHRG-117shrg48327/CHRG-117shrg48327","https://www.govinfo.gov/content/pkg/CHRG-117shrg48327/pdf/CHRG-117shrg48327.pdf","1.3 MB","https://www.govinfo.gov/content/pkg/CHRG-117shrg48327/html/CHRG-117shrg48327.htm","553.6 KB","","0 B","","0 B","","0 B"," CONGRESS FIRST SESSION on the NOMINATIONS OF ANDREA JOAN PALM, TO BE DEPUTY SECRETARY, DEPARTMENT OF HEALTH AND HUMAN SERVICES; AND CHIQUITA BROOKS-LaSURE, TO BE ADMINISTRATOR, CENTERS FOR MEDICARE AND MEDICAID SERVICES APRIL 15, 2021 [GRAPHIC(S) NOT AVAILABLE IN TIFF FORMAT] Printed for the use of the Committee on Finance _________ U.S....","","2021-04-15"
"488","Congressional Hearings","CHRG-117shrg49554","CHRG-117shrg49554","Domestic Violent Extremism in America","https://www.govinfo.gov/app/details/CHRG-117shrg49554/CHRG-117shrg49554","https://www.govinfo.gov/content/pkg/CHRG-117shrg49554/pdf/CHRG-117shrg49554.pdf","315.5 KB","https://www.govinfo.gov/content/pkg/CHRG-117shrg49554/html/CHRG-117shrg49554.htm","305.2 KB","","0 B","","0 B","","0 B"," FIRST SESSION SPECIAL HEARING MAY 12, 2021--WASHINGTON, DC Printed for the use of the Committee on Appropriations [GRAPHIC NOT AVAILABLE IN TIFF FORMAT] Available via the World Wide Web: http://www.govinfo.gov U.S. GOVERNMENT PUBLISHING OFFICE 49-554 PDF WASHINGTON : 2022 COMMITTEE ON APPROPRIATIONS PATRICK LEAHY, Vermont, Chairman PATTY ...","","2021-05-12"
"489","Congressional Hearings","CHRG-117shrg47082","CHRG-117shrg47082","21st Century Economy: Protecting the Financial System from Risks Associated with Climate Change","https://www.govinfo.gov/app/details/CHRG-117shrg47082/CHRG-117shrg47082","https://www.govinfo.gov/content/pkg/CHRG-117shrg47082/pdf/CHRG-117shrg47082.pdf","108.9 MB","https://www.govinfo.gov/content/pkg/CHRG-117shrg47082/html/CHRG-117shrg47082.htm","400.9 KB","","0 B","","0 B","","0 B",",HOUSING,AND URBAN AFFAIRS UNITED STATES SENATE ONE HUNDRED SEVENTEENTH CONGRESS FIRST SESSION ON EXAMINING THE RISK CLIMATE CHANGE POSES TO OUR ECONOMY MARCH 18, 2021 Printed for the use of the Committee on Banking, Housing, and Urban Affairs [GRAPHIC NOT AVAILABLE IN TIFF FORMAT] U.S. GOVERNMENT PUBLISHING OFFICE 47-082 PDF WASHINGTON : 2022 ...","","2021-03-18"
"490","Congressional Hearings","CHRG-117shrg53137","CHRG-117shrg53137","Oversight of the U.S. Airline Industry","https://www.govinfo.gov/app/details/CHRG-117shrg53137/CHRG-117shrg53137","https://www.govinfo.gov/content/pkg/CHRG-117shrg53137/pdf/CHRG-117shrg53137.pdf","8.4 MB","https://www.govinfo.gov/content/pkg/CHRG-117shrg53137/html/CHRG-117shrg53137.htm","906.1 KB","","0 B","","0 B","","0 B"," HUNDRED SEVENTEENTH CONGRESS FIRST SESSION DECEMBER 15, 2021 Printed for the use of the Committee on Commerce, Science, and Transportation [GRAPHIC NOT AVAILABLE IN TIFF FORMAT] Available online: http://www.govinfo.gov U.S. GOVERNMENT PUBLISHING OFFICE 53-137 PDF WASHINGTON : 2023 SENATE COMMITTEE ON COMMERCE, SCIENCE, AND TRANSPORTATION ONE ...","","2021-12-15"
"491","Congressional Hearings","CHRG-117hhrg49890","CHRG-117hhrg49890","ENERGY AND WATER DEVELOPMENT APPROPRIATIONS FOR 2023","https://www.govinfo.gov/app/details/CHRG-117hhrg49890/CHRG-117hhrg49890","https://www.govinfo.gov/content/pkg/CHRG-117hhrg49890/pdf/CHRG-117hhrg49890.pdf","49.4 MB","https://www.govinfo.gov/content/pkg/CHRG-117hhrg49890/html/CHRG-117hhrg49890.htm","2.4 KB","","0 B","","0 B","","0 B"," SEVENTEENTH CONGRESS SECOND SESSION SUBCOMMITTEE ON ENERGY AND WATER DEVELOPMENT, AND RELATED AGENCIES MARCY KAPTUR, Ohio, Chairwoman DEBBIE WASSERMAN SCHULTZ, Florida ANN KIRKPATRICK, Arizona SUSIE LEE, Nevada TIM RYAN, Ohio DEREK KILMER, Washington LOIS FRANKEL, Florida CHERI BUSTOS, Illinois BONNIE WATSON COLEMAN, New Jersey MICHAEL K. ...","","2021-01-01"
"492","Congressional Hearings","CHRG-117hhrg49397","CHRG-117hhrg49397","A Hearing to Review the State of the Livestock Industry","https://www.govinfo.gov/app/details/CHRG-117hhrg49397/CHRG-117hhrg49397","https://www.govinfo.gov/content/pkg/CHRG-117hhrg49397/pdf/CHRG-117hhrg49397.pdf","25.4 MB","https://www.govinfo.gov/content/pkg/CHRG-117hhrg49397/html/CHRG-117hhrg49397.htm","1.3 MB","","0 B","","0 B","","0 B","CONGRESS FIRST SESSION OCTOBER 7, 2021 Serial No. 117-18 [GRAPHIC NOT AVAILABLE IN TIFF FORMAT] Printed for the use of the Committee on Agriculture agriculture.house.gov A HEARING TO REVIEW THE STATE OF THE LIVESTOCK INDUSTRY HEARING BEFORE THE COMMITTEE ON AGRICULTURE HOUSE OF REPRESENTATIVES ONE HUNDRED SEVENTEENTH CONGRESS FIRST SESSION OCTOBER ...","","2021-10-07"
"493","Congressional Hearings","CHRG-117shrg52803","CHRG-117shrg52803","Nominations of Christi A. Grimm, to Be Inspector General, Department of Health and Human Services; and Neil H. Macbride, to Be General Counsel, Department of the Treasury","https://www.govinfo.gov/app/details/CHRG-117shrg52803/CHRG-117shrg52803","https://www.govinfo.gov/content/pkg/CHRG-117shrg52803/pdf/CHRG-117shrg52803.pdf","421.5 KB","https://www.govinfo.gov/content/pkg/CHRG-117shrg52803/html/CHRG-117shrg52803.htm","473.1 KB","","0 B","","0 B","","0 B"," CONGRESS FIRST SESSION on the NOMINATIONS OF CHRISTI A. GRIMM, TO BE INSPECTOR GENERAL, DEPARTMENT OF HEALTH AND HUMAN SERVICES; AND NEIL H. MacBRIDE, TO BE GENERAL COUNSEL, DEPARTMENT OF THE TREASURY SEPTEMBER 22, 2021 [GRAPHIC NOT AVAILABLE IN TIFF FORMAT] Printed for the use of the Committee on Finance ______ U.S. GOVERNMENT PUBLISHING ...","","2021-09-22"
"494","Congressional Hearings","CHRG-117shrg53059","CHRG-117shrg53059","Nomination of Polly E. Trottenberg, Nominee to Be Deputy Secretary, U.S. Department of Transportation","https://www.govinfo.gov/app/details/CHRG-117shrg53059/CHRG-117shrg53059","https://www.govinfo.gov/content/pkg/CHRG-117shrg53059/pdf/CHRG-117shrg53059.pdf","1.5 MB","https://www.govinfo.gov/content/pkg/CHRG-117shrg53059/html/CHRG-117shrg53059.htm","362.5 KB","","0 B","","0 B","","0 B"," COMMERCE, SCIENCE, AND TRANSPORTATION UNITED STATES SENATE ONE HUNDRED SEVENTEENTH CONGRESS FIRST SESSION MARCH 3, 2021 Printed for the use of the Committee on Commerce, Science, and Transportation Available online: http://www.govinfo.gov ______ U.S. GOVERNMENT PUBLISHING OFFICE 53-059 WASHINGTON : 2023 ONE HUNDRED SEVENTEENTH CONGRESS FIRST ...","","2021-03-03"
"495","Congressional Hearings","CHRG-117shrg47552","CHRG-117shrg47552","Authorizations of Use of Force: Administration Perspectives","https://www.govinfo.gov/app/details/CHRG-117shrg47552/CHRG-117shrg47552","https://www.govinfo.gov/content/pkg/CHRG-117shrg47552/pdf/CHRG-117shrg47552.pdf","215.8 KB","https://www.govinfo.gov/content/pkg/CHRG-117shrg47552/html/CHRG-117shrg47552.htm","149.9 KB","","0 B","","0 B","","0 B"," HUNDRED SEVENTEENTH CONGRESS FIRST SESSION AUGUST 3, 2021 Printed for the use of the Committee on Foreign Relations [GRAPHIC(S) NOT AVAILABLE IN TIFF FORMAT] Available via http://www.govinfo.gov ______ U.S. GOVERNMENT PUBLISHING OFFICE 47-552 PDF WASHINGTON : 2022 COMMITTEE ON FOREIGN RELATIONS ROBERT MENENDEZ, New Jersey, Chairman BENJAMIN L. ...","","2021-08-03"
"496","Congressional Hearings","CHRG-117hhrg44664","CHRG-117hhrg44664","Banking Innovation or Regulatory Evasion? Exploring Trends in Financial Institution Charters","https://www.govinfo.gov/app/details/CHRG-117hhrg44664/CHRG-117hhrg44664","https://www.govinfo.gov/content/pkg/CHRG-117hhrg44664/pdf/CHRG-117hhrg44664.pdf","34.1 MB","https://www.govinfo.gov/content/pkg/CHRG-117hhrg44664/html/CHRG-117hhrg44664.htm","150.5 KB","","0 B","","0 B","","0 B"," AND FINANCIAL INSTITUTIONS OF THE COMMITTEE ON FINANCIAL SERVICES U.S. HOUSE OF REPRESENTATIVES ONE HUNDRED SEVENTEENTH CONGRESS FIRST SESSION APRIL 15, 2021 Printed for the use of the Committee on Financial Services Serial No. 117-16 [GRAPHIC NOT AVAILABLE IN TIFF FORMAT] U.S. GOVERNMENT PUBLISHING OFFICE 44-664 PDF WASHINGTON : 2021 HOUSE ...","","2021-04-15"
"497","Congressional Hearings","CHRG-117hhrg44957","CHRG-117hhrg44957","Legislative Hearing on H.R. 660, ""Shovel-Ready Restoration Grants for Coastlines and Fisheries Act of 2021""; H.R. 1415, ""Tribal Coastal Resiliency Act""; H.R. 1689, ""Offshore Wind for Territories Act""; H.R. 2750, ""Blue Carbon for Our Planet Act""; H.R. 3160, ""Keep America's Waterfronts Working Act""; H.R. 3228, ""National Coastal Resilience Data and Services Act""; H.R. 3692, ""Marine Mammal Climate Change Protection Act""; H.R. 3748, ""Blue Globe Act""; H.R. 3764, ""Ocean-Based Climate Solutions Act of 2021""; H.R. 3817, ""Regional Ocean Partnership Act""; H.R. 3864, ""Chesapeake Bay Oyster Research Act""; H.R. 3892, ""National Oceans and Coastal Security Improvements Act""; and H.R. 3906, ""Blue Carbon Protection Act""","https://www.govinfo.gov/app/details/CHRG-117hhrg44957/CHRG-117hhrg44957","https://www.govinfo.gov/content/pkg/CHRG-117hhrg44957/pdf/CHRG-117hhrg44957.pdf","12.9 MB","https://www.govinfo.gov/content/pkg/CHRG-117hhrg44957/html/CHRG-117hhrg44957.htm","425.1 KB","","0 B","","0 B","","0 B"," HEARING BEFORE THE COMMITTEE ON NATURAL RESOURCES U.S. HOUSE OF REPRESENTATIVES ONE HUNDRED SEVENTEENTH CONGRESS FIRST SESSION Tuesday, June 22, 2021 Serial No. 117-6 Printed for the use of the Committee on Natural Resources [GRAPHIC NOT AVAILABLE IN TIFF FORMAT] Available via the World Wide Web: http://www.govinfo.gov or Committee address:...","","2021-06-22"
"498","Congressional Hearings","CHRG-117shrg52232","CHRG-117shrg52232","New Era for Consumer Protection: The Consumer Financial Protection Bureau's Semiannual Report to Congress","https://www.govinfo.gov/app/details/CHRG-117shrg52232/CHRG-117shrg52232","https://www.govinfo.gov/content/pkg/CHRG-117shrg52232/pdf/CHRG-117shrg52232.pdf","8.9 MB","https://www.govinfo.gov/content/pkg/CHRG-117shrg52232/html/CHRG-117shrg52232.htm","160.6 KB","","0 B","","0 B","","0 B"," ON BANKING,HOUSING,AND URBAN AFFAIRS UNITED STATES SENATE ONE HUNDRED SEVENTEENTH CONGRESS FIRST SESSION ON CONSUMER FINANCIAL PROTECTION BUREAU'S SEMIANNUAL REPORT TO CONGRESS OCTOBER 28, 2021 Printed for the use of the Committee on Banking, Housing, and Urban Affairs [GRAPHIC NOT AVAILABLE IN TIFF FORMAT] Available at: https: //www.govinfo.gov/...","","2021-10-28"
"499","Congressional Hearings","CHRG-117hhrg44926","CHRG-117hhrg44926","Cmmc Implementation: What IT Means for Small Businesses","https://www.govinfo.gov/app/details/CHRG-117hhrg44926/CHRG-117hhrg44926","https://www.govinfo.gov/content/pkg/CHRG-117hhrg44926/pdf/CHRG-117hhrg44926.pdf","53.8 MB","https://www.govinfo.gov/content/pkg/CHRG-117hhrg44926/html/CHRG-117hhrg44926.htm","78.6 KB","","0 B","","0 B","","0 B"," ON SMALL BUSINESS UNITED STATES HOUSE OF REPRESENTATIVES ONE HUNDRED SEVENTEENTH CONGRESS FIRST SESSION HEARING HELD JUNE 24, 2021 [GRAPHICS NOT AVAILABLE IN TIFF FORMAT] Small Business Committee Document Number 117-021 Available via the GPO Website: www.govinfo.gov U.S. GOVERNMENT PUBLISHING OFFICE 44-926 WASHINGTON : 2021 HOUSE COMMITTEE ON ...","","2021-06-24"
"500","Congressional Hearings","CHRG-117hhrg45997","CHRG-117hhrg45997","The Community College Pipeline to Small Businesses","https://www.govinfo.gov/app/details/CHRG-117hhrg45997/CHRG-117hhrg45997","https://www.govinfo.gov/content/pkg/CHRG-117hhrg45997/pdf/CHRG-117hhrg45997.pdf","1.4 MB","https://www.govinfo.gov/content/pkg/CHRG-117hhrg45997/html/CHRG-117hhrg45997.htm","87.7 KB","","0 B","","0 B","","0 B","COMMITTEE ON SMALL BUSINESS UNITED STATES HOUSE OF REPRESENTATIVES ONE HUNDRED SEVENTEENTH CONGRESS FIRST SESSION HEARING HELD NOVEMBER 4, 2021 [GRAPHIC NOT AVAILABLE IN TIFF FORMAT Small Business Committee Document Number 117-040 Available via the GPO Website: www.govinfo.gov U.S. GOVERNMENT PUBLISHING OFFICE 45-997 WASHINGTON : 2022 HOUSE ...","","2021-11-04"
