"index","collection","packageId","granuleId","title","detailsLink","pdfLink","pdfSize","htmlLink","htmlSize","xmlLink","xmlSize","otherLink1","other1Size","otherLink2","other2Size","teaser","historical","publishdate"
"377","Congressional Hearings","CHRG-118hhrg52767","CHRG-118hhrg52767","Continuing U.S. Leadership in Commercial Space at Home and Abroad","https://www.govinfo.gov/app/details/CHRG-118hhrg52767/CHRG-118hhrg52767","https://www.govinfo.gov/content/pkg/CHRG-118hhrg52767/pdf/CHRG-118hhrg52767.pdf","32.7 MB","https://www.govinfo.gov/content/pkg/CHRG-118hhrg52767/html/CHRG-118hhrg52767.htm","182.4 KB","","0 B","","0 B","","0 B"," ONE HUNDRED EIGHTEENTH CONGRESS FIRST SESSION JULY 13, 2023 Serial No. 118-20 Printed for the use of the Committee on Science, Space, and Technology [GRAPHIC NOT AVAILABLE IN TIFF FORMAT] Available via the World Wide Web: http://science.house.gov U.S. GOVERNMENT PUBLISHING OFFICE 52-767PDF WASHINGTON : 2024 COMMITTEE ON SCIENCE, SPACE, ...","","2023-07-13"
"378","Congressional Hearings","CHRG-118hhrg54317","CHRG-118hhrg54317","Moving the Money: Understanding the Iranian Regime's Access to Money Around the World and How They Use IT to Support Terrorism","https://www.govinfo.gov/app/details/CHRG-118hhrg54317/CHRG-118hhrg54317","https://www.govinfo.gov/content/pkg/CHRG-118hhrg54317/pdf/CHRG-118hhrg54317.pdf","6.7 MB","https://www.govinfo.gov/content/pkg/CHRG-118hhrg54317/html/CHRG-118hhrg54317.htm","91.3 KB","","0 B","","0 B","","0 B"," ON OVERSIGHT AND INVESTIGATIONS OF THE COMMITTEE ON FINANCIAL SERVICES U.S. HOUSE OF REPRESENTATIVES ONE HUNDRED EIGHTEENTH CONGRESS FIRST SESSION OCTOBER 26, 2023 Printed for the use of the Committee on Financial Services Serial No. 118-52 [GRAPHIC NOT AVAILABLE IN TIFF FORMAT] U.S. GOVERNMENT PUBLISHING OFFICE 54-317 PDF WASHINGTON : ...","","2023-10-26"
"379","Congressional Hearings","CHRG-118hhrg54430","CHRG-118hhrg54430","Examining the Biden Administration's Afghanistan Policy Since the U.S. Withdrawal","https://www.govinfo.gov/app/details/CHRG-118hhrg54430/CHRG-118hhrg54430","https://www.govinfo.gov/content/pkg/CHRG-118hhrg54430/pdf/CHRG-118hhrg54430.pdf","24.7 MB","https://www.govinfo.gov/content/pkg/CHRG-118hhrg54430/html/CHRG-118hhrg54430.htm","117.2 KB","","0 B","","0 B","","0 B"," ONE HUNDRED EIGHTEENTH CONGRESS FIRST SESSION November 14, 2023 Serial No. 118-60 Printed for the use of the Committee on Foreign Affairs [GRAPHIC NOT AVAILABLE IN TIFF FORMAT] Available: http://www.foreignaffairs.house.gov/, http:// docs.house.gov, or http://www.govinfo.gov U.S. GOVERNMENT PUBLISHING OFFICE 54-430PDF WASHINGTON : 2024 ...","","2023-11-14"
"380","Congressional Hearings","CHRG-118hhrg53463","CHRG-118hhrg53463","Exposing the Woke, Wasteful, and Bloated Bureaucracy","https://www.govinfo.gov/app/details/CHRG-118hhrg53463/CHRG-118hhrg53463","https://www.govinfo.gov/content/pkg/CHRG-118hhrg53463/pdf/CHRG-118hhrg53463.pdf","26.9 MB","https://www.govinfo.gov/content/pkg/CHRG-118hhrg53463/html/CHRG-118hhrg53463.htm","201.5 KB","","0 B","","0 B","","0 B"," FIRST SESSION HEARING HELD IN WASHINGTON, D.C., MAY 11, 2023 Serial No. 118-3 Printed for the use of the Committee on the Budget [GRAPHIC NOT AVAILABLE IN TIFF FORMAT] Available on the Internet: www.govinfo.gov ______ U.S. GOVERNMENT PUBLISHING OFFICE 53-463 WASHINGTON : 2024 COMMITTEE ON THE BUDGET JODEY C. ARRINGTON, Texas, Chairman RALPH ...","","2023-05-11"
"381","Congressional Hearings","CHRG-118hhrg53047","CHRG-118hhrg53047","Evaluating High-Risk Security Vulnerabilities at Our Nation's Ports","https://www.govinfo.gov/app/details/CHRG-118hhrg53047/CHRG-118hhrg53047","https://www.govinfo.gov/content/pkg/CHRG-118hhrg53047/pdf/CHRG-118hhrg53047.pdf","210.5 KB","https://www.govinfo.gov/content/pkg/CHRG-118hhrg53047/html/CHRG-118hhrg53047.htm","120.0 KB","","0 B","","0 B","","0 B"," ON HOMELAND SECURITY HOUSE OF REPRESENTATIVES ONE HUNDRED EIGHTEENTH CONGRESS FIRST SESSION MAY 10, 2023 Serial No. 118-10 Printed for the use of the Committee on Homeland Security [GRAPHIC NOT AVAILABLE IN TIFF FORMAT] Available via the World Wide Web: http://www.govinfo.gov U.S. GOVERNMENT PUBLISHING OFFICE 53-047 PDF WASHINGTON : 2023 ...","","2023-05-10"
"382","Congressional Hearings","CHRG-118hhrg53076","CHRG-118hhrg53076","Oversight Hearing on Safeguarding American Jobs and Economic Growth: Examining the Future of the Offshore Leasing Program","https://www.govinfo.gov/app/details/CHRG-118hhrg53076/CHRG-118hhrg53076","https://www.govinfo.gov/content/pkg/CHRG-118hhrg53076/pdf/CHRG-118hhrg53076.pdf","3.3 MB","https://www.govinfo.gov/content/pkg/CHRG-118hhrg53076/html/CHRG-118hhrg53076.htm","212.9 KB","","0 B","","0 B","","0 B"," AND MINERAL RESOURCES of the COMMITTEE ON NATURAL RESOURCES U.S. HOUSE OF REPRESENTATIVES ONE HUNDRED EIGHTEENTH CONGRESS FIRST SESSION Thursday, July 27, 2023 Serial No. 118-52 Printed for the use of the Committee on Natural Resources [GRAPHIC NOT AVAILABLE IN TIFF FORMAT] Available via the World Wide Web: http://www.govinfo.gov or Committee ...","","2023-07-27"
"383","Congressional Hearings","CHRG-118hhrg52180","CHRG-118hhrg52180","Return on Unprecedented Investment: An Analysis of the Department of Energy's Implementation of the Iija, the Ira, and the Chips and Science Act","https://www.govinfo.gov/app/details/CHRG-118hhrg52180/CHRG-118hhrg52180","https://www.govinfo.gov/content/pkg/CHRG-118hhrg52180/pdf/CHRG-118hhrg52180.pdf","10.3 MB","https://www.govinfo.gov/content/pkg/CHRG-118hhrg52180/html/CHRG-118hhrg52180.htm","133.4 KB","","0 B","","0 B","","0 B"," HEARING BEFORE THE SUBCOMMITTEE ON ENERGY SUBCOMMITTEE ON INVESTIGATIONS AND OVERSIGHT OF THE COMMITTEE ON SCIENCE, SPACE, AND TECHNOLOGY OF THE HOUSE OF REPRESENTATIVES ONE HUNDRED EIGHTEENTH CONGRESS FIRST SESSION MAY 10, 2023 Serial No. 118-12 Printed for the use of the Committee on Science, Space, and Technology [GRAPHIC(S) NOT AVAILABLE IN ...","","2023-05-10"
"384","Congressional Hearings","CHRG-118hhrg53465","CHRG-118hhrg53465","Reigniting American Growth and Prosperity Series: Incentivizing Economic Excellence Through Tax Policy","https://www.govinfo.gov/app/details/CHRG-118hhrg53465/CHRG-118hhrg53465","https://www.govinfo.gov/content/pkg/CHRG-118hhrg53465/pdf/CHRG-118hhrg53465.pdf","66.4 MB","https://www.govinfo.gov/content/pkg/CHRG-118hhrg53465/html/CHRG-118hhrg53465.htm","169.3 KB","","0 B","","0 B","","0 B"," OF REPRESENTATIVES ONE HUNDRED EIGHTEENTH CONGRESS FIRST SESSION HEARING HELD IN WASHINGTON, D.C., JUNE 22, 2023 Serial No. 118-5 Printed for the use of the Committee on the Budget [GRAPHIC(S) NOT AVAILABLE IN TIFF FORMAT] Available on the Internet: www.govinfo.gov _______ U.S. GOVERNMENT PUBLISHING OFFICE 53-465 WASHINGTON : 2024 COMMITTEE ON ...","","2023-06-22"
"385","Congressional Hearings","CHRG-118hhrg53037","CHRG-118hhrg53037","Producer Perspectives on the 2023 Farm Bill","https://www.govinfo.gov/app/details/CHRG-118hhrg53037/CHRG-118hhrg53037","https://www.govinfo.gov/content/pkg/CHRG-118hhrg53037/pdf/CHRG-118hhrg53037.pdf","2.2 MB","https://www.govinfo.gov/content/pkg/CHRG-118hhrg53037/html/CHRG-118hhrg53037.htm","516.6 KB","","0 B","","0 B","","0 B"," ON AGRICULTURE HOUSE OF REPRESENTATIVES ONE HUNDRED EIGHTEENTH CONGRESS FIRST SESSION APRIL 26, 2023 Serial No. 118-8 [GRAPHIC NOT AVAILABLE IN TIFF FORMAT] Printed for the use of the Committee on Agriculture agriculture.house.gov U.S. GOVERNMENT PUBLISHING OFFICE 53-037 PDF WASHINGTON : 2023 COMMITTEE ON AGRICULTURE GLENN THOMPSON, Pennsylvania, ...","","2023-04-26"
"386","Congressional Hearings","CHRG-118hhrg52383","CHRG-118hhrg52383","[H.A.S.C. No. 118-22] Hearing on National Defense Authorization Act for Fiscal Year 2024 and Oversight of Previously Authorized Programs Before the Committee on Armed Services House of Representatives One Hundred Eighteenth Congress First Session","https://www.govinfo.gov/app/details/CHRG-118hhrg52383/CHRG-118hhrg52383","https://www.govinfo.gov/content/pkg/CHRG-118hhrg52383/pdf/CHRG-118hhrg52383.pdf","6.0 MB","https://www.govinfo.gov/content/pkg/CHRG-118hhrg52383/html/CHRG-118hhrg52383.htm","168.9 KB","","0 B","","0 B","","0 B"," ON ARMED SERVICES HOUSE OF REPRESENTATIVES ONE HUNDRED EIGHTEENTH CONGRESS FIRST SESSION SUBCOMMITTEE ON TACTICAL AIR AND LAND FORCES HEARING ON FISCAL YEAR 2024 BUDGET REQUEST OF THE DEPARTMENT OF DEFENSE FOR FIXED-WING TACTICAL AND TRAINING AIRCRAFT PROGRAMS HEARING HELD MARCH 29, 2023 [GRAPHIC NOT AVAILABLE IN TIFF FORMAT] U.S. ...","","2023-03-29"
"387","Congressional Hearings","CHRG-118hhrg53870","CHRG-118hhrg53870","Oversight of the SEC's Division of Corporation Finance","https://www.govinfo.gov/app/details/CHRG-118hhrg53870/CHRG-118hhrg53870","https://www.govinfo.gov/content/pkg/CHRG-118hhrg53870/pdf/CHRG-118hhrg53870.pdf","36.1 MB","https://www.govinfo.gov/content/pkg/CHRG-118hhrg53870/html/CHRG-118hhrg53870.htm","92.9 KB","","0 B","","0 B","","0 B"," HOUSE OF REPRESENTATIVES ONE HUNDRED EIGHTEENTH CONGRESS FIRST SESSION JULY 18, 2023 Printed for the use of the Committee on Financial Services Serial No. 118-42 [GRAPHIC NOT AVAILABLE IN TIFF FORMAT] U.S. GOVERNMENT PUBLISHING OFFICE 53-870 PDF WASHINGTON : 2024 HOUSE COMMITTEE ON FINANCIAL SERVICES PATRICK McHENRY, North Carolina, Chairman FRANK...","","2023-07-18"
"388","Congressional Hearings","CHRG-118hhrg53021","CHRG-118hhrg53021","Member Day","https://www.govinfo.gov/app/details/CHRG-118hhrg53021/CHRG-118hhrg53021","https://www.govinfo.gov/content/pkg/CHRG-118hhrg53021/pdf/CHRG-118hhrg53021.pdf","3.0 MB","https://www.govinfo.gov/content/pkg/CHRG-118hhrg53021/html/CHRG-118hhrg53021.htm","62.1 KB","","0 B","","0 B","","0 B","16, 2023 [GRAPHIC(S) NOT AVAILABLE IN TIFF FORMAT] ------- U.S. GOVERNMENT PUBLISHING OFFICE 53-021 WASHINGTON : 2024 COMMITTEE ON ARMED SERVICES One Hundred Eighteenth Congress MIKE ROGERS, Alabama, Chairman JOE WILSON, South Carolina ADAM SMITH, Washington MICHAEL R. TURNER, Ohio JOE COURTNEY, Connecticut DOUG LAMBORN, Colorado JOHN GARAMENDI, ...","","2023-05-16"
"389","Congressional Hearings","CHRG-118hhrg56341","CHRG-118hhrg56341","Evaluating Federal Cybersecurity Governance","https://www.govinfo.gov/app/details/CHRG-118hhrg56341/CHRG-118hhrg56341","https://www.govinfo.gov/content/pkg/CHRG-118hhrg56341/pdf/CHRG-118hhrg56341.pdf","232.0 KB","https://www.govinfo.gov/content/pkg/CHRG-118hhrg56341/html/CHRG-118hhrg56341.htm","153.9 KB","","0 B","","0 B","","0 B"," SECURITY HOUSE OF REPRESENTATIVES ONE HUNDRED EIGHTEENTH CONGRESS FIRST SESSION OCTOBER 25, 2023 Serial No. 118-36 Printed for the use of the Committee on Homeland Security [GRAPHIC(S) NOT AVAILABLE IN TIFF FORMAT] Available via the World Wide Web: http://www.govinfo.gov U.S. GOVERNMENT PUBLISHING OFFICE 56-341 PDF WASHINGTON : 2024 COMMITTEE ON...","","2023-10-25"
"390","Congressional Hearings","CHRG-118shrg53538","CHRG-118shrg53538","The Assault on Reproductive Rights in a Post-Dobbs America","https://www.govinfo.gov/app/details/CHRG-118shrg53538/CHRG-118shrg53538","https://www.govinfo.gov/content/pkg/CHRG-118shrg53538/pdf/CHRG-118shrg53538.pdf","29.2 MB","https://www.govinfo.gov/content/pkg/CHRG-118shrg53538/html/CHRG-118shrg53538.htm","153.5 KB","","0 B","","0 B","","0 B"," EIGHTEENTH CONGRESS FIRST SESSION APRIL 26, 2023 Serial No. J-118-13 Printed for the use of the Committee on the Judiciary [GRAPHIC NOT AVAILABLE IN TIFF FORMAT] www.judiciary.senate.gov www.govinfo.gov U.S. GOVERNMENT PUBLISHING OFFICE 53-538 PDF WASHINGTON : 2024 COMMITTEE ON THE JUDICIARY RICHARD J. DURBIN, Illinois, Chair DIANNE FEINSTEIN,...","","2023-04-26"
"391","Congressional Hearings","CHRG-118hhrg52263","CHRG-118hhrg52263","Oversight Hearing on Examining the Mineral Wealth of Northern Minnesota","https://www.govinfo.gov/app/details/CHRG-118hhrg52263/CHRG-118hhrg52263","https://www.govinfo.gov/content/pkg/CHRG-118hhrg52263/pdf/CHRG-118hhrg52263.pdf","2.1 MB","https://www.govinfo.gov/content/pkg/CHRG-118hhrg52263/html/CHRG-118hhrg52263.htm","103.7 KB","","0 B","","0 B","","0 B"," NATURAL RESOURCES U.S. HOUSE OF REPRESENTATIVES ONE HUNDRED EIGHTEENTH CONGRESS FIRST SESSION Tuesday, May 2, 2023, in Mountain Iron, Minnesota Serial No. 118-21 Printed for the use of the Committee on Natural Resources [GRAPHIC NOT AVAILABLE IN TIFF FORMAT] Available via the World Wide Web: http://www.govinfo.gov or Committee address: http://...","","2023-05-02"
"392","Congressional Hearings","CHRG-118hhrg52640","CHRG-118hhrg52640","Clearing the Air: Examining the Environmental Protection Agency's Proposed Emissions Standards","https://www.govinfo.gov/app/details/CHRG-118hhrg52640/CHRG-118hhrg52640","https://www.govinfo.gov/content/pkg/CHRG-118hhrg52640/pdf/CHRG-118hhrg52640.pdf","172.4 KB","https://www.govinfo.gov/content/pkg/CHRG-118hhrg52640/html/CHRG-118hhrg52640.htm","70.3 KB","","0 B","","0 B","","0 B"," POLICY, AND REGULATORY AFFAIRS OF THE COMMITTEE ON OVERSIGHT AND ACCOUNTABILITY HOUSE OF REPRESENTATIVES ONE HUNDRED EIGHTEENTH CONGRESS FIRST SESSION JUNE 21, 2023 Serial No. 118-44 Printed for the use of the Committee on Oversight and Accountability [GRAPHIC(S) NOT AVAILABLE IN TIFF FORMAT] Available on: govinfo.gov, oversight.house.gov or ...","","2023-06-21"
"393","Congressional Hearings","CHRG-118jhrg53818","CHRG-118jhrg53818","Growing the Economy of the Future: Job Training for the Clean Energy Transition","https://www.govinfo.gov/app/details/CHRG-118jhrg53818/CHRG-118jhrg53818","https://www.govinfo.gov/content/pkg/CHRG-118jhrg53818/pdf/CHRG-118jhrg53818.pdf","6.8 MB","https://www.govinfo.gov/content/pkg/CHRG-118jhrg53818/html/CHRG-118jhrg53818.htm","95.3 KB","","0 B","","0 B","","0 B"," OF THE UNITED STATES ONE HUNDRED EIGHTEENTH CONGRESS FIRST SESSION SEPTEMBER 20, 2023 Printed for the use of the Joint Economic Committee [GRAPHIC NOT AVAILABLE IN TIFF FORMAT] Available via the World Wide Web: http://www.govinfo.gov ______ U.S. GOVERNMENT PUBLISHING OFFICE 53-818 WASHINGTON : 2024 JOINT ECONOMIC COMMITTEE [Created pursuant ...","","2023-09-20"
"394","Congressional Hearings","CHRG-118hhrg53426","CHRG-118hhrg53426","A Review of Science and Technology Activities at the Environmental Protection Agency and the Use of Science in Regulatory and Deregulatory Decision-Making","https://www.govinfo.gov/app/details/CHRG-118hhrg53426/CHRG-118hhrg53426","https://www.govinfo.gov/content/pkg/CHRG-118hhrg53426/pdf/CHRG-118hhrg53426.pdf","18.6 MB","https://www.govinfo.gov/content/pkg/CHRG-118hhrg53426/html/CHRG-118hhrg53426.htm","199.7 KB","","0 B","","0 B","","0 B"," HEARING BEFORE THE COMMITTEE ON SCIENCE, SPACE, AND TECHNOLOGY OF THE HOUSE OF REPRESENTATIVES ONE HUNDRED EIGHTEENTH CONGRESS FIRST SESSION SEPTEMBER 27, 2023 Serial No. 118-26 Printed for the use of the Committee on Science, Space, and Technology [GRAPHIC NOT AVAILABLE IN TIFF FORMAT] Available via the World Wide Web: http://...","","2023-09-27"
"395","Congressional Hearings","CHRG-118hhrg55696","CHRG-118hhrg55696","Ethiopia: Promise or Perils, the State of U.S. Policy","https://www.govinfo.gov/app/details/CHRG-118hhrg55696/CHRG-118hhrg55696","https://www.govinfo.gov/content/pkg/CHRG-118hhrg55696/pdf/CHRG-118hhrg55696.pdf","9.9 MB","https://www.govinfo.gov/content/pkg/CHRG-118hhrg55696/html/CHRG-118hhrg55696.htm","78.3 KB","","0 B","","0 B","","0 B"," ONE HUNDRED EIGHTEENTH CONGRESS FIRST SESSION NOVEMBER 30, 2023 Serial No. 118-68 Printed for the use of the Committee on Foreign Affairs [GRAPHIC NOT AVAILABLE IN TIFF FORMAT] Available: http://www.foreignaffairs.house.gov/, http://docs.house.gov, or http://www.govinfo.gov U.S. GOVERNMENT PUBLISHING OFFICE 55-696PDF WASHINGTON : 2024 ...","","2023-11-30"
"396","Congressional Hearings","CHRG-118shrg52706","CHRG-118shrg52706","Oversight of A.I.: Rules for Artificial Intelligence","https://www.govinfo.gov/app/details/CHRG-118shrg52706/CHRG-118shrg52706","https://www.govinfo.gov/content/pkg/CHRG-118shrg52706/pdf/CHRG-118shrg52706.pdf","160.7 MB","https://www.govinfo.gov/content/pkg/CHRG-118shrg52706/html/CHRG-118shrg52706.htm","181.9 KB","","0 B","","0 B","","0 B"," ON THE JUDICIARY UNITED STATES SENATE ONE HUNDRED EIGHTEENTH CONGRESS FIRST SESSION MAY 16, 2023 Serial No. J-118-16 Printed for the use of the Committee on the Judiciary [GRAPHIC NOT AVAILABLE IN TIFF FORMAT] U.S. GOVERNMENT PUBLISHING OFFICE 52-706 PDF WASHINGTON : 2024 COMMITTEE ON THE JUDICIARY RICHARD J. DURBIN, Illinois, Chair DIANNE ...","","2023-05-16"
"397","Congressional Hearings","CHRG-118shrg50512","CHRG-118shrg50512","Energy and Water Development Appropriations for Fiscal Year 2024","https://www.govinfo.gov/app/details/CHRG-118shrg50512/CHRG-118shrg50512","https://www.govinfo.gov/content/pkg/CHRG-118shrg50512/pdf/CHRG-118shrg50512.pdf","1.1 MB","https://www.govinfo.gov/content/pkg/CHRG-118shrg50512/html/CHRG-118shrg50512.htm","250.3 KB","","0 B","","0 B","","0 B"," STATES SENATE ONE HUNDRED EIGHTEENTH CONGRESS FIRST SESSION ON H.R. 4394/S. 2587 AN ACT MAKING APPROPRIATIONS FOR ENERGY AND WATER DEVELOPMENT FOR THE FISCAL YEAR ENDING SEPTEMBER 30, 2024, AND FOR OTHER PURPOSES Department of Defense--Civil Department of Energy Department of the Interior Printed for the use of the Committee on Appropriations ...","","2023-04-26"
"398","Congressional Hearings","CHRG-118shrg52782","CHRG-118shrg52782","DHS Budget: Resources and Authorities Requested to Protect and Secure the Homeland","https://www.govinfo.gov/app/details/CHRG-118shrg52782/CHRG-118shrg52782","https://www.govinfo.gov/content/pkg/CHRG-118shrg52782/pdf/CHRG-118shrg52782.pdf","57.7 MB","https://www.govinfo.gov/content/pkg/CHRG-118shrg52782/html/CHRG-118shrg52782.htm","149.1 KB","","0 B","","0 B","","0 B","AND GOVERNMENTAL AFFAIRS UNITED STATES SENATE ONE HUNDRED EIGHTEENTH CONGRESS FIRST SESSION APRIL 18, 2023 Available via the World Wide Web: http://www.govinfo.gov Printed for the use of the Committee on Homeland Security and Governmental Affairs [GRAPHIC NOT AVAILABLE IN TIFF FORMAT] ________ U.S. GOVERNMENT PUBLISHING OFFICE 52-782 PDF WASHINGTON...","","2023-04-18"
"399","Congressional Hearings","CHRG-118shrg049104057","CHRG-118shrg049104057","Department of Homeland Security Appropriations for Fiscal Year 2024","https://www.govinfo.gov/app/details/CHRG-118shrg049104057/CHRG-118shrg049104057","https://www.govinfo.gov/content/pkg/CHRG-118shrg049104057/pdf/CHRG-118shrg049104057.pdf","245.2 KB","https://www.govinfo.gov/content/pkg/CHRG-118shrg049104057/html/CHRG-118shrg049104057.htm","203.9 KB","","0 B","","0 B","","0 B",", Washington, DC. The subcommittee met at 1:32 p.m. in room SD-192, Dirksen Senate Office Building, Hon. Chris Murphy (chairman) presiding. Present: Senators Murphy, Murray, Tester, Shaheen, Baldwin, Collins, Peters, Britt, Murkowski, Capito, Kennedy, and Hyde- Smith DEPARTMENT OF HOMELAND SECURITY STATEMENT OF HON. ALEJANDRO MAYORKAS, ...","","2023-03-29"
"400","Congressional Hearings","CHRG-118jhrg53719","CHRG-118jhrg53719","Combating Ransomware Attacks","https://www.govinfo.gov/app/details/CHRG-118jhrg53719/CHRG-118jhrg53719","https://www.govinfo.gov/content/pkg/CHRG-118jhrg53719/pdf/CHRG-118jhrg53719.pdf","203.6 KB","https://www.govinfo.gov/content/pkg/CHRG-118jhrg53719/html/CHRG-118jhrg53719.htm","111.6 KB","","0 B","","0 B","","0 B"," ON ECONOMIC GROWTH, ENERGY POLICY, AND REGULATORY AFFAIRS OF THE COMMITTEE ON OVERSIGHT AND ACCOUNTABILITY HOUSE OF REPRESENTATIVES ONE HUNDRED EIGHTEENTH CONGRESS FIRST SESSION SEPTEMBER 27, 2023 Serial No. 118-68 Printed for the use of the Committee on Oversight and Accountability [GRAPHIC(S) NOT AVAILABLE IN TIFF FORMAT] Available on: ...","","2023-09-27"
"401","Congressional Hearings","CHRG-118shrg53994","CHRG-118shrg53994","Threats to the Homeland","https://www.govinfo.gov/app/details/CHRG-118shrg53994/CHRG-118shrg53994","https://www.govinfo.gov/content/pkg/CHRG-118shrg53994/pdf/CHRG-118shrg53994.pdf","23.9 MB","https://www.govinfo.gov/content/pkg/CHRG-118shrg53994/html/CHRG-118shrg53994.htm","198.4 KB","","0 B","","0 B","","0 B"," CONGRESS FIRST SESSION OCTOBER 31, 2023 Available via the World Wide Web: http://www.govinfo.gov [GRAPHIC NOT AVAILABLE IN TIFF FORMAT] Printed for the use of the Committee on Homeland Security and Governmental Affairs U.S. GOVERNMENT PUBLISHING OFFICE 53-994 PDF WASHINGTON : 2025 COMMITTEE ON HOMELAND SECURITY AND GOVERNMENTAL AFFAIRS ...","","2023-10-31"
"402","Congressional Hearings","CHRG-118hhrg52421","CHRG-118hhrg52421","Fiscal Year 2024 Army Modernization Programs","https://www.govinfo.gov/app/details/CHRG-118hhrg52421/CHRG-118hhrg52421","https://www.govinfo.gov/content/pkg/CHRG-118hhrg52421/pdf/CHRG-118hhrg52421.pdf","1.3 MB","https://www.govinfo.gov/content/pkg/CHRG-118hhrg52421/html/CHRG-118hhrg52421.htm","118.9 KB","","0 B","","0 B","","0 B"," ON ARMED SERVICES HOUSE OF REPRESENTATIVES ONE HUNDRED EIGHTEENTH CONGRESS FIRST SESSION SUBCOMMITTEE ON TACTICAL AIR AND LAND FORCES HEARING ON FISCAL YEAR 2024 ARMY MODERNIZATION PROGRAMS HEARING HELD APRIL 26, 2023 [GRAPHIC(S) NOT AVAILABLE IN TIFF FORMAT] ______ U.S. GOVERNMENT PUBLISHING OFFICE 52-421 WASHINGTON : 2024 SUBCOMMITTEE ON...","","2023-04-26"
"403","Congressional Hearings","CHRG-118hhrg51834","CHRG-118hhrg51834","Fueling Unaffordability: How the Biden Administration's Policies Catalyzed Global Energy Scarcity and Compounded Inflation","https://www.govinfo.gov/app/details/CHRG-118hhrg51834/CHRG-118hhrg51834","https://www.govinfo.gov/content/pkg/CHRG-118hhrg51834/pdf/CHRG-118hhrg51834.pdf","169.3 KB","https://www.govinfo.gov/content/pkg/CHRG-118hhrg51834/html/CHRG-118hhrg51834.htm","66.1 KB","","0 B","","0 B","","0 B"," ON ECONOMIC GROWTH, ENERGY POLICY, AND REGULATORY AFFAIRS OF THE COMMITTEE ON OVERSIGHT AND ACCOUNTABILITY HOUSE OF REPRESENTATIVES ONE HUNDRED EIGHTEENTH CONGRESS FIRST SESSION MARCH 29, 2023 Serial No. 118-18 Printed for the use of the Committee on Oversight and Accountability [GRAPHIC NOT AVAILABLE IN TIFF FORMAT] Available on: govinfo.gov...","","2023-03-29"
"404","Congressional Hearings","CHRG-118hhrg54882","CHRG-118hhrg54882","Maritime Transportation Supply Chain Issues","https://www.govinfo.gov/app/details/CHRG-118hhrg54882/CHRG-118hhrg54882","https://www.govinfo.gov/content/pkg/CHRG-118hhrg54882/pdf/CHRG-118hhrg54882.pdf","1.4 MB","https://www.govinfo.gov/content/pkg/CHRG-118hhrg54882/html/CHRG-118hhrg54882.htm","212.0 KB","","0 B","","0 B","","0 B"," AND INFRASTRUCTURE HOUSE OF REPRESENTATIVES ONE HUNDRED EIGHTEENTH CONGRESS FIRST SESSION MARCH 28, 2023 Printed for the use of the Committee on Transportation and Infrastructure [GRAPHIC NOT AVAILABLE IN TIFF FORMAT] Available online at: https://www.govinfo.gov/committee/house- transportation?path=/browsecommittee/chamber/house/...","","2023-03-28"
"405","Congressional Hearings","CHRG-118jhrg54252","CHRG-118jhrg54252","Making Russia Pay: Sovereign Asset Confiscation for Ukrainian Victory","https://www.govinfo.gov/app/details/CHRG-118jhrg54252/CHRG-118jhrg54252","https://www.govinfo.gov/content/pkg/CHRG-118jhrg54252/pdf/CHRG-118jhrg54252.pdf","841.4 KB","https://www.govinfo.gov/content/pkg/CHRG-118jhrg54252/html/CHRG-118jhrg54252.htm","185.5 KB","","0 B","","0 B","","0 B"," COMMISSION U.S. HOUSE OF REPRESENTATIVES ONE HUNDRED EIGHTEENTH CONGRESS SECOND SESSION DECEMBER 6, 2023 Printed for the use of the Commission on Security and Cooperation in Europe [CSCE118-11] [GRAPHIC(S) NOT AVAILABLE IN TIFF FORMAT] Available via www.csce.gov ------ U.S. GOVERNMENT PUBLISHING OFFICE 54-252 WASHINGTON : 2024 COMMISSION ON ...","","2023-12-06"
"406","Congressional Hearings","CHRG-118hhrg54816","CHRG-118hhrg54816","Evaluating CISA's Federal Civilian Executive Branch Cybersecurity Programs","https://www.govinfo.gov/app/details/CHRG-118hhrg54816/CHRG-118hhrg54816","https://www.govinfo.gov/content/pkg/CHRG-118hhrg54816/pdf/CHRG-118hhrg54816.pdf","328.2 KB","https://www.govinfo.gov/content/pkg/CHRG-118hhrg54816/html/CHRG-118hhrg54816.htm","172.6 KB","","0 B","","0 B","","0 B"," OF THE COMMITTEE ON HOMELAND SECURITY HOUSE OF REPRESENTATIVES ONE HUNDRED EIGHTEENTH CONGRESS FIRST SESSION SEPTEMBER 19, 2023 Serial No. 118-29 Printed for the use of the Committee on Homeland Security [GRAPHIC NOT AVAILABLE IN TIFF FORMAT] Available via the World Wide Web: http://www.govinfo.gov ________ U.S. GOVERNMENT PUBLISHING OFFICE 54...","","2023-09-19"
"407","Congressional Hearings","CHRG-118hhrg54164","CHRG-118hhrg54164","Markup of Various Measures","https://www.govinfo.gov/app/details/CHRG-118hhrg54164/CHRG-118hhrg54164","https://www.govinfo.gov/content/pkg/CHRG-118hhrg54164/pdf/CHRG-118hhrg54164.pdf","21.8 MB","https://www.govinfo.gov/content/pkg/CHRG-118hhrg54164/html/CHRG-118hhrg54164.htm","193.3 KB","","0 B","","0 B","","0 B"," 7, 2023 Serial No. 118-58 Printed for the use of the Committee on Foreign Affairs [GRAPHIC NOT AVAILABLE IN TIFF FORMAT] Available: http://www.foreignaffairs.house.gov/, http:// docs.house.gov, or http://www.govinfo.gov U.S. GOVERNMENT PUBLISHING OFFICE 54-164 PDF WASHINGTON : 2023 COMMITTEE ON FOREIGN AFFAIRS MICHAEL T. McCAUL, Texas, ...","","2023-11-07"
"408","Congressional Hearings","CHRG-118hhrg56746","CHRG-118hhrg56746","The Sahel in Crisis: Examining U.S. Policy Options","https://www.govinfo.gov/app/details/CHRG-118hhrg56746/CHRG-118hhrg56746","https://www.govinfo.gov/content/pkg/CHRG-118hhrg56746/pdf/CHRG-118hhrg56746.pdf","17.5 MB","https://www.govinfo.gov/content/pkg/CHRG-118hhrg56746/html/CHRG-118hhrg56746.htm","80.7 KB","","0 B","","0 B","","0 B"," REPRESENTATIVES ONE HUNDRED EIGHTEENTH CONGRESS FIRST SESSION December 5, 2023 Serial No. 118-116 Printed for the use of the Committee on Foreign Affairs GRAPHIC(S) NOT AVAILABLE IN TIFF FORMAT Available: www.foreignaffairs.house.gov, docs.house.gov, or www.govinfo.gov _______ U.S. GOVERNMENT PUBLISHING OFFICE 56-746 PDF WASHINGTON : 2025 ...","","2023-12-05"
