"index","collection","packageId","granuleId","title","detailsLink","pdfLink","pdfSize","htmlLink","htmlSize","xmlLink","xmlSize","otherLink1","other1Size","otherLink2","other2Size","teaser","historical","publishdate"
"532","Congressional Hearings","CHRG-118shrg59104060","CHRG-118shrg59104060","Financial Services and General Government Appropriations for Fiscal Year 2024","https://www.govinfo.gov/app/details/CHRG-118shrg59104060/CHRG-118shrg59104060","https://www.govinfo.gov/content/pkg/CHRG-118shrg59104060/pdf/CHRG-118shrg59104060.pdf","183.9 KB","https://www.govinfo.gov/content/pkg/CHRG-118shrg59104060/html/CHRG-118shrg59104060.htm","116.5 KB","","0 B","","0 B","","0 B","on Appropriations, Washington, DC. The subcommittee met, pursuant to notice, at 2:35 p.m., in room SD-124, Dirksen Senate Office Building, Hon. Chris Van Hollen (Chairman) presiding. Present: Senators Van Hollen, Manchin, Hagerty, and Kennedy. U.S. FEDERAL COMMUNICATIONS COMMISSION OPENING STATEMENT OF SENATOR CHRIS VAN HOLLEN Senator Van Hollen. ...","","2023-09-19"
"533","Congressional Hearings","CHRG-118hhrg53550","CHRG-118hhrg53550","Terrorist Entry Through the Southwest Border","https://www.govinfo.gov/app/details/CHRG-118hhrg53550/CHRG-118hhrg53550","https://www.govinfo.gov/content/pkg/CHRG-118hhrg53550/pdf/CHRG-118hhrg53550.pdf","13.1 MB","https://www.govinfo.gov/content/pkg/CHRG-118hhrg53550/html/CHRG-118hhrg53550.htm","114.7 KB","","0 B","","0 B","","0 B"," U.S. HOUSE OF REPRESENTATIVES ONE HUNDRED EIGHTEENTH CONGRESS FIRST SESSION THURSDAY, SEPTEMBER 14, 2023 Serial No. 118-43 Printed for the use of the Committee on the Judiciary [GRAPHIC NOT AVAILABLE IN TIFF FORMAT] Available via: http://judiciary.house.gov U.S. GOVERNMENT PUBLISHING OFFICE 53-550 WASHINGTON : 2023 COMMITTEE ON THE JUDICIARY...","","2023-09-14"
"534","Congressional Hearings","CHRG-118hhrg54213","CHRG-118hhrg54213","[H.A.S.C. No. 118-41] MERITOCRACY IN THE MILITARY SERVICES:  ACCESSION, PROMOTION, AND COMMAND SELECTION","https://www.govinfo.gov/app/details/CHRG-118hhrg54213/CHRG-118hhrg54213","https://www.govinfo.gov/content/pkg/CHRG-118hhrg54213/pdf/CHRG-118hhrg54213.pdf","3.6 MB","https://www.govinfo.gov/content/pkg/CHRG-118hhrg54213/html/CHRG-118hhrg54213.htm","128.6 KB","","0 B","","0 B","","0 B"," PERSONNEL OF THE COMMITTEE ON ARMED SERVICES HOUSE OF REPRESENTATIVES ONE HUNDRED EIGHTEENTH CONGRESS FIRST SESSION HEARING HELD SEPTEMBER 20, 2023 [GRAPHIC NOT AVAILABLE IN TIFF FORMAT] U.S. GOVERNMENT PUBLISHING OFFICE 54-213 WASHINGTON : 2024 SUBCOMMITTEE ON MILITARY PERSONNEL JIM BANKS, Indiana, Chairman ELISE M. STEFANIK, New York ANDY KIM, ...","","2023-09-20"
"535","Congressional Hearings","CHRG-118hhrg53628","CHRG-118hhrg53628","Admissions, Curriculum, and Diversity of Thought at the Military Service Academies","https://www.govinfo.gov/app/details/CHRG-118hhrg53628/CHRG-118hhrg53628","https://www.govinfo.gov/content/pkg/CHRG-118hhrg53628/pdf/CHRG-118hhrg53628.pdf","3.9 MB","https://www.govinfo.gov/content/pkg/CHRG-118hhrg53628/html/CHRG-118hhrg53628.htm","186.7 KB","","0 B","","0 B","","0 B","PERSONNEL OF THE COMMITTEE ON ARMED SERVICES HOUSE OF REPRESENTATIVES ONE HUNDRED EIGHTEENTH CONGRESS FIRST SESSION HEARING HELD JULY 19, 2023 [GRAPHIC NOT AVAILABLE IN TIFF FORAMT] U.S. GOVERNMENT PUBLISHING OFFICE 53-628 WASHINGTON : 2024 SUBCOMMITTEE ON MILITARY PERSONNEL JIM BANKS, Indiana, Chairman ELISE M. STEFANIK, New York ANDY KIM, New ...","","2023-07-19"
"536","Congressional Hearings","CHRG-118shrg57430","CHRG-118shrg57430","Annual Oversight of Wall Street Firms","https://www.govinfo.gov/app/details/CHRG-118shrg57430/CHRG-118shrg57430","https://www.govinfo.gov/content/pkg/CHRG-118shrg57430/pdf/CHRG-118shrg57430.pdf","118.6 MB","https://www.govinfo.gov/content/pkg/CHRG-118shrg57430/html/CHRG-118shrg57430.htm","211.7 KB","","0 B","","0 B","","0 B"," EIGHTEENTH CONGRESS FIRST SESSION ON EXAMINING HOW THE FAILURE OF THE LARGEST BANKS IN THE NATION COULD POSE A THREAT TO THE ENTIRE GLOBAL FINANCIAL SYSTEM DECEMBER 6, 2023 Printed for the use of the Committee on Banking, Housing, and Urban Affairs [GRAPHIC NOT AVAILABLE IN TIFF FORMAT] Available at: https: //www.govinfo.gov / ______ U.S. ...","","2023-12-06"
"537","Congressional Hearings","CHRG-118hhrg54888","CHRG-118hhrg54888","Insights from the HHS Inspector General on Oversight of Unaccompanied Minors, Grant Management, and Cms","https://www.govinfo.gov/app/details/CHRG-118hhrg54888/CHRG-118hhrg54888","https://www.govinfo.gov/content/pkg/CHRG-118hhrg54888/pdf/CHRG-118hhrg54888.pdf","25.3 MB","https://www.govinfo.gov/content/pkg/CHRG-118hhrg54888/html/CHRG-118hhrg54888.htm","112.6 KB","","0 B","","0 B","","0 B","AND INVESTIGATIONS OF THE COMMITTEE ON ENERGY AND COMMERCE HOUSE OF REPRESENTATIVES ONE HUNDRED EIGHTEENTH CONGRESS FIRST SESSION APRIL 18, 2023 Serial No. 118-22 [GRAPHIC NOT AVAILABLE IN TIFF FORMAT] Published for the use of the Committee on Energy and Commerce govinfo.gov/committee/house-energy energycommerce.house.gov U.S. GOVERNMENT PUBLISHING...","","2023-04-18"
"538","Congressional Hearings","CHRG-118shrg53705","CHRG-118shrg53705","After Apprehension: Tracing DHS Responsibilities After Title 42","https://www.govinfo.gov/app/details/CHRG-118shrg53705/CHRG-118shrg53705","https://www.govinfo.gov/content/pkg/CHRG-118shrg53705/pdf/CHRG-118shrg53705.pdf","27.8 MB","https://www.govinfo.gov/content/pkg/CHRG-118shrg53705/html/CHRG-118shrg53705.htm","122.4 KB","","0 B","","0 B","","0 B"," of the COMMITTEE ON HOMELAND SECURITY AND GOVERNMENTAL AFFAIRS UNITED STATES SENATE ONE HUNDRED EIGHTEENTH CONGRESS FIRST SESSION SEPTEMBER 6, 2023 Available via the World Wide Web: http://www.govinfo.gov Printed for the use of the Committee on Homeland Security and Governmental Affairs GRAPHIC(S) NOT AVAILABLE IN TIFF FORMAT ______ U.S. ...","","2023-09-06"
"539","Congressional Hearings","CHRG-118shrg49104046","CHRG-118shrg49104046","Department of Defense Appropriations for Fiscal Year 2024","https://www.govinfo.gov/app/details/CHRG-118shrg49104046/CHRG-118shrg49104046","https://www.govinfo.gov/content/pkg/CHRG-118shrg49104046/pdf/CHRG-118shrg49104046.pdf","311.7 KB","https://www.govinfo.gov/content/pkg/CHRG-118shrg49104046/html/CHRG-118shrg49104046.htm","311.5 KB","","0 B","","0 B","","0 B",", DC. The subcommittee met at 9:30 a.m. in room SD-192, Dirksen Senate Office Building, Hon. Jon Tester (chairman) presiding. Present: Senators Tester, Durbin, Baldwin, Shaheen, Collins, Murkowski, Moran, Hoeven, Boozman, and Capito. DEPARTMENT OF DEFENSE National Guard and Reserve STATEMENT OF GENERAL DANIEL R. HOKANSON, CHIEF OF THE NATIONAL ...","","2023-06-01"
"540","Congressional Hearings","CHRG-118shrg60097","CHRG-118shrg60097","DEPARTMENT OF DEFENSE AUTHORIZATION REQUEST FOR APPROPRIATIONS FOR FISCAL YEAR 2024 AND THE FUTURE YEARS DEFENSE PROGRAM","https://www.govinfo.gov/app/details/CHRG-118shrg60097/CHRG-118shrg60097","https://www.govinfo.gov/content/pkg/CHRG-118shrg60097/pdf/CHRG-118shrg60097.pdf","7.0 MB","https://www.govinfo.gov/content/pkg/CHRG-118shrg60097/html/CHRG-118shrg60097.htm","597.4 KB","","0 B","","0 B","","0 B"," HEARING before the COMMITTEE ON ARMED SERVICES UNITED STATES SENATE ONE HUNDRED EIGHTEENTH CONGRESS FIRST SESSION ON S. 2226 TO AUTHORIZE APPROPRIATIONS FOR FISCAL YEAR 2024 FOR MILITARY ACTIVITIES OF THE DEPARTMENT OF DEFENSE, FOR MILITARY CONSTRUCTION, AND FOR DEFENDSE ACTIVITIES OF THE DEPARTMENT OF ENERGY. TO PRESCRIBE MILITARY PERSONNEL ...","","2023-04-19"
"541","Congressional Hearings","CHRG-118hhrg53877","CHRG-118hhrg53877","Hearing for the Purpose of Receiving Testimony from the Honorable Michael Regan, Administrator, U.S. Environmental Protection Agency","https://www.govinfo.gov/app/details/CHRG-118hhrg53877/CHRG-118hhrg53877","https://www.govinfo.gov/content/pkg/CHRG-118hhrg53877/pdf/CHRG-118hhrg53877.pdf","4.2 MB","https://www.govinfo.gov/content/pkg/CHRG-118hhrg53877/html/CHRG-118hhrg53877.htm","457.9 KB","","0 B","","0 B","","0 B"," COMMITTEE ON AGRICULTURE HOUSE OF REPRESENTATIVES ONE HUNDRED EIGHTEENTH CONGRESS FIRST SESSION APRIL 19, 2023 Serial No. 118-7 [GRAPHIC(S) NOT AVAILABLE IN TIFF FORMAT] Printed for the use of the Committee on Agriculture agriculture.house.gov ______ U.S. GOVERNMENT PUBLISHING OFFICE 53-877PDF WASHINGTON : 2023 COMMITTEE ON AGRICULTURE GLENN ...","","2023-04-19"
"542","Congressional Hearings","CHRG-118hhrg53181","CHRG-118hhrg53181","Part 1: Committee Funding for the 118th Congress","https://www.govinfo.gov/app/details/CHRG-118hhrg53181/CHRG-118hhrg53181","https://www.govinfo.gov/content/pkg/CHRG-118hhrg53181/pdf/CHRG-118hhrg53181.pdf","12.6 MB","https://www.govinfo.gov/content/pkg/CHRG-118hhrg53181/html/CHRG-118hhrg53181.htm","165.0 KB","","0 B","","0 B","","0 B"," CONGRESS FIRST SESSION FEBRUARY 28, 2023 Printed for the use of the Committee on House Administration [GRAPHIC NOT AVAILABLE IN TIFF FORMAT] www.govinfo.gov www.cha.house.gov U.S. GOVERNMENT PUBLISHING OFFICE 53-181 WASHINGTON : 2023 Committee on House Administration BRYAN STEIL, WISCONSIN, Chairman BARRY LOUDERMILK, Georgia JOSEPH MORELLE, New ...","","2023-02-28"
"543","Congressional Hearings","CHRG-118shrg53707","CHRG-118shrg53707","Governing AI Through Acquisition and Procurement","https://www.govinfo.gov/app/details/CHRG-118shrg53707/CHRG-118shrg53707","https://www.govinfo.gov/content/pkg/CHRG-118shrg53707/pdf/CHRG-118shrg53707.pdf","12.6 MB","https://www.govinfo.gov/content/pkg/CHRG-118shrg53707/html/CHRG-118shrg53707.htm","128.8 KB","","0 B","","0 B","","0 B"," SENATE ONE HUNDRED EIGHTEENTH CONGRESS FIRST SESSION SEPTEMBER 14, 2023 Available via the World Wide Web: http://www.govinfo.gov Printed for the use of the Committee on Homeland Security and Governmental Affairs [GRAPHIC NOT AVAILABLE IN TIFF FORMAT] U.S. GOVERNMENT PUBLISHING OFFICE 53-707 PDF WASHINGTON : 2024 COMMITTEE ON HOMELAND SECURITY ...","","2023-09-14"
"544","Congressional Hearings","CHRG-118shrg50503","CHRG-118shrg50503","Agriculture, Rural Development, Food and Drug Administration, and Related Agencies Appropriations for Fiscal Year 2024","https://www.govinfo.gov/app/details/CHRG-118shrg50503/CHRG-118shrg50503","https://www.govinfo.gov/content/pkg/CHRG-118shrg50503/pdf/CHRG-118shrg50503.pdf","785.3 KB","https://www.govinfo.gov/content/pkg/CHRG-118shrg50503/html/CHRG-118shrg50503.htm","856.5 KB","","0 B","","0 B","","0 B"," A SUBCOMMITTEE OF THE COMMITTEE ON APPROPRIATIONS UNITED STATES SENATE ONE HUNDRED EIGHTEENTH CONGRESS FIRST SESSION on H.R. 4368/S. 2131 AN ACT MAKING APPROPRIATIONS FOR AGRICULTURE, RURAL DEVELOPMENT, FOOD AND DRUG ADMINISTRATION, AND RELATED AGENCIES FOR THE FISCAL YEAR ENDING SEPTEMBER 30, 2024, AND FOR OTHER PURPOSES Department of ...","","2023-03-29"
"545","Congressional Hearings","CHRG-118hhrg52359","CHRG-118hhrg52359","Empowering Entrepreneurs: Removing Barriers to Capital Access for Small Businesses","https://www.govinfo.gov/app/details/CHRG-118hhrg52359/CHRG-118hhrg52359","https://www.govinfo.gov/content/pkg/CHRG-118hhrg52359/pdf/CHRG-118hhrg52359.pdf","10.8 MB","https://www.govinfo.gov/content/pkg/CHRG-118hhrg52359/html/CHRG-118hhrg52359.htm","109.7 KB","","0 B","","0 B","","0 B"," ON FINANCIAL SERVICES U.S. HOUSE OF REPRESENTATIVES ONE HUNDRED EIGHTEENTH CONGRESS FIRST SESSION FEBRUARY 8, 2023 Printed for the use of the Committee on Financial Services Serial No. 118-4 [GRAPHIC NOT AVAILABLE IN TIFF FORMAT] U.S. GOVERNMENT PUBLISHING OFFICE 52-359 PDF WASHINGTON : 2023 HOUSE COMMITTEE ON FINANCIAL SERVICES PATRICK McHENRY, ...","","2023-02-08"
"546","Congressional Hearings","CHRG-118hhrg56070","CHRG-118hhrg56070","Safeguarding Workers' Rights and Liberties","https://www.govinfo.gov/app/details/CHRG-118hhrg56070/CHRG-118hhrg56070","https://www.govinfo.gov/content/pkg/CHRG-118hhrg56070/pdf/CHRG-118hhrg56070.pdf","18.3 MB","https://www.govinfo.gov/content/pkg/CHRG-118hhrg56070/html/CHRG-118hhrg56070.htm","136.6 KB","","0 B","","0 B","","0 B"," AND THE WORKFORCE U.S. HOUSE OF REPRESENTATIVES ONE HUNDRED EIGHTEENTH CONGRESS FIRST SESSION HEARING HELD IN WASHINGTON, DC, NOVEMBER 30, 2023 Serial No. 118-29 Printed for the use of the Committee on Education and Workforce GRAPHIC(S) NOT AVAILABLE IN TIFF FORMAT Available via: edworkforce.house.gov or www.govinfo.gov _______ U.S. ...","","2023-11-30"
"547","Congressional Hearings","CHRG-118hhrg51814","CHRG-118hhrg51814","Paying Their Fair Share: How Tax Hikes Crush the Competitiveness of Small Businesses","https://www.govinfo.gov/app/details/CHRG-118hhrg51814/CHRG-118hhrg51814","https://www.govinfo.gov/content/pkg/CHRG-118hhrg51814/pdf/CHRG-118hhrg51814.pdf","19.8 MB","https://www.govinfo.gov/content/pkg/CHRG-118hhrg51814/html/CHRG-118hhrg51814.htm","111.8 KB","","0 B","","0 B","","0 B"," OF REPRESENTATIVES ONE HUNDRED EIGHTEENTH CONGRESS FIRST SESSION HEARING HELD APRIL 18, 2023 [GRAPHIC NOT AVAILABLE IN TIFF FORMAT] Small Business Committee Document Number 118-008 Available via the GPO Website: www.govinfo.gov U.S. GOVERNMENT PUBLISHING OFFICE 51-814 WASHINGTON : 2023 HOUSE COMMITTEE ON SMALL BUSINESS ROGER WILLIAMS, Texas, ...","","2023-04-18"
"548","Congressional Hearings","CHRG-118hhrg52976","CHRG-118hhrg52976","Oversight Hearing on ESA at 50: The Destructive Cost of the ESA","https://www.govinfo.gov/app/details/CHRG-118hhrg52976/CHRG-118hhrg52976","https://www.govinfo.gov/content/pkg/CHRG-118hhrg52976/pdf/CHRG-118hhrg52976.pdf","975.9 KB","https://www.govinfo.gov/content/pkg/CHRG-118hhrg52976/html/CHRG-118hhrg52976.htm","284.7 KB","","0 B","","0 B","","0 B"," U.S. HOUSE OF REPRESENTATIVES ONE HUNDRED EIGHTEENTH CONGRESS FIRST SESSION July 18, 2023 Serial No. 118-49 Printed for the use of the Committee on Natural Resources [GRAPHIC(S) NOT AVAILABLE IN TIFF FORMAT] Available via the World Wide Web: http://www.govinfo.gov or Committee address: http://naturalresources.house.gov _________ U.S. ...","","2023-07-18"
"549","Congressional Hearings","CHRG-118hhrg54212","CHRG-118hhrg54212","Hearing for the Purpose of Receiving Testimony from the Honorable Thomas J. Vilsack, Secretary, U.S. Department of Agriculture","https://www.govinfo.gov/app/details/CHRG-118hhrg54212/CHRG-118hhrg54212","https://www.govinfo.gov/content/pkg/CHRG-118hhrg54212/pdf/CHRG-118hhrg54212.pdf","1.2 MB","https://www.govinfo.gov/content/pkg/CHRG-118hhrg54212/html/CHRG-118hhrg54212.htm","496.6 KB","","0 B","","0 B","","0 B"," ON AGRICULTURE HOUSE OF REPRESENTATIVES ONE HUNDRED EIGHTEENTH CONGRESS FIRST SESSION MARCH 28, 2023 Serial No. 118-5 [GRAPHIC(S) NOT AVAILABLE IN TIFF FORMAT] Printed for the use of the Committee on Agriculture agriculture.house.gov _________ U.S. GOVERNMENT PUBLISHING OFFICE 54-212 PDF WASHINGTON : 2023 COMMITTEE ON AGRICULTURE GLENN ...","","2023-03-28"
"550","Congressional Hearings","CHRG-118hhrg56239","CHRG-118hhrg56239","Holding Campus Leaders Accountable and Confronting Antisemitism","https://www.govinfo.gov/app/details/CHRG-118hhrg56239/CHRG-118hhrg56239","https://www.govinfo.gov/content/pkg/CHRG-118hhrg56239/pdf/CHRG-118hhrg56239.pdf","42.5 MB","https://www.govinfo.gov/content/pkg/CHRG-118hhrg56239/html/CHRG-118hhrg56239.htm","241.4 KB","","0 B","","0 B","","0 B"," ONE HUNDRED EIGHTEENTH CONGRESS FIRST SESSION HEARING HELD IN WASHINGTON, DC, DECEMBER 5, 2023 Serial No. 118-31 Printed for the use of the Committee on Education and the Workforce [GRAPHIC NOT AVAILABLE IN TIFF FORMAT] Available via: edworkforce.house.gov or www.govinfo.gov U.S. GOVERNMENT PUBLISHING OFFICE 56-239 PDF WASHINGTON : 2024 ...","","2023-12-05"
"551","Congressional Hearings","CHRG-118shrg49104034","CHRG-118shrg49104034","Commerce, Justice, Science, and Related Agencies Appropriations for Fiscal Year 2023","https://www.govinfo.gov/app/details/CHRG-118shrg49104034/CHRG-118shrg49104034","https://www.govinfo.gov/content/pkg/CHRG-118shrg49104034/pdf/CHRG-118shrg49104034.pdf","1.1 MB","https://www.govinfo.gov/content/pkg/CHRG-118shrg49104034/html/CHRG-118shrg49104034.htm","709.1 KB","","0 B","","0 B","","0 B",", DC. [Clerk's note.--The subcommittee was unable to hold hearings on departmental and nondepartmental witnesses. The statements and letters of those submitting written testimony are as follows:] DEPARTMENTAL WITNESSES Prepared Statement of American Physiological Society The American Physiological Society (APS) thanks you for your sustained...","","2023-12-07"
"552","Congressional Hearings","CHRG-118hhrg53286","CHRG-118hhrg53286","Examining the Fiscal Year 2024 State Department Diversity Equity Inclusion and Accessibility Budget","https://www.govinfo.gov/app/details/CHRG-118hhrg53286/CHRG-118hhrg53286","https://www.govinfo.gov/content/pkg/CHRG-118hhrg53286/pdf/CHRG-118hhrg53286.pdf","1.2 MB","https://www.govinfo.gov/content/pkg/CHRG-118hhrg53286/html/CHRG-118hhrg53286.htm","124.5 KB","","0 B","","0 B","","0 B","ACCOUNTABILITY OF THE COMMITTEE ON FOREIGN AFFAIRS HOUSE OF REPRESENTATIVES ONE HUNDRED EIGHTEENTH CONGRESS FIRST SESSION June 13, 2023 Serial No. 118-30 Printed for the use of the Committee on Foreign Affairs [GRAPHIC NOT AVAILABLE IN TIFF FORMAT] Available: http://www.foreignaffairs.house.gov/, http://docs.house.gov, or http://www.govinfo.gov ___...","","2023-06-13"
"553","Congressional Hearings","CHRG-118hhrg53710","CHRG-118hhrg53710","Departments of Labor, Health and Human Services, Education, and Related Agencies Appropriations for 2024","https://www.govinfo.gov/app/details/CHRG-118hhrg53710/CHRG-118hhrg53710","https://www.govinfo.gov/content/pkg/CHRG-118hhrg53710/pdf/CHRG-118hhrg53710.pdf","51.6 MB","https://www.govinfo.gov/content/pkg/CHRG-118hhrg53710/html/CHRG-118hhrg53710.htm","814.1 KB","","0 B","","0 B","","0 B"," ON APPROPRIATIONS HOUSE OF REPRESENTATIVES ONE HUNDRED EIGHTEENTH CONGRESS FIRST SESSION SUBCOMMITTEE ON LABOR, HEALTH AND HUMAN SERVICES, EDUCATION, AND RELATED AGENCIES ROBERT B. ADERHOLT, Alabama, Chairman MICHAEL K. SIMPSON, Idado ROSA L. DeLAURO, Connecticut ANDY HARRIS, Maryland STENY H. HOYER, Maryland CHARLES J. ``CHUCK'' FLEISCHMANN, ...","","2023-03-08"
"554","Congressional Hearings","CHRG-118shrg52111","CHRG-118shrg52111","The President's Fiscal Year 2024 Budget Proposal","https://www.govinfo.gov/app/details/CHRG-118shrg52111/CHRG-118shrg52111","https://www.govinfo.gov/content/pkg/CHRG-118shrg52111/pdf/CHRG-118shrg52111.pdf","18.2 MB","https://www.govinfo.gov/content/pkg/CHRG-118shrg52111/html/CHRG-118shrg52111.htm","121.0 KB","","0 B","","0 B","","0 B"," CONGRESS FIRST SESSION March 15, 2023 Printed for the use of the Committee on the Budget [GRAPHIC NOT AVAILABLE IN TIFF FORMAT] www.govinfo.gov U.S. GOVERNMENT PUBLISHING OFFICE 52-111 WASHINGTON : 2023 COMMITTEE ON THE BUDGET SHELDON WHITEHOUSE, Rhode Island, Chairman PATTY MURRAY, Washington CHARLES E. GRASSLEY, Iowa RON WYDEN, Oregon MIKE ...","","2023-03-15"
"555","Congressional Hearings","CHRG-118jhrg54068","CHRG-118jhrg54068","Oversight of the Internal Revenue Service","https://www.govinfo.gov/app/details/CHRG-118jhrg54068/CHRG-118jhrg54068","https://www.govinfo.gov/content/pkg/CHRG-118jhrg54068/pdf/CHRG-118jhrg54068.pdf","223.6 KB","https://www.govinfo.gov/content/pkg/CHRG-118jhrg54068/html/CHRG-118jhrg54068.htm","136.7 KB","","0 B","","0 B","","0 B"," ON HEALTH CARE AND FINANCIAL SERVICES OF THE COMMITTEE ON OVERSIGHT AND ACCOUNTABILITY HOUSE OF REPRESENTATIVES ONE HUNDRED EIGHTEENTH CONGRESS FIRST SESSION OCTOBER 24, 2023 Serial No. 118-71 Printed for the use of the Committee on Oversight and Accountability [GRAPHIC NOT AVAILABLE IN TIFF FORMAT] Available on: govinfo.gov, oversight.house.gov...","","2023-10-24"
"556","Congressional Hearings","CHRG-118hhrg52653","CHRG-118hhrg52653","Getting Back on Track: Exploring Rail Supply Chain Resilience and Challenges","https://www.govinfo.gov/app/details/CHRG-118hhrg52653/CHRG-118hhrg52653","https://www.govinfo.gov/content/pkg/CHRG-118hhrg52653/pdf/CHRG-118hhrg52653.pdf","2.1 MB","https://www.govinfo.gov/content/pkg/CHRG-118hhrg52653/html/CHRG-118hhrg52653.htm","411.4 KB","","0 B","","0 B","","0 B"," MATERIALS OF THE COMMITTEE ON TRANSPORTATION AND INFRASTRUCTURE HOUSE OF REPRESENTATIVES ONE HUNDRED EIGHTEENTH CONGRESS FIRST SESSION MAY 11, 2023 Printed for the use of the Committee on Transportation and Infrastructure [GRAPHIC NOT AVAILABLE IN TIFF FORMAT] Available online at: https://www.govinfo.gov/committee/house- transportation?path...","","2023-05-11"
"557","Congressional Hearings","CHRG-118hhrg56073","CHRG-118hhrg56073","Oversight and Reauthorization of the National Telecommunications and in- Formation Administration","https://www.govinfo.gov/app/details/CHRG-118hhrg56073/CHRG-118hhrg56073","https://www.govinfo.gov/content/pkg/CHRG-118hhrg56073/pdf/CHRG-118hhrg56073.pdf","10.2 MB","https://www.govinfo.gov/content/pkg/CHRG-118hhrg56073/html/CHRG-118hhrg56073.htm","194.9 KB","","0 B","","0 B","","0 B"," AND TECHNOLOGY OF THE COMMITTEE ON ENERGY AND COMMERCE HOUSE OF REPRESENTATIVES ONE HUNDRED EIGHTEENTH CONGRESS FIRST SESSION MAY 23, 2023 Serial No. 118-38 [GRAPHIC(S) NOT AVAILABLE IN TIFF FORMAT] Published for the use of the Committee on Energy and Commerce govinfo.gov/committee/house-energy energycommerce.house.gov ______ U.S. GOVERNMENT ...","","2023-05-23"
"558","Congressional Hearings","CHRG-118hhrg56737","CHRG-118hhrg56737","Examining the Fiscal Year 2024 State Department Diversity Equity Inclusion, and Accessibility Budget","https://www.govinfo.gov/app/details/CHRG-118hhrg56737/CHRG-118hhrg56737","https://www.govinfo.gov/content/pkg/CHRG-118hhrg56737/pdf/CHRG-118hhrg56737.pdf","1.1 MB","https://www.govinfo.gov/content/pkg/CHRG-118hhrg56737/html/CHRG-118hhrg56737.htm","125.1 KB","","0 B","","0 B","","0 B"," ACCOUNTABILITY OF THE COMMITTEE ON FOREIGN AFFAIRS HOUSE OF REPRESENTATIVES ONE HUNDRED EIGHTEENTH CONGRESS FIRST SESSION JUNE 13, 2023 Serial No. 118-30 Printed for the use of the Committee on Foreign Affairs [GRAPHIC NOT AVAILABLE IN TIFF FORMAT] Available: http://www.foreignaffairs.house.gov/, http://docs.house.gov, or http://www.govinfo.gov ...","","2023-06-13"
"559","Congressional Hearings","CHRG-118hhrg55268","CHRG-118hhrg55268","[H.A.S.C. No. 118-7] COVID-19's Impact on DOD and Its Servicemembers","https://www.govinfo.gov/app/details/CHRG-118hhrg55268/CHRG-118hhrg55268","https://www.govinfo.gov/content/pkg/CHRG-118hhrg55268/pdf/CHRG-118hhrg55268.pdf","2.0 MB","https://www.govinfo.gov/content/pkg/CHRG-118hhrg55268/html/CHRG-118hhrg55268.htm","132.5 KB","","0 B","","0 B","","0 B","SERVICES HOUSE OF REPRESENTATIVES ONE HUNDRED EIGHTEENTH CONGRESS FIRST SESSION HEARING HELD FEBRUARY 28, 2023 [GRAPHIC(S) NOT AVAILABLE IN TIFF FORMAT] ______ U.S. GOVERNMENT PUBLISHING OFFICE 55-268 WASHINGTON : 2024 SUBCOMMITTEE ON MILITARY PERSONNEL JIM BANKS, Indiana, Chairman ELISE M. STEFANIK, New York ANDY KIM, New Jersey MATT GAETZ, ...","","2023-02-28"
"560","Congressional Hearings","CHRG-118hhrg55098","CHRG-118hhrg55098","The Semi-Annual Report of the Bureau of Consumer Financial Protection","https://www.govinfo.gov/app/details/CHRG-118hhrg55098/CHRG-118hhrg55098","https://www.govinfo.gov/content/pkg/CHRG-118hhrg55098/pdf/CHRG-118hhrg55098.pdf","41.0 MB","https://www.govinfo.gov/content/pkg/CHRG-118hhrg55098/html/CHRG-118hhrg55098.htm","250.0 KB","","0 B","","0 B","","0 B"," ONE HUNDRED EIGHTEENTH CONGRESS FIRST SESSION NOVEMBER 29, 2023 Printed for the use of the Committee on Financial Services Serial No. 118-59 [GRAPHIC NOT AVAILABLE IN TIFF FORMAT] U.S. GOVERNMENT PUBLISHING OFFICE 55-098 PDF WASHINGTON : 2024 HOUSE COMMITTEE ON FINANCIAL SERVICES PATRICK McHENRY, North Carolina, Chairman FRANK D. LUCAS, Oklahoma ...","","2023-11-29"
"561","Congressional Hearings","CHRG-118hhrg52461","CHRG-118hhrg52461","The Biden Border Crisis: Part III","https://www.govinfo.gov/app/details/CHRG-118hhrg52461/CHRG-118hhrg52461","https://www.govinfo.gov/content/pkg/CHRG-118hhrg52461/pdf/CHRG-118hhrg52461.pdf","21.6 MB","https://www.govinfo.gov/content/pkg/CHRG-118hhrg52461/html/CHRG-118hhrg52461.htm","140.3 KB","","0 B","","0 B","","0 B"," HOUSE OF REPRESENTATIVES ONE HUNDRED EIGHTEENTH CONGRESS FIRST SESSION TUESDAY, MAY 23, 2023 Serial No. 118-22 Printed for the use of the Committee on the Judiciary [GRAPHIC NOT AVAILABLE IN TIFF FORMAT] Available via: http://judiciary.house.gov U.S. GOVERNMENT PUBLISHING OFFICE 52-461 WASHINGTON : 2023 COMMITTEE ON THE JUDICIARY JIM JORDAN, Ohio,...","","2023-05-23"
"562","Congressional Hearings","CHRG-118hhrg55203","CHRG-118hhrg55203","Breaking Barriers: Streamlining Permitting to Expedite Broadband Deployment","https://www.govinfo.gov/app/details/CHRG-118hhrg55203/CHRG-118hhrg55203","https://www.govinfo.gov/content/pkg/CHRG-118hhrg55203/pdf/CHRG-118hhrg55203.pdf","42.5 MB","https://www.govinfo.gov/content/pkg/CHRG-118hhrg55203/html/CHRG-118hhrg55203.htm","210.1 KB","","0 B","","0 B","","0 B"," ON ENERGY AND COMMERCE HOUSE OF REPRESENTATIVES ONE HUNDRED EIGHTEENTH CONGRESS FIRST SESSION APRIL 19, 2023 Serial No. 118-25 Published for the use of the Committee on Energy and Commerce [GRAPHIC NOT AVAILABLE IN TIFF FORMAT] govinfo.gov/committee/house-energy energycommerce.house.gov U.S. GOVERNMENT PUBLISHING OFFICE 55-203 PDF ...","","2023-04-19"
