"index","collection","packageId","granuleId","title","detailsLink","pdfLink","pdfSize","htmlLink","htmlSize","xmlLink","xmlSize","otherLink1","other1Size","otherLink2","other2Size","teaser","historical","publishdate"
"189","Congressional Hearings","CHRG-118hhrg54069","CHRG-118hhrg54069","Faith Under Fire: An Examination of Global Religious Persecution","https://www.govinfo.gov/app/details/CHRG-118hhrg54069/CHRG-118hhrg54069","https://www.govinfo.gov/content/pkg/CHRG-118hhrg54069/pdf/CHRG-118hhrg54069.pdf","203.9 KB","https://www.govinfo.gov/content/pkg/CHRG-118hhrg54069/html/CHRG-118hhrg54069.htm","112.2 KB","","0 B","","0 B","","0 B"," of the COMMITTEE ON OVERSIGHT AND ACCOUNTABILITY U.S. HOUSE OF REPRESENTATIVES ONE HUNDRED EIGHTEENTH CONGRESS FIRST SESSION OCTOBER 25, 2023 Serial No. 118-72 Printed for the use of the Committee on Oversight and Accountability [GRAPHIC NOT AVAILABLE IN TIFF FORMAT] Available on: govinfo.gov oversight.house.gov or docs.house.gov ______ U.S. ...","","2023-10-25"
"190","Congressional Hearings","CHRG-118shrg53115","CHRG-118shrg53115","Artificial Intelligence and Intellectual Property--Part I: Patents, Innovation, and Competition","https://www.govinfo.gov/app/details/CHRG-118shrg53115/CHRG-118shrg53115","https://www.govinfo.gov/content/pkg/CHRG-118shrg53115/pdf/CHRG-118shrg53115.pdf","37.6 MB","https://www.govinfo.gov/content/pkg/CHRG-118shrg53115/html/CHRG-118shrg53115.htm","104.7 KB","","0 B","","0 B","","0 B"," PROPERTY of the COMMITTEE ON THE JUDICIARY UNITED STATES SENATE ONE HUNDRED EIGHTEENTH CONGRESS FIRST SESSION JUNE 7, 2023 Serial No. J-118-19 Printed for the use of the Committee on the Judiciary [GRAPHIC(S) NOT AVAILABLE IN TIFF FORMAT] U.S. GOVERNMENT PUBLISHING OFFICE 53-115 PDF WASHINGTON : 2024 COMMITTEE ON THE JUDICIARY RICHARD J. ...","","2023-06-07"
"191","Congressional Hearings","CHRG-118hhrg53742","CHRG-118hhrg53742","National Defense Authorization Act for Fiscal Year 2024","https://www.govinfo.gov/app/details/CHRG-118hhrg53742/CHRG-118hhrg53742","https://www.govinfo.gov/content/pkg/CHRG-118hhrg53742/pdf/CHRG-118hhrg53742.pdf","2.2 MB","https://www.govinfo.gov/content/pkg/CHRG-118hhrg53742/html/CHRG-118hhrg53742.htm","76.9 KB","","0 B","","0 B","","0 B"," ON ARMED SERVICES HOUSE OF REPRESENTATIVES ONE HUNDRED EIGHTEENTH CONGRESS FIRST SESSION SUBCOMMITTEE ON STRATEGIC FORCES HEARING ON FISCAL YEAR 2024 NATIONAL SECURITY SPACE PROGRAMS HEARING HELD APRIL 26, 2023 [GRAPHIC(S) NOT AVAILABLE IN TIFF FORMAT] U.S. GOVERNMENT PUBLISHING OFFICE 53-742 WASHINGTON : 2024 SUBCOMMITTEE ON STRATEGIC ...","","2023-04-26"
"192","Congressional Hearings","CHRG-118shrg55542","CHRG-118shrg55542","Fiscal Year 2024 Budget Priorities for the Western Hemisphere","https://www.govinfo.gov/app/details/CHRG-118shrg55542/CHRG-118shrg55542","https://www.govinfo.gov/content/pkg/CHRG-118shrg55542/pdf/CHRG-118shrg55542.pdf","1.1 MB","https://www.govinfo.gov/content/pkg/CHRG-118shrg55542/html/CHRG-118shrg55542.htm","140.6 KB","","0 B","","0 B","","0 B",", CIVILIAN SECURITY, DEMOCRACY, HUMAN RIGHTS, AND GLOBAL WOMEN'S ISSUES OF THE COMMITTEE ON FOREIGN RELATIONS UNITED STATES SENATE ONE HUNDRED EIGHTEENTH CONGRESS FIRST SESSION SEPTEMBER 7, 2023 Printed for the use of the Committee on Foreign Relations [GRAPHIC NOT AVAILABLE IN TIFF FORMAT] Available via http://www.govinfo.gov U.S. GOVERNMENT ...","","2023-09-07"
"193","Congressional Hearings","CHRG-118shrg52483","CHRG-118shrg52483","Artificial Intelligence: Risks and Opportunities","https://www.govinfo.gov/app/details/CHRG-118shrg52483/CHRG-118shrg52483","https://www.govinfo.gov/content/pkg/CHRG-118shrg52483/pdf/CHRG-118shrg52483.pdf","15.7 MB","https://www.govinfo.gov/content/pkg/CHRG-118shrg52483/html/CHRG-118shrg52483.htm","105.7 KB","","0 B","","0 B","","0 B"," SENATE ONE HUNDRED EIGHTEENTH CONGRESS FIRST SESSION MARCH 8, 2023 Available via the World Wide Web: http://www.govinfo.gov Printed for the use of the Committee on Homeland Security and Governmental Affairs [GRAPHIC(S) NOT AVAILABLE IN TIFF FORMAT] ______ U.S. GOVERNMENT PUBLISHING OFFICE 52-483 PDF WASHINGTON : 2023 GARY C. PETERS, Michigan, ...","","2023-03-08"
"194","Congressional Hearings","CHRG-118hhrg54482","CHRG-118hhrg54482","Biden and Mayorkas' Open Border: Advancing Cartel Crime in America","https://www.govinfo.gov/app/details/CHRG-118hhrg54482/CHRG-118hhrg54482","https://www.govinfo.gov/content/pkg/CHRG-118hhrg54482/pdf/CHRG-118hhrg54482.pdf","1.4 MB","https://www.govinfo.gov/content/pkg/CHRG-118hhrg54482/html/CHRG-118hhrg54482.htm","407.4 KB","","0 B","","0 B","","0 B"," EIGHTEENTH CONGRESS FIRST SESSION JULY 19, 2023 Serial No. 118-25 Printed for the use of the Committee on Homeland Security [GRAPHIC NOT AVAILABLE IN TIFF FORMAT] Available via the World Wide Web: http://www.govinfo.gov U.S. GOVERNMENT PUBLISHING OFFICE 54-482 PDF WASHINGTON : 2024 COMMITTEE ON HOMELAND SECURITY Mark E. Green, MD, Tennessee, ...","","2023-07-19"
"195","Congressional Hearings","CHRG-118hhrg54191","CHRG-118hhrg54191","Department of Defense Appropriations for 2024","https://www.govinfo.gov/app/details/CHRG-118hhrg54191/CHRG-118hhrg54191","https://www.govinfo.gov/content/pkg/CHRG-118hhrg54191/pdf/CHRG-118hhrg54191.pdf","112.8 MB","https://www.govinfo.gov/content/pkg/CHRG-118hhrg54191/html/CHRG-118hhrg54191.htm","590.9 KB","","0 B","","0 B","","0 B","EIGHTEENTH CONGRESS FIRST SESSION SUBCOMMITTEE ON DEFENSE KEN CALVERT, California, Chairman HAROLD ROGERS, Kentucky BETTY McCOLLUM, Minnesota, TOM COLE, Oklahoma C. A. DUTCH RUPPERSBERGER, Maryland STEVE WOMACK, Arkansas MARCY KAPTUR, Ohio ROBERT B. ADERHOLT, Alabama HENRY CUELLAR, Texas JOHN R. CARTER, Texas DEREK KILMER, Washington MARIO ...","","2023-02-28"
"196","Congressional Hearings","CHRG-118hhrg52523","CHRG-118hhrg52523","Legislative Hearing on H.R. 2685, to Require the Secretary of Energy to Provide Technology Grants to Strengthen Domestic Mining Education, and for Other Purposes, ""Mining Schools Act of 2023""; H.R. 3883, to Nullify Public Land Order No. 7921, Withdrawing Certain Land in the Railroad Valley of Nye County, Nevada, from Mineral Entry; and H.R., to Amend the Surface Mining Control and Reclamation Act of 1977 to Authorize Partnerships Between States and Nongovernmental Entities for the Purpose of Reclaiming and Restoring Land and Water Resources Adversely Affected by Coal Mining Activities Before August 3, 1977, and for Other Purposes, ""Community Reclamation Partnerships Act""","https://www.govinfo.gov/app/details/CHRG-118hhrg52523/CHRG-118hhrg52523","https://www.govinfo.gov/content/pkg/CHRG-118hhrg52523/pdf/CHRG-118hhrg52523.pdf","7.1 MB","https://www.govinfo.gov/content/pkg/CHRG-118hhrg52523/html/CHRG-118hhrg52523.htm","191.2 KB","","0 B","","0 B","","0 B"," OF THE COMMITTEE ON NATURAL RESOURCES U.S. HOUSE OF REPRESENTATIVES ONE HUNDRED EIGHTEENTH CONGRESS FIRST SESSION Wednesday, June 14, 2023 Serial No. 118-37 Printed for the use of the Committee on Natural Resources [GRAPHIC NOT AVAILABLE IN TIFF FORMAT] Available via the World Wide Web: http://www.govinfo.gov or Committee address: http://...","","2023-06-14"
"197","Congressional Hearings","CHRG-118shrg51948","CHRG-118shrg51948","Climate-Related Economic Risks and Their Costs to the Federal Budget and Global Economy","https://www.govinfo.gov/app/details/CHRG-118shrg51948/CHRG-118shrg51948","https://www.govinfo.gov/content/pkg/CHRG-118shrg51948/pdf/CHRG-118shrg51948.pdf","7.6 MB","https://www.govinfo.gov/content/pkg/CHRG-118shrg51948/html/CHRG-118shrg51948.htm","106.9 KB","","0 B","","0 B","","0 B"," STATES SENATE ONE HUNDRED EIGHTEENTH CONGRESS FIRST SESSION February 15, 2023 Printed for the use of the Committee on the Budget [GRAPHIC NOT AVAILABLE IN TIFF FORMAT] www.govinfo.gov U.S. GOVERNMENT PUBLISHING OFFICE 51-948 WASHINGTON : 2023 COMMITTEE ON THE BUDGET SHELDON WHITEHOUSE, Rhode Island, Chairman PATTY MURRAY, Washington CHARLES E....","","2023-02-15"
"198","Congressional Hearings","CHRG-118hhrg53915","CHRG-118hhrg53915","The Future of Automated Commercial  Motor Vehicles:  Impacts on Society, the Supply Chain, and U.S. Economic Leadership","https://www.govinfo.gov/app/details/CHRG-118hhrg53915/CHRG-118hhrg53915","https://www.govinfo.gov/content/pkg/CHRG-118hhrg53915/pdf/CHRG-118hhrg53915.pdf","2.9 MB","https://www.govinfo.gov/content/pkg/CHRG-118hhrg53915/html/CHRG-118hhrg53915.htm","567.7 KB","","0 B","","0 B","","0 B"," ON HIGHWAYS AND TRANSIT OF THE COMMITTEE ON TRANSPORTATION AND INFRASTRUCTURE HOUSE OF REPRESENTATIVES ONE HUNDRED EIGHTEENTH CONGRESS FIRST SESSION SEPTEMBER 13, 2023 Printed for the use of the Committee on Transportation and Infrastructure [GRAPHIC NOT AVAILABLE IN TIFF FORMAT] Available online at: https://www.govinfo.gov/committee/...","","2023-09-13"
"199","Congressional Hearings","CHRG-118hhrg52931","CHRG-118hhrg52931","Oversight Hearing on Examining the Biden Administration's Record on Federal Coal Leasing","https://www.govinfo.gov/app/details/CHRG-118hhrg52931/CHRG-118hhrg52931","https://www.govinfo.gov/content/pkg/CHRG-118hhrg52931/pdf/CHRG-118hhrg52931.pdf","1.3 MB","https://www.govinfo.gov/content/pkg/CHRG-118hhrg52931/html/CHRG-118hhrg52931.htm","225.3 KB","","0 B","","0 B","","0 B","COMMITTEE ON NATURAL RESOURCES U.S. HOUSE OF REPRESENTATIVES ONE HUNDRED EIGHTEENTH CONGRESS FIRST SESSION Wednesday, July 12, 2023 Serial No. 118-44 Printed for the use of the Committee on Natural Resources [GRAPHIC NOT AVAILABLE IN TIFF FORMAT] Available via the World Wide Web: http://www.govinfo.gov or Committee address: http://...","","2023-07-12"
"200","Congressional Hearings","CHRG-118hhrg56739","CHRG-118hhrg56739","The Dire State of Religious Freedom Around the World","https://www.govinfo.gov/app/details/CHRG-118hhrg56739/CHRG-118hhrg56739","https://www.govinfo.gov/content/pkg/CHRG-118hhrg56739/pdf/CHRG-118hhrg56739.pdf","9.7 MB","https://www.govinfo.gov/content/pkg/CHRG-118hhrg56739/html/CHRG-118hhrg56739.htm","162.0 KB","","0 B","","0 B","","0 B"," OF THE COMMITTEE ON FOREIGN AFFAIRS HOUSE OF REPRESENTATIVES ONE HUNDRED EIGHTEENTH CONGRESS FIRST SESSION JULY 18, 2023 Serial No. 118-40 Printed for the use of the Committee on Foreign Affairs [GRAPHIC NOT AVAILABLE IN TIFF FORMAT] Available: http://www.foreignaffairs.house.gov/, http:// docs.house.gov, or http://www.govinfo.gov U.S. ...","","2023-07-18"
"201","Congressional Hearings","CHRG-118hhrg53239","CHRG-118hhrg53239","President Biden's Fiscal Year 2024 Budget Request with Treasury Secretary Yellen","https://www.govinfo.gov/app/details/CHRG-118hhrg53239/CHRG-118hhrg53239","https://www.govinfo.gov/content/pkg/CHRG-118hhrg53239/pdf/CHRG-118hhrg53239.pdf","29.7 MB","https://www.govinfo.gov/content/pkg/CHRG-118hhrg53239/html/CHRG-118hhrg53239.htm","182.8 KB","","0 B","","0 B","","0 B"," OF REPRESENTATIVES ONE HUNDRED EIGHTEENTH CONGRESS FIRST SESSION MARCH 10, 2023 Serial No. 118-4 Printed for the use of the Committee on Ways and Means [GRAPHIC NOT AVAILABLE IN TIFF FORMAT] U.S. GOVERNMENT PUBLISHING OFFICE 53-239 WASHINGTON : 2024 COMMITTEE ON WAYS AND MEANS JASON SMITH, Missouri, Chairman VERN BUCHANAN, Florida RICHARD E. NEAL,...","","2023-03-10"
"202","Congressional Hearings","CHRG-118hhrg52394","CHRG-118hhrg52394","Oversight of the Financial Crimes Enforcement Network (Fincen) and the Office of Terrorism and Financial Intelligence (Tfi)","https://www.govinfo.gov/app/details/CHRG-118hhrg52394/CHRG-118hhrg52394","https://www.govinfo.gov/content/pkg/CHRG-118hhrg52394/pdf/CHRG-118hhrg52394.pdf","111.9 MB","https://www.govinfo.gov/content/pkg/CHRG-118hhrg52394/html/CHRG-118hhrg52394.htm","107.4 KB","","0 B","","0 B","","0 B"," ON NATIONAL SECURITY, ILLICIT FINANCE, AND INTERNATIONAL FINANCIAL INSTITUTIONS OF THE COMMITTEE ON FINANCIAL SERVICES U.S. HOUSE OF REPRESENTATIVES ONE HUNDRED EIGHTEENTH CONGRESS FIRST SESSION APRIL 27, 2023 Printed for the use of the Committee on Financial Services Serial No. 118-16 [GRAPHIC NOT AVAILABLE IN TIFF FORMAT] U.S. GOVERNMENT ...","","2023-04-27"
"203","Congressional Hearings","CHRG-118hhrg54081","CHRG-118hhrg54081","Markup of Various Measures","https://www.govinfo.gov/app/details/CHRG-118hhrg54081/CHRG-118hhrg54081","https://www.govinfo.gov/content/pkg/CHRG-118hhrg54081/pdf/CHRG-118hhrg54081.pdf","17.8 MB","https://www.govinfo.gov/content/pkg/CHRG-118hhrg54081/html/CHRG-118hhrg54081.htm","215.4 KB","","0 B","","0 B","","0 B"," 19, 2023 Serial No. 118-53 Printed for the use of the Committee on Foreign Affairs [GRAPHIC NOT AVAILABLE IN TIFF FORMAT] Available: http://www.foreignaffairs.house.gov/, http://docs.house.gov, or http://www.govinfo.gov ______ U.S. GOVERNMENT PUBLISHING OFFICE 54-081PDF WASHINGTON : 2023 COMMITTEE ON FOREIGN AFFAIRS MICHAEL T. McCAUL, Texas, ...","","2023-10-19"
"204","Congressional Hearings","CHRG-118hhrg53874","CHRG-118hhrg53874","[H.A.S.C. No. 118-29] FISCAL YEAR 2024 BUDGET REQUEST FOR MILITARY READINESS","https://www.govinfo.gov/app/details/CHRG-118hhrg53874/CHRG-118hhrg53874","https://www.govinfo.gov/content/pkg/CHRG-118hhrg53874/pdf/CHRG-118hhrg53874.pdf","4.6 MB","https://www.govinfo.gov/content/pkg/CHRG-118hhrg53874/html/CHRG-118hhrg53874.htm","129.1 KB","","0 B","","0 B","","0 B"," COMMITTEE ON ARMED SERVICES HOUSE OF REPRESENTATIVES ONE HUNDRED EIGHTEENTH CONGRESS FIRST SESSION SUBCOMMITTEE ON READINESS HEARING ON FISCAL YEAR 2024 BUDGET REQUEST FOR MILITARY READINESS HEARING HELD APRIL 19, 2023 [GRAPHIC NOT AVAILABLE IN TIFF FORMAT] U.S. GOVERNMENT PUBLISHING OFFICE 53-874 WASHINGTON : 2024 SUBCOMMITTEE ON READINESS ...","","2023-04-19"
"205","Congressional Hearings","CHRG-118shrg54121","CHRG-118shrg54121","Bottlenecks and Backlogs: How Climate Change Threatens Supply Chains","https://www.govinfo.gov/app/details/CHRG-118shrg54121/CHRG-118shrg54121","https://www.govinfo.gov/content/pkg/CHRG-118shrg54121/pdf/CHRG-118shrg54121.pdf","50.2 MB","https://www.govinfo.gov/content/pkg/CHRG-118shrg54121/html/CHRG-118shrg54121.htm","99.8 KB","","0 B","","0 B","","0 B","ONE HUNDRED EIGHTEENTH CONGRESS FIRST SESSION October 25, 2023 Printed for the use of the Committee on the Budget [GRAPHIC NOT AVAILABLE IN TIFF FORMAT] U.S. GOVERNMENT PUBLISHING OFFICE 54-121 WASHINGTON : 2024 COMMITTEE ON THE BUDGET SHELDON WHITEHOUSE, Rhode Island, Chairman PATTY MURRAY, Washington CHARLES E. GRASSLEY, Iowa RON WYDEN, Oregon ...","","2023-10-25"
"206","Congressional Hearings","CHRG-118shrg60005","CHRG-118shrg60005","The Conflict in Ukraine","https://www.govinfo.gov/app/details/CHRG-118shrg60005/CHRG-118shrg60005","https://www.govinfo.gov/content/pkg/CHRG-118shrg60005/pdf/CHRG-118shrg60005.pdf","3.4 MB","https://www.govinfo.gov/content/pkg/CHRG-118shrg60005/html/CHRG-118shrg60005.htm","157.6 KB","","0 B","","0 B","","0 B"," FEBRUARY 28, 2023 Printed for the use of the Committee on Armed Services [GRAPHIC(S) NOT AVAILABLE IN TIFF FORMAT] Available via: http://www.govinfo.gov ------ U.S. GOVERNMENT PUBLISHING OFFICE 60-005 WASHINGTON : 2025 COMMITTEE ON ARMED SERVICES JACK REED, Rhode Island, Chairman JEANNE SHAHEEN, New Hampshire ROGER F. WICKER, Mississippi ...","","2023-02-28"
"207","Congressional Hearings","CHRG-118shrg55518","CHRG-118shrg55518","The President's Budget Request for the Department of Energy for Fiscal Year 2024","https://www.govinfo.gov/app/details/CHRG-118shrg55518/CHRG-118shrg55518","https://www.govinfo.gov/content/pkg/CHRG-118shrg55518/pdf/CHRG-118shrg55518.pdf","73.1 MB","https://www.govinfo.gov/content/pkg/CHRG-118shrg55518/html/CHRG-118shrg55518.htm","126.5 KB","","0 B","","0 B","","0 B"," UNITED STATES SENATE ONE HUNDRED EIGHTEENTH CONGRESS FIRST SESSION APRIL 20, 2023 [GRAPHIC(S) NOT AVAILABLE IN TIFF FORMAT] Printed for the use of the Committee on Energy and Natural Resources Available via the World Wide Web: http://www.govinfo.gov _______ U.S. GOVERNMENT PUBLISHING OFFICE 55-518 WASHINGTON : 2025 COMMITTEE ON ENERGY AND ...","","2023-04-20"
"208","Congressional Hearings","CHRG-118hhrg52380","CHRG-118hhrg52380","[H.A.S.C. No. 118-5] The Future of War:  Is The Pentagon Prepared To Deter and Defeat America's Adversaries?","https://www.govinfo.gov/app/details/CHRG-118hhrg52380/CHRG-118hhrg52380","https://www.govinfo.gov/content/pkg/CHRG-118hhrg52380/pdf/CHRG-118hhrg52380.pdf","3.3 MB","https://www.govinfo.gov/content/pkg/CHRG-118hhrg52380/html/CHRG-118hhrg52380.htm","127.6 KB","","0 B","","0 B","","0 B"," INFORMATION TECHNOLOGIES, AND INNOVATION OF THE COMMITTEE ON ARMED SERVICES HOUSE OF REPRESENTATIVES ONE HUNDRED EIGHTEENTH CONGRESS FIRST SESSION HEARING HELD FEBRUARY 9, 2023 [GRAPHIC NOT AVAILABLE IN TIFF FORMAT] U.S. GOVERNMENT PUBLISHING OFFICE 52-380 WASHINGTON : 2023 SUBCOMMITTEE ON CYBER, INFORMATION TECHNOLOGIES, AND INNOVATION MIKE ...","","2023-02-09"
"209","Congressional Hearings","CHRG-118hhrg57716","CHRG-118hhrg57716","Driving Affordability: Preserving People's Freedom to Buy Affordable Vehicles and Fuel","https://www.govinfo.gov/app/details/CHRG-118hhrg57716/CHRG-118hhrg57716","https://www.govinfo.gov/content/pkg/CHRG-118hhrg57716/pdf/CHRG-118hhrg57716.pdf","23.0 MB","https://www.govinfo.gov/content/pkg/CHRG-118hhrg57716/html/CHRG-118hhrg57716.htm","241.6 KB","","0 B","","0 B","","0 B"," AND CRITICAL MATERIALS OF THE COMMITTEE ON ENERGY AND COMMERCE HOUSE OF REPRESENTATIVES ONE HUNDRED EIGHTEENTH CONGRESS FIRST SESSION JUNE 22, 2023 Serial No. 118-53 [GRAPHIC NOT AVAILABLE IN TIFF FORMAT] Published for the use of the Committee on Energy and Commerce govinfo.gov/committee/house-energy energycommerce.house.gov U.S. GOVERNMENT ...","","2023-06-22"
"210","Congressional Hearings","CHRG-118hhrg52161","CHRG-118hhrg52161","ESG Part I: An Examination of Environmental, Social, and Governance Practices with Attorneys General","https://www.govinfo.gov/app/details/CHRG-118hhrg52161/CHRG-118hhrg52161","https://www.govinfo.gov/content/pkg/CHRG-118hhrg52161/pdf/CHRG-118hhrg52161.pdf","285.9 KB","https://www.govinfo.gov/content/pkg/CHRG-118hhrg52161/html/CHRG-118hhrg52161.htm","223.0 KB","","0 B","","0 B","","0 B"," HOUSE OF REPRESENTATIVES ONE HUNDRED EIGHTEENTH CONGRESS FIRST SESSION MAY 10, 2023 Serial No. 118-27 Printed for the use of the Committee on Oversight and Accountability [GRAPHIC NOT AVAILABLE IN TIFF FORMAT] Available on: govinfo.gov, oversight.house.gov or docs.house.gov U.S. GOVERNMENT PUBLISHING OFFICE 53-161 PDF WASHINGTON : 2023...","","2023-05-10"
"211","Congressional Hearings","CHRG-118hhrg53089","CHRG-118hhrg53089","Stakeholder Perspectives on Agricultural Trade","https://www.govinfo.gov/app/details/CHRG-118hhrg53089/CHRG-118hhrg53089","https://www.govinfo.gov/content/pkg/CHRG-118hhrg53089/pdf/CHRG-118hhrg53089.pdf","443.7 KB","https://www.govinfo.gov/content/pkg/CHRG-118hhrg53089/html/CHRG-118hhrg53089.htm","195.3 KB","","0 B","","0 B","","0 B"," AGRICULTURE HOUSE OF REPRESENTATIVES ONE HUNDRED EIGHTEENTH CONGRESS FIRST SESSION MAY 11, 2023 Serial No. 118-10 [GRAPHIC) NOT AVAILABLE IN TIFF FORMAT] Printed for the use of the Committee on Agriculture agriculture.house.gov ______ U.S. GOVERNMENT PUBLISHING OFFICE 53-089 PDF WASHINGTON : 2023 COMMITTEE ON AGRICULTURE GLENN THOMPSON, ...","","2023-05-11"
"212","Congressional Hearings","CHRG-118hhrg56530","CHRG-118hhrg56530","Member Day","https://www.govinfo.gov/app/details/CHRG-118hhrg56530/CHRG-118hhrg56530","https://www.govinfo.gov/content/pkg/CHRG-118hhrg56530/pdf/CHRG-118hhrg56530.pdf","29.4 MB","https://www.govinfo.gov/content/pkg/CHRG-118hhrg56530/html/CHRG-118hhrg56530.htm","199.4 KB","","0 B","","0 B","","0 B"," No. 118-FC13 Printed for the use of the Committee on Ways and Means [GRAPHIC NOT AVAILABLE IN TIFF FORMAT] U.S. GOVERNMENT PUBLISHING OFFICE 56-530 WASHINGTON : 2024 COMMITTEE ON WAYS AND MEANS JASON SMITH, Missouri, Chairman VERN BUCHANAN, Florida RICHARD E. NEAL, Massachusetts ADRIAN SMITH, Nebraska LLOYD DOGGETT, Texas MIKE KELLY, ...","","2023-09-14"
"213","Congressional Hearings","CHRG-118hhrg55024","CHRG-118hhrg55024","Member Day","https://www.govinfo.gov/app/details/CHRG-118hhrg55024/CHRG-118hhrg55024","https://www.govinfo.gov/content/pkg/CHRG-118hhrg55024/pdf/CHRG-118hhrg55024.pdf","8.2 MB","https://www.govinfo.gov/content/pkg/CHRG-118hhrg55024/html/CHRG-118hhrg55024.htm","85.8 KB","","0 B","","0 B","","0 B"," 2023 Printed for the use of the Committee on Financial Services Serial No. 118-56 [GRAPHIC(S) NOT AVAILABLE IN TIFF FORMAT] ______ U.S. GOVERNMENT PUBLISHING OFFICE 55-024 PDF WASHINGTON : 2024 HOUSE COMMITTEE ON FINANCIAL SERVICES PATRICK McHENRY, North Carolina, Chairman FRANK D. LUCAS, Oklahoma MAXINE WATERS, California, Ranking PETE SESSIONS, ...","","2023-11-09"
"214","Congressional Hearings","CHRG-118hhrg54411","CHRG-118hhrg54411","State, Foreign Operations, and Related Programs Appropriations for 2024","https://www.govinfo.gov/app/details/CHRG-118hhrg54411/CHRG-118hhrg54411","https://www.govinfo.gov/content/pkg/CHRG-118hhrg54411/pdf/CHRG-118hhrg54411.pdf","11.3 MB","https://www.govinfo.gov/content/pkg/CHRG-118hhrg54411/html/CHRG-118hhrg54411.htm","469.0 B","","0 B","","0 B","","0 B",", UNITED STATES AMBASSADOR TO THE UNITED NATIONS OPENING STATEMENT OF CHAIRMAN DIAZ-BALART Mr. DIAZ-BALART. The Subcommittee on State, Foreign Oper- ations, and Related Programs will come to order. Ambassador Greenfield, what a pleasure to have you here. Wel- come to our first subcommittee hearing of the 118th Congress, re- garding oversight of...","","2023-03-01"
"215","Congressional Hearings","CHRG-118shrg55804","CHRG-118shrg55804","U.S. Leadership on Artificial Intelligence in an Era of Strategic Competition","https://www.govinfo.gov/app/details/CHRG-118shrg55804/CHRG-118shrg55804","https://www.govinfo.gov/content/pkg/CHRG-118shrg55804/pdf/CHRG-118shrg55804.pdf","1.9 MB","https://www.govinfo.gov/content/pkg/CHRG-118shrg55804/html/CHRG-118shrg55804.htm","142.8 KB","","0 B","","0 B","","0 B"," STATES SENATE ONE HUNDRED EIGHTEENTH CONGRESS FIRST SESSION NOVEMBER 15, 2023 Printed for the use of the Committee on Foreign Relations [GRAPHIC NOT AVAILABLE IN TIFF FORMAT] Available via http://www.govinfo.gov U.S. GOVERNMENT PUBLISHING OFFICE 55-804 PDF WASHINGTON : 2024 COMMITTEE ON FOREIGN RELATIONS BENJAMIN L. CARDIN, Maryland, Chairman ...","","2023-11-15"
"216","Congressional Hearings","CHRG-118hhrg55573","CHRG-118hhrg55573","BACK TO THE FUTURE","https://www.govinfo.gov/app/details/CHRG-118hhrg55573/CHRG-118hhrg55573","https://www.govinfo.gov/content/pkg/CHRG-118hhrg55573/pdf/CHRG-118hhrg55573.pdf","3.2 MB","https://www.govinfo.gov/content/pkg/CHRG-118hhrg55573/html/CHRG-118hhrg55573.htm","86.6 KB","","0 B","","0 B","","0 B"," SERVICES HOUSE OF REPRESENTATIVES ONE HUNDRED EIGHTEENTH CONGRESS FIRST SESSION HEARING HELD DECEMBER 6, 2023 [GRAPHIC NOT AVAILABLE IN TIFF FORMAT] U.S. GOVERNMENT PUBLISHING OFFICE 55-573 WASHINGTON : 2024 SUBCOMMITTEE ON CYBER, INFORMATION TECHNOLOGIES, AND INNOVATION MIKE GALLAGHER, Wisconsin, Chairman MATT GAETZ, Florida RO KHANNA, ...","","2023-12-06"
"217","Congressional Hearings","CHRG-118jhrg54590","CHRG-118jhrg54590","The Real Cost of an Open Border: How Americans Are Paying the Price","https://www.govinfo.gov/app/details/CHRG-118jhrg54590/CHRG-118jhrg54590","https://www.govinfo.gov/content/pkg/CHRG-118jhrg54590/pdf/CHRG-118jhrg54590.pdf","2.1 MB","https://www.govinfo.gov/content/pkg/CHRG-118jhrg54590/html/CHRG-118jhrg54590.htm","362.0 KB","","0 B","","0 B","","0 B","SUBCOMMITTEE ON COUNTERTERRORISM, LAW ENFORCEMENT, AND INTELLIGENCE OF THE COMMITTEE ON HOMELAND SECURITY HOUSE OF REPRESENTATIVES ONE HUNDRED EIGHTEENTH CONGRESS FIRST SESSION JULY 26, 2023 Serial No. 118-26 Printed for the use of the Committee on Homeland Security [GRAPHIC NOT AVAILABLE IN TIFF FORMAT] Available via the World Wide Web: http://...","","2023-07-26"
"218","Congressional Hearings","CHRG-118hhrg52321","CHRG-118hhrg52321","Oversight Hearing on the Biden Administration's Executive Overreach and Its Impact on American Energy Independence","https://www.govinfo.gov/app/details/CHRG-118hhrg52321/CHRG-118hhrg52321","https://www.govinfo.gov/content/pkg/CHRG-118hhrg52321/pdf/CHRG-118hhrg52321.pdf","1.2 MB","https://www.govinfo.gov/content/pkg/CHRG-118hhrg52321/html/CHRG-118hhrg52321.htm","281.3 KB","","0 B","","0 B","","0 B","AND INVESTIGATIONS OF THE COMMITTEE ON NATURAL RESOURCES U.S. HOUSE OF REPRESENTATIVES ONE HUNDRED EIGHTEENTH CONGRESS FIRST SESSION Thursday, May 11, 2023 Serial No. 118-26 Printed for the use of the Committee on Natural Resources [GRAPHIC NOT AVAILABLE IN TIFF FORMAT] Available via the World Wide Web: http://www.govinfo.gov or Committee address: ...","","2023-05-11"
"219","Congressional Hearings","CHRG-118shrg58970","CHRG-118shrg58970","Back to School with the Shop Safe Act: Protecting Our Families from Unsafe Online Counterfeits","https://www.govinfo.gov/app/details/CHRG-118shrg58970/CHRG-118shrg58970","https://www.govinfo.gov/content/pkg/CHRG-118shrg58970/pdf/CHRG-118shrg58970.pdf","61.0 MB","https://www.govinfo.gov/content/pkg/CHRG-118shrg58970/html/CHRG-118shrg58970.htm","94.7 KB","","0 B","","0 B","","0 B"," PROPERTY of the COMMITTEE ON THE JUDICIARY UNITED STATES SENATE ONE HUNDRED EIGHTEENTH CONGRESS FIRST SESSION OCTOBER 3, 2023 Serial No. J-118-34 Printed for the use of the Committee on the Judiciary [GRAPHIC NOT AVAILABLE IN TIFF FORMAT] www.judiciary.senate.gov www.govinfo.gov ______ U.S. GOVERNMENT PUBLISHING OFFICE 58-970 WASHINGTON :...","","2023-10-03"
