"index","collection","packageId","granuleId","title","detailsLink","pdfLink","pdfSize","htmlLink","htmlSize","xmlLink","xmlSize","otherLink1","other1Size","otherLink2","other2Size","teaser","historical","publishdate"
"284","Congressional Hearings","CHRG-116hhrg56468","CHRG-116hhrg56468","Generating Equity: Improving Clean Energy Access and Affordability","https://www.govinfo.gov/app/details/CHRG-116hhrg56468/CHRG-116hhrg56468","https://www.govinfo.gov/content/pkg/CHRG-116hhrg56468/pdf/CHRG-116hhrg56468.pdf","31.4 MB","https://www.govinfo.gov/content/pkg/CHRG-116hhrg56468/html/CHRG-116hhrg56468.htm","204.4 KB","","0 B","","0 B","","0 B"," HOUSE OF REPRESENTATIVES ONE HUNDRED SIXTEENTH CONGRESS SECOND SESSION OCTOBER 1, 2020 Serial No. 116-129 [GRAPHIC(S) NOT AVAILABLE IN TIFF FORMAT] Printed for the use of the Committee on Energy and Commerce govinfo.gov/committee/house-energy energycommerce.house.gov ______ U.S. GOVERNMENT PUBLISHING OFFICE 56-468 WASHINGTON : 2024 ...","","2020-10-01"
"285","Congressional Hearings","CHRG-116hhrg41478","CHRG-116hhrg41478","[H.A.S.C. No. 116-60] Update on Navy and Marine Corps Readiness in the Pacific in the Aftermath of Recent Mishaps","https://www.govinfo.gov/app/details/CHRG-116hhrg41478/CHRG-116hhrg41478","https://www.govinfo.gov/content/pkg/CHRG-116hhrg41478/pdf/CHRG-116hhrg41478.pdf","488.2 KB","https://www.govinfo.gov/content/pkg/CHRG-116hhrg41478/html/CHRG-116hhrg41478.htm","131.3 KB","","0 B","","0 B","","0 B"," ON SEAPOWER AND PROJECTION FORCES meeting jointly with the SUBCOMMITTEE ON READINESS of the COMMITTEE ON ARMED SERVICES HOUSE OF REPRESENTATIVES ONE HUNDRED SIXTEENTH CONGRESS SECOND SESSION HEARING HELD FEBRUARY 5, 2020 [GRAPHIC(S) NOT AVAILABLE IN TIFF FORMAT] ______ U.S. GOVERNMENT PUBLISHING OFFICE 41-478 WASHINGTON : 2021 SUBCOMMITTEE ON ...","","2020-02-05"
"286","Congressional Hearings","CHRG-116hhrg41104","CHRG-116hhrg41104","Examining the Federal Government's Actions to Protect Workers from COVID-19","https://www.govinfo.gov/app/details/CHRG-116hhrg41104/CHRG-116hhrg41104","https://www.govinfo.gov/content/pkg/CHRG-116hhrg41104/pdf/CHRG-116hhrg41104.pdf","47.2 MB","https://www.govinfo.gov/content/pkg/CHRG-116hhrg41104/html/CHRG-116hhrg41104.htm","207.2 KB","","0 B","","0 B","","0 B"," AND LABOR U.S. HOUSE OF REPRESENTATIVES ONE HUNDRED SIXTEENTH CONGRESS SECOND SESSION HEARING HELD IN WASHINGTON, DC, MAY 28, 2020 Serial No. 116-57 Printed for the use of the Committee on Education and Labor [GRAPHIC NOT AVAILABLE IN TIFF FORMAT] Available via the: https://edlabor.house.gov or www.govinfo.gov U.S. GOVERNMENT PUBLISHING ...","","2020-05-28"
"287","Congressional Hearings","CHRG-116hhrg44852","CHRG-116hhrg44852","Pollution and Pandemics: COVID-19's Disproportionate Impact on Environmental Justice Communities","https://www.govinfo.gov/app/details/CHRG-116hhrg44852/CHRG-116hhrg44852","https://www.govinfo.gov/content/pkg/CHRG-116hhrg44852/pdf/CHRG-116hhrg44852.pdf","14.1 MB","https://www.govinfo.gov/content/pkg/CHRG-116hhrg44852/html/CHRG-116hhrg44852.htm","205.3 KB","","0 B","","0 B","","0 B"," AND CLIMATE CHANGE OF THE COMMITTEE ON ENERGY AND COMMERCE HOUSE OF REPRESENTATIVES ONE HUNDRED SIXTEENTH CONGRESS SECOND SESSION JUNE 9, 2020 Serial No. 116-112 [GRAPHIC(S) NOT AVAILABLE IN TIFF FORMAT] Printed for the use of the Committee on Energy and Commerce govinfo.gov/committee/house-energy energycommerce.house.gov U.S. GOVERNMENT ...","","2020-06-09"
"288","Congressional Hearings","CHRG-116shrg45465","CHRG-116shrg45465","President's Fiscal Year 2021 Health Care Proposals","https://www.govinfo.gov/app/details/CHRG-116shrg45465/CHRG-116shrg45465","https://www.govinfo.gov/content/pkg/CHRG-116shrg45465/pdf/CHRG-116shrg45465.pdf","565.8 KB","https://www.govinfo.gov/content/pkg/CHRG-116shrg45465/html/CHRG-116shrg45465.htm","579.9 KB","","0 B","","0 B","","0 B"," CONGRESS SECOND SESSION FEBRUARY 13, 2020 [GRAPHIC NOT AVAILABLE IN TIFF FORMAT] Printed for the use of the Committee on Finance U.S. GOVERNMENT PUBLISHING OFFICE 45-465-PDF WASHINGTON : 2021 COMMITTEE ON FINANCE CHUCK GRASSLEY, Iowa, Chairman MIKE CRAPO, Idaho RON WYDEN, Oregon PAT ROBERTS, Kansas DEBBIE STABENOW, Michigan MICHAEL B. ENZI, ...","","2020-02-13"
"289","Congressional Hearings","CHRG-116hhrg38916","CHRG-116hhrg38916","From Sanctions to the Soleimani Strike to Escalation: Evaluating the Administration's Iran Policy","https://www.govinfo.gov/app/details/CHRG-116hhrg38916/CHRG-116hhrg38916","https://www.govinfo.gov/content/pkg/CHRG-116hhrg38916/pdf/CHRG-116hhrg38916.pdf","4.6 MB","https://www.govinfo.gov/content/pkg/CHRG-116hhrg38916/html/CHRG-116hhrg38916.htm","193.1 KB","","0 B","","0 B","","0 B"," OF REPRESENTATIVES ONE HUNDRED SIXTEENTH CONGRESS SECOND SESSION January 14, 2020 Serial No. 116-89 Printed for the use of the Committee on Foreign Affairs [GRAPHIC NOT AVAILABLE IN TIFF FORMAT] Available: http://www.foreignaffairs.house.gov/, http:// docs.house.gov, or http://www.govinfo.gov U.S. GOVERNMENT PUBLISHING OFFICE 38-916PDF ...","","2020-01-14"
"290","Congressional Hearings","CHRG-116hhrg42741","CHRG-116hhrg42741","Voting Rights and Election Administration: Combatting Misinformation in the 2020 Election","https://www.govinfo.gov/app/details/CHRG-116hhrg42741/CHRG-116hhrg42741","https://www.govinfo.gov/content/pkg/CHRG-116hhrg42741/pdf/CHRG-116hhrg42741.pdf","12.2 MB","https://www.govinfo.gov/content/pkg/CHRG-116hhrg42741/html/CHRG-116hhrg42741.htm","67.1 KB","","0 B","","0 B","","0 B"," ON HOUSE ADMINISTRATION HOUSE OF REPRESENTATIVES ONE HUNDRED SIXTEENTH CONGRESS SECOND SESSION OCTOBER 6, 2020 Printed for the use of the Committee on House Administration [GRAPHIC NOT AVAILABLE IN TIFF FORMAT] Available on the Internet: http://www.gpoinfo.gov/committee/house-administration U.S. GOVERNMENT PUBLISHING OFFICE 42-741 PDF WASHINGTON...","","2020-10-06"
"291","Congressional Hearings","CHRG-116hhrg41468","CHRG-116hhrg41468","Paycheck Protection Program: An Examination of Loan Forgiveness, SBA Legacy Systems, and Inaccurate Data","https://www.govinfo.gov/app/details/CHRG-116hhrg41468/CHRG-116hhrg41468","https://www.govinfo.gov/content/pkg/CHRG-116hhrg41468/pdf/CHRG-116hhrg41468.pdf","1.3 MB","https://www.govinfo.gov/content/pkg/CHRG-116hhrg41468/html/CHRG-116hhrg41468.htm","67.6 KB","","0 B","","0 B","","0 B"," AND WORKFORCE DEVELOPMENT OF THE COMMITTEE ON SMALL BUSINESS UNITED STATES HOUSE OF REPRESENTATIVES ONE HUNDRED SIXTEENTH CONGRESS SECOND SESSION HEARING HELD SEPTEMBER 24, 2020 [GRAPHIC NOT AVAILABLE IN TIFF FORMAT] Small Business Committee Document Number 116-094 Available via the GPO Website: www.govinfo.gov U.S. GOVERNMENT PUBLISHING OFFICE ...","","2020-09-24"
"292","Congressional Hearings","CHRG-116shrg44021","CHRG-116shrg44021","The Government Accountability Office's Annual Report on the Nation's Fiscal Health","https://www.govinfo.gov/app/details/CHRG-116shrg44021/CHRG-116shrg44021","https://www.govinfo.gov/content/pkg/CHRG-116shrg44021/pdf/CHRG-116shrg44021.pdf","14.4 MB","https://www.govinfo.gov/content/pkg/CHRG-116shrg44021/html/CHRG-116shrg44021.htm","66.8 KB","","0 B","","0 B","","0 B","STATES SENATE ONE HUNDRED SIXTEENTH CONGRESS SECOND SESSION March 12, 2020 Printed for the use of the Committee on the Budget [GRAPHIC NOT AVAILABLE IN TIFF FORMAT] U.S. GOVERNMENT PUBLISHING OFFICE 44-021 WASHINGTON : 2021 COMMITTEE ON THE BUDGET MICHAEL B. ENZI, Wyoming, Chairman CHARLES E. GRASSLEY, Iowa BERNARD SANDERS, Vermont MIKE CRAPO, ...","","2020-03-12"
"293","Congressional Hearings","CHRG-116shrg52821","CHRG-116shrg52821","The Pact Act and Section 230: The Impact of the Law that Helped Create the Internet and an Examination of Proposed Reforms for Today's Online World","https://www.govinfo.gov/app/details/CHRG-116shrg52821/CHRG-116shrg52821","https://www.govinfo.gov/content/pkg/CHRG-116shrg52821/pdf/CHRG-116shrg52821.pdf","2.5 MB","https://www.govinfo.gov/content/pkg/CHRG-116shrg52821/html/CHRG-116shrg52821.htm","370.3 KB","","0 B","","0 B","","0 B"," ONLINE WORLD HEARING before the SUBCOMMITTEE ON COMMUNICATIONS, TECHNOLOGY, INNOVATION AND THE INTERNET of the COMMITTEE ON COMMERCE, SCIENCE, AND TRANSPORTATION UNITED STATES SENATE ONE HUNDRED SIXTEENTH CONGRESS SECOND SESSION JULY 28, 2020 Printed for the use of the Committee on Commerce, Science, and Transportation [GRAPHIC(S) NOT AVAILABLE ...","","2020-07-28"
"294","Congressional Hearings","CHRG-116hhrg39457","CHRG-116hhrg39457","SBA Management Review: Office of Field Operations","https://www.govinfo.gov/app/details/CHRG-116hhrg39457/CHRG-116hhrg39457","https://www.govinfo.gov/content/pkg/CHRG-116hhrg39457/pdf/CHRG-116hhrg39457.pdf","709.6 KB","https://www.govinfo.gov/content/pkg/CHRG-116hhrg39457/html/CHRG-116hhrg39457.htm","67.7 KB","","0 B","","0 B","","0 B"," CONGRESS SECOND SESSION HEARING HELD JANUARY 29, 2020 [GRAPHIC NOT AVAILABLE IN TIFF FORMAT] Small Business Committee Document Number 116-068 Available via the GPO Website: www.govinfo.gov U.S. GOVERNMENT PUBLISHING OFFICE 39-457 WASHINGTON : 2020 HOUSE COMMITTEE ON SMALL BUSINESS NYDIA VELAZQUEZ, New York, Chairwoman ABBY FINKENAUER, Iowa...","","2020-01-29"
"295","Congressional Hearings","CHRG-116shrg42248","CHRG-116shrg42248","Implementation of Title IV of the Cares Act","https://www.govinfo.gov/app/details/CHRG-116shrg42248/CHRG-116shrg42248","https://www.govinfo.gov/content/pkg/CHRG-116shrg42248/pdf/CHRG-116shrg42248.pdf","2.8 MB","https://www.govinfo.gov/content/pkg/CHRG-116shrg42248/html/CHRG-116shrg42248.htm","250.0 KB","","0 B","","0 B","","0 B"," HUNDRED SIXTEENTH CONGRESS SECOND SESSION ON EXAMINING TITLE IV OF THE CARES ACT JUNE 2, 2020 Printed for the use of the Committee on Banking, Housing, and Urban Affairs [GRAPHICS NOT AVAILABLE IN TIFF FORMAT] Available at: https: //www.govinfo.gov / U.S. GOVERNMENT PUBLISHING OFFICE 42-248 PDF WASHINGTON : 2021 COMMITTEE ON BANKING, HOUSING, AND...","","2020-06-02"
"296","Congressional Hearings","CHRG-116shrg56585","CHRG-116shrg56585","The Findings and Recommendations of the Cyberspace Solarium Commission","https://www.govinfo.gov/app/details/CHRG-116shrg56585/CHRG-116shrg56585","https://www.govinfo.gov/content/pkg/CHRG-116shrg56585/pdf/CHRG-116shrg56585.pdf","3.6 MB","https://www.govinfo.gov/content/pkg/CHRG-116shrg56585/html/CHRG-116shrg56585.htm","168.2 KB","","0 B","","0 B","","0 B"," ON ARMED SERVICES UNITED STATES SENATE ONE HUNDRED SIXTEENTH CONGRESS SECOND SESSION AUGUST 4, 2020 Printed for the use of the Committee on Armed Services [GRAPHIC NOT AVAILABLE IN TIFF FORMAT] Available via: http:// www.govinfo.gov ______ U.S. GOVERNMENT PUBLISHING OFFICE 56-585 PDF WASHINGTON : 2024 COMMITTEE ON ARMED SERVICES JAMES M. INHOFE...","","2020-08-04"
"297","Congressional Hearings","CHRG-116hhrg39570","CHRG-116hhrg39570","Management and Spending Challenges Within the Department of Energy's Office of Energy Efficiency and Renewable Energy","https://www.govinfo.gov/app/details/CHRG-116hhrg39570/CHRG-116hhrg39570","https://www.govinfo.gov/content/pkg/CHRG-116hhrg39570/pdf/CHRG-116hhrg39570.pdf","20.3 MB","https://www.govinfo.gov/content/pkg/CHRG-116hhrg39570/html/CHRG-116hhrg39570.htm","152.6 KB","","0 B","","0 B","","0 B"," ON INVESTIGATIONS AND OVERSIGHT SUBCOMMITTEE ON ENERGY OF THE COMMITTEE ON SCIENCE, SPACE, AND TECHNOLOGY HOUSE OF REPRESENTATIVES ONE HUNDRED SIXTEENTH CONGRESS SECOND SESSION February 5, 2020 Serial No. 116-66 Printed for the use of the Committee on Science, Space, and Technology [GRAPHIC(S) NOT AVAILABLE IN TIFF FORMAT] Available via the ...","","2020-02-05"
"298","Congressional Hearings","CHRG-116hhrg42435","CHRG-116hhrg42435","Diplomacy or Dead End: An Evaluation of Syria Policy","https://www.govinfo.gov/app/details/CHRG-116hhrg42435/CHRG-116hhrg42435","https://www.govinfo.gov/content/pkg/CHRG-116hhrg42435/pdf/CHRG-116hhrg42435.pdf","3.6 MB","https://www.govinfo.gov/content/pkg/CHRG-116hhrg42435/html/CHRG-116hhrg42435.htm","158.0 KB","","0 B","","0 B","","0 B"," SECOND SESSION DECEMBER 9, 2020 Serial No. 116-138 Printed for the use of the Committee on Foreign Affairs [GRAPHIC NOT AVAILABLE IN TIFF FORMAT] Available: http://www.foreignaffairs.house.gov/, http:// docs.house.gov, or http://www.govinfo.gov U.S. GOVERNMENT PUBLISHING OFFICE 42-435PDF WASHINGTON : 2021 COMMITTEE ON FOREIGN AFFAIRS ELIOT ...","","2020-12-09"
"299","Congressional Hearings","CHRG-116shrg19104893","CHRG-116shrg19104893","Departments of Labor, Health and Human Services, and Education, and Related Agencies Appropriations for Fiscal Year 2021","https://www.govinfo.gov/app/details/CHRG-116shrg19104893/CHRG-116shrg19104893","https://www.govinfo.gov/content/pkg/CHRG-116shrg19104893/pdf/CHRG-116shrg19104893.pdf","3.2 MB","https://www.govinfo.gov/content/pkg/CHRG-116shrg19104893/html/CHRG-116shrg19104893.htm","424.9 KB","","0 B","","0 B","","0 B","Senate, Subcommittee of the Committee on Appropriations, Washington, DC. The subcommittee met at 10:05 a.m. in room SD-106, Dirksen Senate Office Building, Hon. Roy Blunt (chairman) presiding. Present: Senators Blunt, Shelby, Alexander, Moran, Capito, Kennedy, Murray, Durbin, Shaheen, Merkley, Baldwin, Murphy, and Manchin. DEPARTMENT OF HEALTH AND ...","","2020-07-02"
"300","Congressional Hearings","CHRG-116hhrg54858","CHRG-116hhrg54858","A Country in Crisis: How Disinformation Online Is Dividing the Nation","https://www.govinfo.gov/app/details/CHRG-116hhrg54858/CHRG-116hhrg54858","https://www.govinfo.gov/content/pkg/CHRG-116hhrg54858/pdf/CHRG-116hhrg54858.pdf","67.3 MB","https://www.govinfo.gov/content/pkg/CHRG-116hhrg54858/html/CHRG-116hhrg54858.htm","242.1 KB","","0 B","","0 B","","0 B","AND THE SUBCOMMITTEE ON CONSUMER PROTECTION AND COMMERCE OF THE COMMITTEE ON ENERGY AND COMMERCE HOUSE OF REPRESENTATIVES ONE HUNDRED SIXTEENTH CONGRESS SECOND SESSION JUNE 24, 2020 Serial No. 116-116 [GRAPHIC NOT AVAILABLE IN TIFF FORMAT] Printed for the use of the Committee on Energy and Commerce govinfo.gov/committee/house-energy ...","","2020-06-24"
"301","Congressional Hearings","CHRG-116hhrg41343","CHRG-116hhrg41343","Protecting the Right to Vote During the COVID-19 Pandemic","https://www.govinfo.gov/app/details/CHRG-116hhrg41343/CHRG-116hhrg41343","https://www.govinfo.gov/content/pkg/CHRG-116hhrg41343/pdf/CHRG-116hhrg41343.pdf","34.9 MB","https://www.govinfo.gov/content/pkg/CHRG-116hhrg41343/html/CHRG-116hhrg41343.htm","156.6 KB","","0 B","","0 B","","0 B"," COMMITTEE ON THE JUDICIARY HOUSE OF REPRESENTATIVES ONE HUNDRED SIXTEENTH CONGRESS SECOND SESSION JUNE 3, 2020 Serial No. 116-79 _________ Printed for the use of the Committee on the Judiciary [GRAPHIC NOT AVAILABLE IN TIFF FORMAT] Available http://judiciary.house.gov or www.govinfo.gov U.S. GOVERNMENT PUBLISHING OFFICE 41-343 WASHINGTON : 2021 ...","","2020-06-03"
"302","Congressional Hearings","CHRG-116shrg42251","CHRG-116shrg42251","Nomination of the Honorable Russell T. Vought, of Virginia, to Be Director of the Office of Management and Budget","https://www.govinfo.gov/app/details/CHRG-116shrg42251/CHRG-116shrg42251","https://www.govinfo.gov/content/pkg/CHRG-116shrg42251/pdf/CHRG-116shrg42251.pdf","12.0 MB","https://www.govinfo.gov/content/pkg/CHRG-116shrg42251/html/CHRG-116shrg42251.htm","2.0 KB","","0 B","","0 B","","0 B"," BUSINESS MEETING BEFORE THE COMMITTEE ON THE BUDGET UNITED STATES SENATE ONE HUNDRED SIXTEENTH CONGRESS SECOND SESSION June 3, 2020HEARING ON THE NOMINATION OF THE HONORABLE RUSSELL T. VOUGHT, OF VIRGINIA, TO BE DIRECTOR OF THE OF- FICE OF MANAGEMENT AND BUDGET June 11, 2020EXECUTIVE BUSINESS MEETING TO CONSIDER THE NOMINATION OF THE ...","","2020-06-03"
"303","Congressional Hearings","CHRG-116hhrg48994","CHRG-116hhrg48994","Data Privacy and Portability at VA: Protecting Veterans' Personal Data","https://www.govinfo.gov/app/details/CHRG-116hhrg48994/CHRG-116hhrg48994","https://www.govinfo.gov/content/pkg/CHRG-116hhrg48994/pdf/CHRG-116hhrg48994.pdf","2.6 MB","https://www.govinfo.gov/content/pkg/CHRG-116hhrg48994/html/CHRG-116hhrg48994.htm","167.0 KB","","0 B","","0 B","","0 B"," VETERANS' AFFAIRS U.S. HOUSE OF REPRESENTATIVES ONE HUNDRED SIXTEENTH CONGRESS SECOND SESSION WEDNESDAY, FEBRUARY 12, 2020 Serial No. 116-56 Printed for the use of the Committee on Veterans' Affairs [GRAPHIC NOT AVAILABLE IN TIFF FORMAT] Available via http://govinfo.gov U.S. GOVERNMENT PUBLISHING OFFICE 48-994 WASHINGTON : 2023 COMMITTEE ON ...","","2020-02-12"
"304","Congressional Hearings","CHRG-116hhrg39989","CHRG-116hhrg39989","The Crisis in Idlib","https://www.govinfo.gov/app/details/CHRG-116hhrg39989/CHRG-116hhrg39989","https://www.govinfo.gov/content/pkg/CHRG-116hhrg39989/pdf/CHRG-116hhrg39989.pdf","3.1 MB","https://www.govinfo.gov/content/pkg/CHRG-116hhrg39989/html/CHRG-116hhrg39989.htm","83.1 KB","","0 B","","0 B","","0 B"," HOUSE OF REPRESENTATIVES ONE HUNDRED SIXTEENTH CONGRESS SECOND SESSION March 11, 2020 Serial No. 116-104 Printed for the use of the Committee on Foreign Affairs [GRAPHIC(S) NOT AVAILABLE IN TIFF FORMAT] Available: http://www.foreignaffairs.house.gov/, http://docs.house.gov, or http://www.govinfo.gov ______ U.S. GOVERNMENT PUBLISHING OFFICE 39-...","","2020-03-11"
"305","Congressional Hearings","CHRG-116hhrg38875","CHRG-116hhrg38875","Enhancing Patent Diversity for America's Innovators","https://www.govinfo.gov/app/details/CHRG-116hhrg38875/CHRG-116hhrg38875","https://www.govinfo.gov/content/pkg/CHRG-116hhrg38875/pdf/CHRG-116hhrg38875.pdf","32.4 MB","https://www.govinfo.gov/content/pkg/CHRG-116hhrg38875/html/CHRG-116hhrg38875.htm","79.9 KB","","0 B","","0 B","","0 B"," SIXTEENTH CONGRESS SECOND SESSION HEARING HELD JANUARY 15, 2020 [GRAPHIC(S) NOT AVAILABLE IN TIFF FORMAT] Small Business Committee Document Number 116-067 Available via the GPO Website: www.govinfo.gov ENHANCING PATENT DIVERSITY FOR AMERICA'S INNOVATORS ENHANCING PATENT DIVERSITY FOR AMERICA'S INNOVATORS HEARING before the COMMITTEE ON SMALL ...","","2020-01-15"
"306","Congressional Hearings","CHRG-116hhrg48685","CHRG-116hhrg48685","Out of Control: The Impact of Wildfires on Our Power Sector and the Environment","https://www.govinfo.gov/app/details/CHRG-116hhrg48685/CHRG-116hhrg48685","https://www.govinfo.gov/content/pkg/CHRG-116hhrg48685/pdf/CHRG-116hhrg48685.pdf","42.3 MB","https://www.govinfo.gov/content/pkg/CHRG-116hhrg48685/html/CHRG-116hhrg48685.htm","264.9 KB","","0 B","","0 B","","0 B","ON ENVIRONMENT AND CLIMATE CHANGE OF THE COMMITTEE ON ENERGY AND COMMERCE HOUSE OF REPRESENTATIVES ONE HUNDRED SIXTEENTH CONGRESS SECOND SESSION JANUARY 28, 2020 Serial No. 116-91 [GRAPHIC NOT AVAILABLE IN TIFF FORMAT] Printed for the use of the Committee on Energy and Commerce govinfo.gov/committee/house-energy energycommerce.house.gov U.S. ...","","2020-01-28"
"307","Congressional Hearings","CHRG-116hhrg42636","CHRG-116hhrg42636","Oversight of the Civil Rights Division of the Department of Justice","https://www.govinfo.gov/app/details/CHRG-116hhrg42636/CHRG-116hhrg42636","https://www.govinfo.gov/content/pkg/CHRG-116hhrg42636/pdf/CHRG-116hhrg42636.pdf","6.5 MB","https://www.govinfo.gov/content/pkg/CHRG-116hhrg42636/html/CHRG-116hhrg42636.htm","184.8 KB","","0 B","","0 B","","0 B"," OF THE COMMITTEE ON THE JUDICIARY HOUSE OF REPRESENTATIVES ONE HUNDRED SIXTEENTH CONGRESS SECOND SESSION SEPTEMBER 24, 2020 Serial No. 116-88 Printed for the use of the Committee on the Judicary [GRAPHIC NOT AVAILABLE IN TIFF FORMAT] Available http://judiciary.house.gov or www.govinfo.gov U.S. GOVERNMENT PUBLISHING OFFICE 42-636 WASHINGTON : ...","","2020-09-24"
"308","Congressional Hearings","CHRG-116hhrg41184","CHRG-116hhrg41184","F-35 Joint Strike Fighter: Ensuring Safety and Accountability in the Government's Trillion Dollar Investment","https://www.govinfo.gov/app/details/CHRG-116hhrg41184/CHRG-116hhrg41184","https://www.govinfo.gov/content/pkg/CHRG-116hhrg41184/pdf/CHRG-116hhrg41184.pdf","249.4 KB","https://www.govinfo.gov/content/pkg/CHRG-116hhrg41184/html/CHRG-116hhrg41184.htm","171.0 KB","","0 B","","0 B","","0 B"," AND REFORM HOUSE OF REPRESENTATIVES ONE HUNDRED SIXTEENTH CONGRESS SECOND SESSION JULY 22, 2020 Serial No. 116-105 Printed for the use of the Committee on Oversight and Reform [GRAPHIC IS NOT AVAILABLE IN TIFF FORMAT] Available on: govinfo.gov, oversight.house.gov or docs.house.gov U.S. GOVERNMENT PUBLISHING OFFICE 41-184 PDF WASHINGTON : 2020 ...","","2020-07-22"
"309","Congressional Hearings","CHRG-116hhrg43090","CHRG-116hhrg43090","Examining the Threat from Isis and AL-Qaeda","https://www.govinfo.gov/app/details/CHRG-116hhrg43090/CHRG-116hhrg43090","https://www.govinfo.gov/content/pkg/CHRG-116hhrg43090/pdf/CHRG-116hhrg43090.pdf","253.4 KB","https://www.govinfo.gov/content/pkg/CHRG-116hhrg43090/html/CHRG-116hhrg43090.htm","173.5 KB","","0 B","","0 B","","0 B"," HOUSE OF REPRESENTATIVES ONE HUNDRED SIXTEENTH CONGRESS SECOND SESSION JUNE 24, 2020 Serial No. 116-72 Printed for the use of the Committee on Homeland Security [GRAPHIC(S) NOT AVAILABLE IN TIFF FORMAT] Available via the World Wide Web: http://www.govinfo.gov U.S. GOVERNMENT PUBLISHING OFFICE 43-090 PDF WASHINGTON : 2021 COMMITTEE ON HOMELAND ...","","2020-06-24"
"310","Congressional Hearings","CHRG-116hhrg50300","CHRG-116hhrg50300","Hearing on ""Modernizing the Natural Gas Act to Ensure IT Works for Everyone""","https://www.govinfo.gov/app/details/CHRG-116hhrg50300/CHRG-116hhrg50300","https://www.govinfo.gov/content/pkg/CHRG-116hhrg50300/pdf/CHRG-116hhrg50300.pdf","36.5 MB","https://www.govinfo.gov/content/pkg/CHRG-116hhrg50300/html/CHRG-116hhrg50300.htm","272.6 KB","","0 B","","0 B","","0 B"," COMMERCE HOUSE OF REPRESENTATIVES ONE HUNDRED SIXTEENTH CONGRESS SECOND SESSION FEBRUARY 5, 2020 Serial No. 116-95 [GRAPHIC NOT AVAILABLE IN TIFF FORMAT] Printed for the use of the Committee on Energy and Commerce govinfo.gov/committee/house-energy energycommerce.house.gov ______ U.S. GOVERNMENT PUBLISHING OFFICE 50-300 PDF WASHINGTON : 2024 ...","","2020-02-05"
"311","Congressional Hearings","CHRG-116shrg43278","CHRG-116shrg43278","State and Local Cybersecurity: Defending Our Communities from Cyber Threats Amid COVID 19","https://www.govinfo.gov/app/details/CHRG-116shrg43278/CHRG-116shrg43278","https://www.govinfo.gov/content/pkg/CHRG-116shrg43278/pdf/CHRG-116shrg43278.pdf","2.5 MB","https://www.govinfo.gov/content/pkg/CHRG-116shrg43278/html/CHRG-116shrg43278.htm","101.9 KB","","0 B","","0 B","","0 B","SPENDING OVERSIGHT AND EMERGENCY MANAGEMENT of the COMMITTEE ON HOMELAND SECURITY AND GOVERNMENTAL AFFAIRS UNITED STATES SENATE ONE HUNDRED SIXTEENTH CONGRESS SECOND SESSION DECEMBER 2, 2020 Available via http://www.govinfo.gov Printed for the use of the Committee on Homeland Security and Governmental Affairs [GRAPHIC(S) NOT AVAILABLE IN TIFF ...","","2020-12-02"
"312","Congressional Hearings","CHRG-116hhrg40637","CHRG-116hhrg40637","Promesa Implementation During the Coronavirus Pandemic","https://www.govinfo.gov/app/details/CHRG-116hhrg40637/CHRG-116hhrg40637","https://www.govinfo.gov/content/pkg/CHRG-116hhrg40637/pdf/CHRG-116hhrg40637.pdf","601.7 KB","https://www.govinfo.gov/content/pkg/CHRG-116hhrg40637/html/CHRG-116hhrg40637.htm","419.2 KB","","0 B","","0 B","","0 B","HUNDRED SIXTEENTH CONGRESS SECOND SESSION Thursday, June 11, 2020 Serial No. 116-35 Printed for the use of the Committee on Natural Resources [GRAPHIC(S) NOT AVAILABLE IN TIFF FORMAT] Available via the World Wide Web: http://www.govinfo.gov or Committee address: http://naturalresources.house.gov ______ U.S. GOVERNMENT PUBLISHING OFFICE 40-637 PDF ...","","2020-06-11"
"313","Congressional Hearings","CHRG-116hhrg41312","CHRG-116hhrg41312","Biological Research at the Department of Energy: Leveraging Doe's Unique Capabilities to Respond to the COVID-19 Pandemic","https://www.govinfo.gov/app/details/CHRG-116hhrg41312/CHRG-116hhrg41312","https://www.govinfo.gov/content/pkg/CHRG-116hhrg41312/pdf/CHRG-116hhrg41312.pdf","17.5 MB","https://www.govinfo.gov/content/pkg/CHRG-116hhrg41312/html/CHRG-116hhrg41312.htm","101.1 KB","","0 B","","0 B","","0 B"," ON ENERGY OF THE COMMITTEE ON SCIENCE, SPACE, AND TECHNOLOGY HOUSE OF REPRESENTATIVES ONE HUNDRED SIXTEENTH CONGRESS SECOND SESSION SEPTEMBER 11, 2020 Serial No. 116-80 Printed for the use of the Committee on Science, Space, and Technology [GRAPHICS NOT AVAILABLE IN TIFF FORMAT] Available via the World Wide Web: http://science.house.gov U.S. ...","","2020-09-11"
"314","Congressional Hearings","CHRG-116shrg42592","CHRG-116shrg42592","Pending Legislation","https://www.govinfo.gov/app/details/CHRG-116shrg42592/CHRG-116shrg42592","https://www.govinfo.gov/content/pkg/CHRG-116shrg42592/pdf/CHRG-116shrg42592.pdf","228.3 MB","https://www.govinfo.gov/content/pkg/CHRG-116shrg42592/html/CHRG-116shrg42592.htm","104.7 KB","","0 B","","0 B","","0 B"," UNITED STATES SENATE ONE HUNDRED SIXTEENTH CONGRESS SECOND SESSION ON H.R. 823/S. 241 S. 4215 S. 4616 S. 1695 S. 4569 S. 4625 S. 2804 S. 4599 S. 4696 S. 2875 S. 4603 S. 4889 S. 3492 NOVEMBER 18, 2020 [GRAPHIC NOT AVAILABLE IN TIFF FORMAT] Printed for the use of the Committee on Energy and Natural Resources U.S. GOVERNMENT PUBLISHING OFFICE 42-...","","2020-11-18"
