"index","collection","packageId","granuleId","title","detailsLink","pdfLink","pdfSize","htmlLink","htmlSize","xmlLink","xmlSize","otherLink1","other1Size","otherLink2","other2Size","teaser","historical","publishdate"
"315","Congressional Hearings","CHRG-117shrg46184","CHRG-117shrg46184","The Circular Economy as a Concept for Creating a More Sustainable Future","https://www.govinfo.gov/app/details/CHRG-117shrg46184/CHRG-117shrg46184","https://www.govinfo.gov/content/pkg/CHRG-117shrg46184/pdf/CHRG-117shrg46184.pdf","44.2 MB","https://www.govinfo.gov/content/pkg/CHRG-117shrg46184/html/CHRG-117shrg46184.htm","100.6 KB","","0 B","","0 B","","0 B"," UNITED STATES SENATE ONE HUNDRED SEVENTEENTH CONGRESS FIRST SESSION SEPTEMBER 22, 2021 Printed for the use of the Committee on Environment and Public Works [GRAPHIC(S) NOT AVAILABLE IN TIFF FORMAT] Available via the World Wide Web: http://www.govinfo.gov U.S. GOVERNMENT PUBLISHING OFFICE 46-184 WASHINGTON : 2021 COMMITTEE ON ENVIRONMENT AND PUBLIC...","","2021-09-22"
"316","Congressional Hearings","CHRG-117hhrg44562","CHRG-117hhrg44562","Harnessing the Power of Immigrant-Owned Businesses to Build Back Better","https://www.govinfo.gov/app/details/CHRG-117hhrg44562/CHRG-117hhrg44562","https://www.govinfo.gov/content/pkg/CHRG-117hhrg44562/pdf/CHRG-117hhrg44562.pdf","47.0 MB","https://www.govinfo.gov/content/pkg/CHRG-117hhrg44562/html/CHRG-117hhrg44562.htm","109.8 KB","","0 B","","0 B","","0 B"," ONE HUNDRED SEVENTEENTH CONGRESS FIRST SESSION HEARING HELD APRIL 28, 2021 [GRAPHIC NOT AVAILABLE IN TIFF FORMAT] Small Business Committee Document Number 117-009 Available via the GPO Website: www.govinfo.gov U.S. GOVERNMENT PUBLISHING OFFICE 44-562 WASHINGTON : 2021 HOUSE COMMITTEE ON SMALL BUSINESS NYDIA VELAZQUEZ, New York, Chairwoman ...","","2021-04-28"
"317","Congressional Hearings","CHRG-117shrg59451","CHRG-117shrg59451","Department of Defense Support to the COVID-19 Response","https://www.govinfo.gov/app/details/CHRG-117shrg59451/CHRG-117shrg59451","https://www.govinfo.gov/content/pkg/CHRG-117shrg59451/pdf/CHRG-117shrg59451.pdf","327.3 KB","https://www.govinfo.gov/content/pkg/CHRG-117shrg59451/html/CHRG-117shrg59451.htm","316.8 KB","","0 B","","0 B","","0 B"," SEVENTEENTH CONGRESS FIRST SESSION FEBRUARY 25, 2021 Printed for the use of the Committee on Armed Services [GRAPHIC NOT AVAILABLE IN TIFF FORMAT] Available via: http://www.govinfo.gov U.S. GOVERNMENT PUBLISHING OFFICE 59-451 PDF WASHINGTON : 2025 COMMITTEE ON ARMED SERVICES JACK REED, Rhode Island, Chairman JAMES M. INHOFE, Oklahoma JEANNE ...","","2021-02-25"
"318","Congressional Hearings","CHRG-117shrg39104973","CHRG-117shrg39104973","Transportation, Housing and Urban Development, and Related Agencies Appropriations for Fiscal Year 2022","https://www.govinfo.gov/app/details/CHRG-117shrg39104973/CHRG-117shrg39104973","https://www.govinfo.gov/content/pkg/CHRG-117shrg39104973/pdf/CHRG-117shrg39104973.pdf","175.6 KB","https://www.govinfo.gov/content/pkg/CHRG-117shrg39104973/html/CHRG-117shrg39104973.htm","99.8 KB","","0 B","","0 B","","0 B"," of the Committee on Appropriations, Washington, DC. The committee met at 2:32 p.m., in room SD-192, Dirksen Senate Office Building, Hon. Brian Schatz (chairman) presiding. Present: Senators Schatz, Reed, Murray, Coons, Van Hollen, Collins, Boozman, Hoeven, Kennedy, and Braun. DEPARTMENT OF TRANSPORTATION STATEMENT OF HON. PETE BUTTIGIEG, ...","","2021-06-16"
"319","Congressional Hearings","CHRG-117shrg52997","CHRG-117shrg52997","Oversight of the U.S. Securities and Exchange Commission","https://www.govinfo.gov/app/details/CHRG-117shrg52997/CHRG-117shrg52997","https://www.govinfo.gov/content/pkg/CHRG-117shrg52997/pdf/CHRG-117shrg52997.pdf","4.3 MB","https://www.govinfo.gov/content/pkg/CHRG-117shrg52997/html/CHRG-117shrg52997.htm","282.0 KB","","0 B","","0 B","","0 B"," SENATE ONE HUNDRED SEVENTEENTH CONGRESS FIRST SESSION ON EXAMINING OVERSIGHT OF THE U.S. SECURITIES AND EXCHANGE COMMISSION SEPTEMBER 14, 2021 Printed for the use of the Committee on Banking, Housing, and Urban Affairs [GRAPHIC NOT AVAILABLE IN TIFF FORMAT] Available at: https: //www.govinfo.gov / U.S. GOVERNMENT PUBLISHING OFFICE 52-997 PDF ...","","2021-09-14"
"320","Congressional Hearings","CHRG-117shrg47001","CHRG-117shrg47001","A Review of the Sbir-Sttr Program","https://www.govinfo.gov/app/details/CHRG-117shrg47001/CHRG-117shrg47001","https://www.govinfo.gov/content/pkg/CHRG-117shrg47001/pdf/CHRG-117shrg47001.pdf","31.8 MB","https://www.govinfo.gov/content/pkg/CHRG-117shrg47001/html/CHRG-117shrg47001.htm","66.2 KB","","0 B","","0 B","","0 B"," HUNDRED SEVENTEENTH CONGRESS FIRST SESSION SEPTEMBER 22, 2021 Printed for the Committee on Small Business and Entrepreneurship [GRAPHIC NOT AVAILABLE IN TIFF FORMAT] Available via the World Wide Web: http://www.govinfo.gov U.S. GOVERNMENT PUBLISHING OFFICE 47-001 PDF WASHINGTON : 2025 COMMITTEE ON SMALL BUSINESS AND ENTREPRENEURSHIP ONE HUNDRED ...","","2021-09-22"
"321","Congressional Hearings","CHRG-117hhrg45496","CHRG-117hhrg45496","Afghanistan 2001-2021: Evaluating the Withdrawal and U.S. Policies Part 1","https://www.govinfo.gov/app/details/CHRG-117hhrg45496/CHRG-117hhrg45496","https://www.govinfo.gov/content/pkg/CHRG-117hhrg45496/pdf/CHRG-117hhrg45496.pdf","13.0 MB","https://www.govinfo.gov/content/pkg/CHRG-117hhrg45496/html/CHRG-117hhrg45496.htm","309.1 KB","","0 B","","0 B","","0 B"," HUNDRED SEVENTEENTH CONGRESS SECOND SESSION SEPTEMBER 13, 2021 Serial No. 117-73 Printed for the use of the Committee on Foreign Affairs [GRAPHIC NOT AVAILABLE IN TIFF FORMAT] Available: http://www.foreignaffairs.house.gov/, http:// docs.house.gov, or http://www.govinfo.gov U.S. GOVERNMENT PUBLISHING OFFICE 45-496PDF WASHINGTON : 2023 COMMITTEE ...","","2021-09-13"
"322","Congressional Hearings","CHRG-117hhrg47086","CHRG-117hhrg47086","OH, Canada! How Outdated U.S. Immigration Policies Push Top Talent to Other Countries","https://www.govinfo.gov/app/details/CHRG-117hhrg47086/CHRG-117hhrg47086","https://www.govinfo.gov/content/pkg/CHRG-117hhrg47086/pdf/CHRG-117hhrg47086.pdf","189.1 MB","https://www.govinfo.gov/content/pkg/CHRG-117hhrg47086/html/CHRG-117hhrg47086.htm","92.8 KB","","0 B","","0 B","","0 B","OF THE COMMITTEE ON THE JUDICIARY U.S. HOUSE OF REPRESENTATIVES ONE HUNDRED SEVENTEENTH CONGRESS FIRST SESSION TUESDAY, JULY 13, 2021 Serial No. 117-34 Printed for the use of the Committee on the Judiciary [GRAPHIC NOT AVAILABLE IN TIFF FORMAT] Available via: http://judiciary.house.gov U.S. GOVERNMENT PUBLISHING OFFICE 47-086 PDF WASHINGTON : 2022 ...","","2021-07-13"
"323","Congressional Hearings","CHRG-117shrg45380","CHRG-117shrg45380","Richmond, Stachelberg, and Berhe Nominations","https://www.govinfo.gov/app/details/CHRG-117shrg45380/CHRG-117shrg45380","https://www.govinfo.gov/content/pkg/CHRG-117shrg45380/pdf/CHRG-117shrg45380.pdf","3.3 MB","https://www.govinfo.gov/content/pkg/CHRG-117shrg45380/html/CHRG-117shrg45380.htm","118.6 KB","","0 B","","0 B","","0 B"," SEVENTEENTH CONGRESS FIRST SESSION to CONSIDER THE NOMINATIONS OF GERALDINE RICHMOND TO BE UNDER SECRETARY FOR SCIENCE, DEPARTMENT OF ENERGY; CYNTHIA WEINER STACHELBERG TO BE AN ASSISTANT SECRETARY OF THE INTERIOR (POLICY, MANAGEMENT, AND BUDGET); AND ASMERET ASEFAW BERHE TO BE DIRECTOR OF THE OFFICE OF SCIENCE, DEPARTMENT OF ENERGY AUGUST 3,...","","2021-08-03"
"324","Congressional Hearings","CHRG-117shrg29104954","CHRG-117shrg29104954","Energy and Water Development Appropriations for Fiscal Year 2022","https://www.govinfo.gov/app/details/CHRG-117shrg29104954/CHRG-117shrg29104954","https://www.govinfo.gov/content/pkg/CHRG-117shrg29104954/pdf/CHRG-117shrg29104954.pdf","211.7 KB","https://www.govinfo.gov/content/pkg/CHRG-117shrg29104954/html/CHRG-117shrg29104954.htm","145.9 KB","","0 B","","0 B","","0 B",", Washington, DC. The subcommittee met at 10:01 a.m. in room SD-192, Dirksen Senate Office Building, Hon. Dianne Feinstein (chairman) presiding. Present: Senators Feinstein, Murray, Shaheen, Merkley, Coons, Kennedy, Hoeven, Hyde-Smith, and Hagerty. DEPARTMENT OF ENERGY Office of the Secretary STATEMENT OF HON. JENNIFER GRANHOLM, SECRETARY ...","","2021-06-23"
"325","Congressional Hearings","CHRG-117hhrg45619","CHRG-117hhrg45619","[H.A.S.C. No. 117-39] Hearing on National Defense Authorization Act for Fiscal Year 2022 and Oversight of Previously Authorized Programs Before the Committee on Armed Services House of Representatives One Hundred Seventeenth Congress First Session","https://www.govinfo.gov/app/details/CHRG-117hhrg45619/CHRG-117hhrg45619","https://www.govinfo.gov/content/pkg/CHRG-117hhrg45619/pdf/CHRG-117hhrg45619.pdf","473.7 KB","https://www.govinfo.gov/content/pkg/CHRG-117hhrg45619/html/CHRG-117hhrg45619.htm","125.8 KB","","0 B","","0 B","","0 B"," ON ARMED SERVICES HOUSE OF REPRESENTATIVES ONE HUNDRED SEVENTEENTH CONGRESS FIRST SESSION SUBCOMMITTEE ON TACTICAL AIR AND LAND FORCES HEARING ON FISCAL YEAR 2022 ARMY AND MARINE CORPS GROUND SYSTEMS MODERNIZATION PROGRAMS HEARING HELD JUNE 7, 2021 [GRAPHIC(S) NOT AVAILABLE IN TIFF FORMAT] ______ U.S. GOVERNMENT PUBLISHING OFFICE 45-619 ...","","2021-06-07"
"326","Congressional Hearings","CHRG-117hhrg44563","CHRG-117hhrg44563","Supply Chain Resiliency and the Role of Small Manufacturers","https://www.govinfo.gov/app/details/CHRG-117hhrg44563/CHRG-117hhrg44563","https://www.govinfo.gov/content/pkg/CHRG-117hhrg44563/pdf/CHRG-117hhrg44563.pdf","63.3 MB","https://www.govinfo.gov/content/pkg/CHRG-117hhrg44563/html/CHRG-117hhrg44563.htm","66.5 KB","","0 B","","0 B","","0 B"," ON SMALL BUSINESS UNITED STATES HOUSE OF REPRESENTATIVES ONE HUNDRED SEVENTEENTH CONGRESS FIRST SESSION HEARING HELD APRIL 29, 2021 [GRAPHICS NOT AVAILABLE IN TIFF FORMAT] Small Business Committee Document Number 117-010 Available via the GPO Website: www.govinfo.gov U.S. GOVERNMENT PUBLISHING OFFICE 44-563 WASHINGTON : 2020 HOUSE COMMITTEE ON ...","","2021-04-29"
"327","Congressional Hearings","CHRG-117hhrg47125","CHRG-117hhrg47125","Agricultural Biotechnology: 21st Century Advancements and Applications","https://www.govinfo.gov/app/details/CHRG-117hhrg47125/CHRG-117hhrg47125","https://www.govinfo.gov/content/pkg/CHRG-117hhrg47125/pdf/CHRG-117hhrg47125.pdf","338.1 KB","https://www.govinfo.gov/content/pkg/CHRG-117hhrg47125/html/CHRG-117hhrg47125.htm","256.0 KB","","0 B","","0 B","","0 B"," THE SUBCOMMITTEE ON BIOTECHNOLOGY, HORTICULTURE, AND RESEARCH OF THE HOUSE OF REPRESENTATIVES ONE HUNDRED SEVENTEENTH CONGRESS FIRST SESSION OCTOBER 26, 2021 Serial No. 117-19 Printed for the use of the Committee on Agriculture agriculture.house.gov [GRAPHIC NOT AVAILABLE IN TIFF FORMAT] _________ U.S. GOVERNMENT PUBLISHING OFFICE 47-125 ...","","2021-10-26"
"328","Congressional Hearings","CHRG-117hhrg46890","CHRG-117hhrg46890","""Why Don't They Just Get in Line?"". Barriers to Legal Immigration","https://www.govinfo.gov/app/details/CHRG-117hhrg46890/CHRG-117hhrg46890","https://www.govinfo.gov/content/pkg/CHRG-117hhrg46890/pdf/CHRG-117hhrg46890.pdf","77.5 MB","https://www.govinfo.gov/content/pkg/CHRG-117hhrg46890/html/CHRG-117hhrg46890.htm","116.8 KB","","0 B","","0 B","","0 B"," THE JUDICIARY U.S. HOUSE OF REPRESENTATIVES ONE HUNDRED SEVENTEENTH CONGRESS FIRST SESSION WEDNESDAY, APRIL 28, 2021 Serial No. 117-18 Printed for the use of the Committee on the Judiciary [GRAPHIC NOT AVAILABLE IN TIFF FORMAT] Available via: http://judiciary.house.gov U.S. GOVERNMENT PUBLISHING OFFICE 46-890 WASHINGTON : 2022 COMMITTEE ON THE ...","","2021-04-28"
"329","Congressional Hearings","CHRG-117hhrg45131","CHRG-117hhrg45131","Wealth for the Working Class: The Clean Energy Economy","https://www.govinfo.gov/app/details/CHRG-117hhrg45131/CHRG-117hhrg45131","https://www.govinfo.gov/content/pkg/CHRG-117hhrg45131/pdf/CHRG-117hhrg45131.pdf","19.8 MB","https://www.govinfo.gov/content/pkg/CHRG-117hhrg45131/html/CHRG-117hhrg45131.htm","96.8 KB","","0 B","","0 B","","0 B","THE COMMITTEE ON SMALL BUSINESS UNITED STATES HOUSE OF REPRESENTATIVES ONE HUNDRED SEVENTEENTH CONGRESS FIRST SESSION HEARING HELD JULY 27, 2021 [GRAPHIC NOT AVAILABLE IN TIFF FORMAT] Small Business Committee Document Number 117-028 Available via the GPO Website: www.govinfo.gov U.S. GOVERNMENT PUBLISHING OFFICE 45-131 WASHINGTON : 2021 HOUSE ...","","2021-07-27"
"330","Congressional Hearings","CHRG-117hhrg48808","CHRG-117hhrg48808","Oversight of the United States Department of Justice","https://www.govinfo.gov/app/details/CHRG-117hhrg48808/CHRG-117hhrg48808","https://www.govinfo.gov/content/pkg/CHRG-117hhrg48808/pdf/CHRG-117hhrg48808.pdf","354.7 MB","https://www.govinfo.gov/content/pkg/CHRG-117hhrg48808/html/CHRG-117hhrg48808.htm","290.6 KB","","0 B","","0 B","","0 B"," CONGRESS FIRST SESSION THURSDAY, OCTOBER 21, 2021 Serial No. 117-42 Printed for the use of the Committee on the Judiciary [GRAPHIC NOT AVAILABLE IN TIFF FORMAT] Available via: http://judiciary.house.gov U.S. GOVERNMENT PUBLISHING OFFICE 48-808 WASHINGTON : 2022 COMMITTEE ON THE JUDICIARY JERROLD NADLER, New York, Chair MADELEINE DEAN, ...","","2021-10-21"
"331","Congressional Hearings","CHRG-117hhrg56897","CHRG-117hhrg56897","The Future of Biomedicine: Translating Biomedical Research into Personalized Health Care","https://www.govinfo.gov/app/details/CHRG-117hhrg56897/CHRG-117hhrg56897","https://www.govinfo.gov/content/pkg/CHRG-117hhrg56897/pdf/CHRG-117hhrg56897.pdf","54.6 MB","https://www.govinfo.gov/content/pkg/CHRG-117hhrg56897/html/CHRG-117hhrg56897.htm","202.0 KB","","0 B","","0 B","","0 B"," ON ENERGY AND COMMERCE HOUSE OF REPRESENTATIVES ONE HUNDRED SEVENTEENTH CONGRESS FIRST SESSION DECEMBER 8, 2021 Serial No. 117-60 GRAPHIC(S) NOT AVAILABLE IN TIFF FORMAT Published for the use of the Committee on Energy and Commerce govinfo.gov/committee/house-energy energycommerce.house.gov _______ U.S. GOVERNMENT PUBLISHING OFFICE 56-897PDF ...","","2021-12-08"
"332","Congressional Hearings","CHRG-117shrg54184","CHRG-117shrg54184","Nomination to the Federal Maritime Commission, Department of Transportation, and the Department of Commerce","https://www.govinfo.gov/app/details/CHRG-117shrg54184/CHRG-117shrg54184","https://www.govinfo.gov/content/pkg/CHRG-117shrg54184/pdf/CHRG-117shrg54184.pdf","14.7 MB","https://www.govinfo.gov/content/pkg/CHRG-117shrg54184/html/CHRG-117shrg54184.htm","406.6 KB","","0 B","","0 B","","0 B"," ON COMMERCE, SCIENCE, AND TRANSPORTATION UNITED STATES SENATE ONE HUNDRED SEVENTEENTH CONGRESS FIRST SESSION OCTOBER 20, 2021 Printed for the use of the Committee on Commerce, Science, and Transportation [GRAPHIC(S) NOT AVAILABLE IN TIFF FORMAT] Available online: http://www.govinfo.gov ______ U.S. GOVERNMENT PUBLISHING OFFICE 54-184-PDF ...","","2021-10-20"
"333","Congressional Hearings","CHRG-117hhrg46377","CHRG-117hhrg46377","Worldwide Threats to the Homeland: 20 Years After 9/11","https://www.govinfo.gov/app/details/CHRG-117hhrg46377/CHRG-117hhrg46377","https://www.govinfo.gov/content/pkg/CHRG-117hhrg46377/pdf/CHRG-117hhrg46377.pdf","532.0 KB","https://www.govinfo.gov/content/pkg/CHRG-117hhrg46377/html/CHRG-117hhrg46377.htm","355.7 KB","","0 B","","0 B","","0 B"," CONGRESS FIRST SESSION SEPTEMBER 22, 2021 Serial No. 117-29 Printed for the use of the Committee on Homeland Security [GRAPHIC(S) NOT AVAILABLE IN TIFF FORMAT] Available via the World Wide Web: http://www.govinfo.gov U.S. GOVERNMENT PUBLISHING OFFICE 46-377 WASHINGTON : 2021 COMMITTEE ON HOMELAND SECURITY Bennie G. Thompson, Mississippi, ...","","2021-09-22"
"334","Congressional Hearings","CHRG-117hhrg45751","CHRG-117hhrg45751","Securing the Homeland: Reforming DHS to Meet Today's Threats","https://www.govinfo.gov/app/details/CHRG-117hhrg45751/CHRG-117hhrg45751","https://www.govinfo.gov/content/pkg/CHRG-117hhrg45751/pdf/CHRG-117hhrg45751.pdf","1.5 MB","https://www.govinfo.gov/content/pkg/CHRG-117hhrg45751/html/CHRG-117hhrg45751.htm","258.0 KB","","0 B","","0 B","","0 B"," CONGRESS FIRST SESSION JULY 15, 2021 Serial No. 117-22 Printed for the use of the Committee on Homeland Security [GRAPHIC NOT AVAILABLE IN TIFF FORMAT] Available via the World Wide Web: http://www.govinfo.gov U.S. GOVERNMENT PUBLISHING OFFICE 45-751 PDF WASHINGTON : 2021 COMMITTEE ON HOMELAND SECURITY Bennie G. Thompson, Mississippi, ...","","2021-07-15"
"335","Congressional Hearings","CHRG-117shrg47353","CHRG-117shrg47353","Update on U.S.-Russia Policy","https://www.govinfo.gov/app/details/CHRG-117shrg47353/CHRG-117shrg47353","https://www.govinfo.gov/content/pkg/CHRG-117shrg47353/pdf/CHRG-117shrg47353.pdf","904.4 KB","https://www.govinfo.gov/content/pkg/CHRG-117shrg47353/html/CHRG-117shrg47353.htm","127.0 KB","","0 B","","0 B","","0 B","FIRST SESSION DECEMBER 7, 2021 Printed for the use of the Committee on Foreign Relations [GRAPHIC NOT AVAILABLE IN TIFF FORMAT] Available via http://www.govinfo.gov U.S. GOVERNMENT PUBLISHING OFFICE 47-353 PDF WASHINGTON : 2022 COMMITTEE ON FOREIGN RELATIONS ROBERT MENENDEZ, New Jersey, Chairman BENJAMIN L. CARDIN, Maryland JAMES E. RISCH, Idaho ...","","2021-12-07"
"336","Congressional Hearings","CHRG-117shrg39104011","CHRG-117shrg39104011","Commerce, Justice, Science, and Related Agencies Appropriations for Fiscal Year 2022","https://www.govinfo.gov/app/details/CHRG-117shrg39104011/CHRG-117shrg39104011","https://www.govinfo.gov/content/pkg/CHRG-117shrg39104011/pdf/CHRG-117shrg39104011.pdf","159.0 KB","https://www.govinfo.gov/content/pkg/CHRG-117shrg39104011/html/CHRG-117shrg39104011.htm","89.9 KB","","0 B","","0 B","","0 B"," on Appropriations, Washington, DC. The subcommittee met at 2:07 p.m., in room SD-192, Dirksen Senate Office Building, Hon. Jeanne Shaheen (Chairwoman) presiding. Present: Senators Shaheen, Manchin, Van Hollen, Moran, Boozman, Capito, Kennedy, and Braun. NATIONAL AERONAUTICS AND SPACE ADMINISTRATION OPENING STATEMENT OF SENATOR JEANNE SHAHEEN ...","","2021-06-15"
"337","Congressional Hearings","CHRG-117shrg48180","CHRG-117shrg48180","Nominations of Matthew Axelrod, Alanna Mccargo, James Arthur Jemison II, and Mark Colon","https://www.govinfo.gov/app/details/CHRG-117shrg48180/CHRG-117shrg48180","https://www.govinfo.gov/content/pkg/CHRG-117shrg48180/pdf/CHRG-117shrg48180.pdf","4.1 MB","https://www.govinfo.gov/content/pkg/CHRG-117shrg48180/html/CHRG-117shrg48180.htm","260.7 KB","","0 B","","0 B","","0 B",",AND URBAN AFFAIRS UNITED STATES SENATE ONE HUNDRED SEVENTEENTH CONGRESS FIRST SESSION ON NOMINATIONS OF: MATTHEW AXELROD, TO BE AN ASSISTANT SECRETARY OF COMMERCE ALANNA MCCARGO, TO BE PRESIDENT, GOVERNMENT NATIONAL MORTGAGE ASSOCIATION, DEPARTMENT OF HOUSING AND URBAN DEVELOPMENT JAMES ARTHUR JEMISON II, TO BE AN ASSISTANT SECRETARY OF HOUSING ...","","2021-10-07"
"338","Congressional Hearings","CHRG-117shrg29104949","CHRG-117shrg29104949","Department of Defense Appropriations for Fiscal Year 2022","https://www.govinfo.gov/app/details/CHRG-117shrg29104949/CHRG-117shrg29104949","https://www.govinfo.gov/content/pkg/CHRG-117shrg29104949/pdf/CHRG-117shrg29104949.pdf","219.4 KB","https://www.govinfo.gov/content/pkg/CHRG-117shrg29104949/html/CHRG-117shrg29104949.htm","164.6 KB","","0 B","","0 B","","0 B",", DC. The subcommittee met at 10 a.m., in room 192, Dirksen Senate Office Building, Hon. Jon Tester (chairman) presiding. Present: Senators Tester, Leahy, Baldwin, Shaheen, Shelby, Murkowski, Blunt, Moran, Hoeven, and Boozman. DEPARTMENT OF DEFENSE Department of the Army Office of the Secretary STATEMENT OF HON. CHRISTINE E. WORMUTH, SECRETARY ...","","2021-06-22"
"339","Congressional Hearings","CHRG-117hhrg44393","CHRG-117hhrg44393","Confronting the Coronavirus: Perspectives on the COVID-19 Pandemic One Year Later","https://www.govinfo.gov/app/details/CHRG-117hhrg44393/CHRG-117hhrg44393","https://www.govinfo.gov/content/pkg/CHRG-117hhrg44393/pdf/CHRG-117hhrg44393.pdf","4.2 MB","https://www.govinfo.gov/content/pkg/CHRG-117hhrg44393/html/CHRG-117hhrg44393.htm","327.7 KB","","0 B","","0 B","","0 B"," ONE HUNDRED SEVENTEENTH CONGRESS FIRST SESSION FEBRUARY 24, 2021 Serial No. 117-3 Printed for the use of the Committee on Homeland Security [GRAPHIC NOT AVAILABLE IN TIFF FORMAT] Available via the World Wide Web: http://www.govinfo.gov U.S. GOVERNMENT PUBLISHING OFFICE 44-393 PDF WASHINGTON : 2021 COMMITTEE ON HOMELAND SECURITY Bennie G. ...","","2021-02-24"
"340","Congressional Hearings","CHRG-117hhrg46102","CHRG-117hhrg46102","Fostering a New Era of Fusion Energy Research and Technology Development","https://www.govinfo.gov/app/details/CHRG-117hhrg46102/CHRG-117hhrg46102","https://www.govinfo.gov/content/pkg/CHRG-117hhrg46102/pdf/CHRG-117hhrg46102.pdf","5.1 MB","https://www.govinfo.gov/content/pkg/CHRG-117hhrg46102/html/CHRG-117hhrg46102.htm","159.6 KB","","0 B","","0 B","","0 B",", AND TECHNOLOGY OF THE HOUSE OF REPRESENTATIVES ONE HUNDRED SEVENTEENTH CONGRESS FIRST SESSION NOVEMBER 17, 2021 Serial No. 117-38 Printed for the use of the Committee on Science, Space, and Technology [GRAPHIC NOT AVAILABLE IN TIFF FORMAT] Available via the World Wide Web: http://science.house.gov U.S. GOVERNMENT PUBLISHING OFFICE 46-102PDF ...","","2021-11-17"
"341","Congressional Hearings","CHRG-117hhrg44669","CHRG-117hhrg44669","10 Years of War: Examining the Ongoing Conflict in Syria","https://www.govinfo.gov/app/details/CHRG-117hhrg44669/CHRG-117hhrg44669","https://www.govinfo.gov/content/pkg/CHRG-117hhrg44669/pdf/CHRG-117hhrg44669.pdf","5.6 MB","https://www.govinfo.gov/content/pkg/CHRG-117hhrg44669/html/CHRG-117hhrg44669.htm","129.4 KB","","0 B","","0 B","","0 B"," THE COMMITTEE ON FOREIGN AFFAIRS HOUSE OF REPRESENTATIVES ONE HUNDRED SEVENTEENTH CONGRESS FIRST SESSION APRIL 15, 2021 Serial No. 117-29 Printed for the use of the Committee on Foreign Affairs [GRAPHIC(S) NOT AVAILABLE IN TIFF FORMAT] Available: http://www.foreignaffairs.house.gov/, http://docs.house.gov, or http://www.govinfo.gov ______ U.S. ...","","2021-04-15"
"342","Congressional Hearings","CHRG-117hhrg45372","CHRG-117hhrg45372","Oversight of Pandemic Evictions: Assessing Abuses by Corporate Landlords and Federal Efforts to Keep Americans in Their Homes","https://www.govinfo.gov/app/details/CHRG-117hhrg45372/CHRG-117hhrg45372","https://www.govinfo.gov/content/pkg/CHRG-117hhrg45372/pdf/CHRG-117hhrg45372.pdf","199.0 KB","https://www.govinfo.gov/content/pkg/CHRG-117hhrg45372/html/CHRG-117hhrg45372.htm","110.1 KB","","0 B","","0 B","","0 B"," SUBCOMMITTEE ON THE CORONAVIRUS CRISIS OF THE COMMITTEE ON OVERSIGHT AND REFORM HOUSE OF REPRESENTATIVES ONE HUNDRED SEVENTEENTH CONGRESS FIRST SESSION JULY 27, 2021 Serial No. 117-37 Printed for the use of the Committee on Oversight and Reform [GRAPHIC NOT AVAILABLE IN TIFF FORMAT] Available at: govinfo.gov, oversight.house.gov or ...","","2021-07-27"
"343","Congressional Hearings","CHRG-117shrg46782","CHRG-117shrg46782","Next Steps: The Road Ahead for the COVID-19 Response","https://www.govinfo.gov/app/details/CHRG-117shrg46782/CHRG-117shrg46782","https://www.govinfo.gov/content/pkg/CHRG-117shrg46782/pdf/CHRG-117shrg46782.pdf","602.2 MB","https://www.govinfo.gov/content/pkg/CHRG-117shrg46782/html/CHRG-117shrg46782.htm","271.4 KB","","0 B","","0 B","","0 B"," SENATE ONE HUNDRED SEVENTEENTH CONGRESS FIRST SESSION ON EXAMINING THE ROAD AHEAD FOR THE COVID-19 RESPONSE, FOCUSING ON NEXT STEPS NOVEMBER 4, 2021 Printed for the use of the Committee on Health, Education, Labor, and Pensions [GRAPHIC NOT AVAILABLE IN TIFF FORMAT] Available via the World Wide Web: http://www.govinfo.gov U.S. GOVERNMENT ...","","2021-11-04"
"344","Congressional Hearings","CHRG-117hhrg47367","CHRG-117hhrg47367","[H.A.S.C. No. 117-15] Special Operations Forces Culture and Climate: The Future of the Force","https://www.govinfo.gov/app/details/CHRG-117hhrg47367/CHRG-117hhrg47367","https://www.govinfo.gov/content/pkg/CHRG-117hhrg47367/pdf/CHRG-117hhrg47367.pdf","1.0 MB","https://www.govinfo.gov/content/pkg/CHRG-117hhrg47367/html/CHRG-117hhrg47367.htm","132.3 KB","","0 B","","0 B","","0 B"," OPERATIONS OF THE COMMITTEE ON ARMED SERVICES HOUSE OF REPRESENTATIVES ONE HUNDRED SEVENTEENTH CONGRESS FIRST SESSION HEARING HELD MARCH 26, 2021 [GRAPHIC(S) NOT AVAILABLE IN TIFF FORMAT] ______ U.S. GOVERNMENT PUBLISHING OFFICE 47-367 WASHINGTON : 2022 SUBCOMMITTEE ON INTELLIGENCE AND SPECIAL OPERATIONS RUBEN GALLEGO, Arizona, Chairman RICK ...","","2021-03-26"
"345","Congressional Hearings","CHRG-117shrg52157","CHRG-117shrg52157","Cares Act Oversight of the Treasury and Federal Reserve: Supporting an Equitable Pandemic Recovery","https://www.govinfo.gov/app/details/CHRG-117shrg52157/CHRG-117shrg52157","https://www.govinfo.gov/content/pkg/CHRG-117shrg52157/pdf/CHRG-117shrg52157.pdf","15.1 MB","https://www.govinfo.gov/content/pkg/CHRG-117shrg52157/html/CHRG-117shrg52157.htm","165.2 KB","","0 B","","0 B","","0 B",",HOUSING,AND URBAN AFFAIRS UNITED STATES SENATE ONE HUNDRED SEVENTEENTH CONGRESS FIRST SESSION ON EXAMINING TESTIMONY FROM THE SECRETARY OF THE TREASURY AND THE CHAIRMAN OF THE FEDERAL RESERVE, AS REQUIRED UNDER TITLE IV OF THE CARES ACT SEPTEMBER 28, 2021 Printed for the use of the Committee on Banking, Housing, and Urban Affairs [GRAPHIC NOT...","","2021-09-28"
